[I 2025-01-14 14:38:40,926] Trial 32 finished with value: 2699.28515625 and parameters: {'n_pool_kernel_size': [2, 2, 1], 'n_freq_downsample': [24, 12, 1], 'learning_rate': 0.00010050005337930657, 'scaler_type': None, 'max_steps': 500.0, 'batch_size': 64, 'windows_batch_size': 256, 'random_seed': 15, 'input_size': 24, 'step_size': 1}. Best is trial 23 with value: 2392.640380859375.
[rank: 0] Seed set to 10
GPU available: True (cuda), used: True
TPU available: False, using: 0 TPU cores
HPU available: False, using: 0 HPUs
LOCAL_RANK: 0 - CUDA_VISIBLE_DEVICES: [0,1,2,3,4,5,6,7]

  | Name         | Type          | Params | Mode 
-------------------------------------------------------
0 | loss         | RMSE          | 0      | train
1 | padder_train | ConstantPad1d | 0      | train
2 | scaler       | TemporalNorm  | 0      | train
3 | blocks       | ModuleList    | 2.5 M  | train
-------------------------------------------------------
2.5 M     Trainable params
0         Non-trainable params
2.5 M     Total params
9.812     Total estimated model params size (MB)
34        Modules in train mode
0         Modules in eval mode
SLURM auto-requeueing enabled. Setting signal handlers.
`Trainer.fit` stopped: `max_steps=600.0` reached.
[I 2025-01-14 14:38:51,494] Trial 33 finished with value: 2412.697265625 and parameters: {'n_pool_kernel_size': [1, 1, 1], 'n_freq_downsample': [24, 12, 1], 'learning_rate': 0.0001623314595760979, 'scaler_type': None, 'max_steps': 600.0, 'batch_size': 64, 'windows_batch_size': 256, 'random_seed': 10, 'input_size': 24, 'step_size': 1}. Best is trial 23 with value: 2392.640380859375.
[rank: 0] Seed set to 10
GPU available: True (cuda), used: True
TPU available: False, using: 0 TPU cores
HPU available: False, using: 0 HPUs
LOCAL_RANK: 0 - CUDA_VISIBLE_DEVICES: [0,1,2,3,4,5,6,7]

  | Name         | Type          | Params | Mode 
-------------------------------------------------------
0 | loss         | RMSE          | 0      | train
1 | padder_train | ConstantPad1d | 0      | train
2 | scaler       | TemporalNorm  | 0      | train
3 | blocks       | ModuleList    | 2.7 M  | train
-------------------------------------------------------
2.7 M     Trainable params
0         Non-trainable params
2.7 M     Total params
10.696    Total estimated model params size (MB)
34        Modules in train mode
0         Modules in eval mode
SLURM auto-requeueing enabled. Setting signal handlers.
`Trainer.fit` stopped: `max_steps=600.0` reached.
[I 2025-01-14 14:39:01,880] Trial 34 finished with value: 2813.3427734375 and parameters: {'n_pool_kernel_size': [1, 1, 1], 'n_freq_downsample': [168, 24, 1], 'learning_rate': 0.00016680673380163027, 'scaler_type': None, 'max_steps': 600.0, 'batch_size': 64, 'windows_batch_size': 256, 'random_seed': 10, 'input_size': 96, 'step_size': 1}. Best is trial 23 with value: 2392.640380859375.
[rank: 0] Seed set to 12
GPU available: True (cuda), used: True
TPU available: False, using: 0 TPU cores
HPU available: False, using: 0 HPUs
LOCAL_RANK: 0 - CUDA_VISIBLE_DEVICES: [0,1,2,3,4,5,6,7]

  | Name         | Type          | Params | Mode 
-------------------------------------------------------
0 | loss         | RMSE          | 0      | train
1 | padder_train | ConstantPad1d | 0      | train
2 | scaler       | TemporalNorm  | 0      | train
3 | blocks       | ModuleList    | 2.5 M  | train
-------------------------------------------------------
2.5 M     Trainable params
0         Non-trainable params
2.5 M     Total params
9.812     Total estimated model params size (MB)
34        Modules in train mode
0         Modules in eval mode
SLURM auto-requeueing enabled. Setting signal handlers.
`Trainer.fit` stopped: `max_steps=700.0` reached.
[I 2025-01-14 14:39:14,240] Trial 35 finished with value: 2636.173828125 and parameters: {'n_pool_kernel_size': [1, 1, 1], 'n_freq_downsample': [24, 12, 1], 'learning_rate': 0.0003103970476121371, 'scaler_type': None, 'max_steps': 700.0, 'batch_size': 64, 'windows_batch_size': 512, 'random_seed': 12, 'input_size': 24, 'step_size': 1}. Best is trial 23 with value: 2392.640380859375.
[rank: 0] Seed set to 5
GPU available: True (cuda), used: True
TPU available: False, using: 0 TPU cores
HPU available: False, using: 0 HPUs
LOCAL_RANK: 0 - CUDA_VISIBLE_DEVICES: [0,1,2,3,4,5,6,7]

  | Name         | Type          | Params | Mode 
-------------------------------------------------------
0 | loss         | RMSE          | 0      | train
1 | padder_train | ConstantPad1d | 0      | train
2 | scaler       | TemporalNorm  | 0      | train
3 | blocks       | ModuleList    | 2.5 M  | train
-------------------------------------------------------
2.5 M     Trainable params
0         Non-trainable params
2.5 M     Total params
9.814     Total estimated model params size (MB)
34        Modules in train mode
0         Modules in eval mode
SLURM auto-requeueing enabled. Setting signal handlers.
`Trainer.fit` stopped: `max_steps=600.0` reached.
[I 2025-01-14 14:39:25,094] Trial 36 finished with value: 3325.886474609375 and parameters: {'n_pool_kernel_size': [1, 1, 1], 'n_freq_downsample': [60, 8, 1], 'learning_rate': 0.0001839772812128737, 'scaler_type': 'robust', 'max_steps': 600.0, 'batch_size': 256, 'windows_batch_size': 256, 'random_seed': 5, 'input_size': 24, 'step_size': 24}. Best is trial 23 with value: 2392.640380859375.
[rank: 0] Seed set to 9
GPU available: True (cuda), used: True
TPU available: False, using: 0 TPU cores
HPU available: False, using: 0 HPUs
LOCAL_RANK: 0 - CUDA_VISIBLE_DEVICES: [0,1,2,3,4,5,6,7]

  | Name         | Type          | Params | Mode 
-------------------------------------------------------
0 | loss         | RMSE          | 0      | train
1 | padder_train | ConstantPad1d | 0      | train
2 | scaler       | TemporalNorm  | 0      | train
3 | blocks       | ModuleList    | 2.6 M  | train
-------------------------------------------------------
2.6 M     Trainable params
0         Non-trainable params
2.6 M     Total params
10.403    Total estimated model params size (MB)
34        Modules in train mode
0         Modules in eval mode
SLURM auto-requeueing enabled. Setting signal handlers.
`Trainer.fit` stopped: `max_steps=700.0` reached.
[I 2025-01-14 14:39:37,175] Trial 37 finished with value: 2883.567626953125 and parameters: {'n_pool_kernel_size': [2, 2, 2], 'n_freq_downsample': [24, 12, 1], 'learning_rate': 0.0005274697268854792, 'scaler_type': None, 'max_steps': 700.0, 'batch_size': 64, 'windows_batch_size': 128, 'random_seed': 9, 'input_size': 96, 'step_size': 1}. Best is trial 23 with value: 2392.640380859375.
[rank: 0] Seed set to 16
GPU available: True (cuda), used: True
TPU available: False, using: 0 TPU cores
HPU available: False, using: 0 HPUs
LOCAL_RANK: 0 - CUDA_VISIBLE_DEVICES: [0,1,2,3,4,5,6,7]

  | Name         | Type          | Params | Mode 
-------------------------------------------------------
0 | loss         | RMSE          | 0      | train
1 | padder_train | ConstantPad1d | 0      | train
2 | scaler       | TemporalNorm  | 0      | train
3 | blocks       | ModuleList    | 2.5 M  | train
-------------------------------------------------------
2.5 M     Trainable params
0         Non-trainable params
2.5 M     Total params
9.905     Total estimated model params size (MB)
34        Modules in train mode
0         Modules in eval mode
SLURM auto-requeueing enabled. Setting signal handlers.
`Trainer.fit` stopped: `max_steps=1100.0` reached.
[I 2025-01-14 14:39:56,958] Trial 38 finished with value: 3423.00341796875 and parameters: {'n_pool_kernel_size': [1, 1, 1], 'n_freq_downsample': [1, 1, 1], 'learning_rate': 0.0006491706231994605, 'scaler_type': 'robust', 'max_steps': 1100.0, 'batch_size': 64, 'windows_batch_size': 256, 'random_seed': 16, 'input_size': 24, 'step_size': 1}. Best is trial 23 with value: 2392.640380859375.
[rank: 0] Seed set to 9
GPU available: True (cuda), used: True
TPU available: False, using: 0 TPU cores
HPU available: False, using: 0 HPUs
LOCAL_RANK: 0 - CUDA_VISIBLE_DEVICES: [0,1,2,3,4,5,6,7]

  | Name         | Type          | Params | Mode 
-------------------------------------------------------
0 | loss         | RMSE          | 0      | train
1 | padder_train | ConstantPad1d | 0      | train
2 | scaler       | TemporalNorm  | 0      | train
3 | blocks       | ModuleList    | 2.4 M  | train
-------------------------------------------------------
2.4 M     Trainable params
0         Non-trainable params
2.4 M     Total params
9.765     Total estimated model params size (MB)
34        Modules in train mode
0         Modules in eval mode
SLURM auto-requeueing enabled. Setting signal handlers.
`Trainer.fit` stopped: `max_steps=500.0` reached.
[I 2025-01-14 14:40:05,610] Trial 39 finished with value: 2357.391357421875 and parameters: {'n_pool_kernel_size': [2, 2, 1], 'n_freq_downsample': [60, 8, 1], 'learning_rate': 0.000261892786253628, 'scaler_type': None, 'max_steps': 500.0, 'batch_size': 64, 'windows_batch_size': 256, 'random_seed': 9, 'input_size': 24, 'step_size': 1}. Best is trial 39 with value: 2357.391357421875.
[rank: 0] Seed set to 6
GPU available: True (cuda), used: True
TPU available: False, using: 0 TPU cores
HPU available: False, using: 0 HPUs
LOCAL_RANK: 0 - CUDA_VISIBLE_DEVICES: [0,1,2,3,4,5,6,7]

  | Name         | Type          | Params | Mode 
-------------------------------------------------------
0 | loss         | RMSE          | 0      | train
1 | padder_train | ConstantPad1d | 0      | train
2 | scaler       | TemporalNorm  | 0      | train
3 | blocks       | ModuleList    | 2.7 M  | train
-------------------------------------------------------
2.7 M     Trainable params
0         Non-trainable params
2.7 M     Total params
10.749    Total estimated model params size (MB)
34        Modules in train mode
0         Modules in eval mode
SLURM auto-requeueing enabled. Setting signal handlers.
`Trainer.fit` stopped: `max_steps=600.0` reached.
[I 2025-01-14 14:40:15,934] Trial 40 finished with value: 2809.72314453125 and parameters: {'n_pool_kernel_size': [2, 2, 1], 'n_freq_downsample': [60, 8, 1], 'learning_rate': 0.0012293443743093136, 'scaler_type': None, 'max_steps': 600.0, 'batch_size': 256, 'windows_batch_size': 512, 'random_seed': 6, 'input_size': 120, 'step_size': 1}. Best is trial 39 with value: 2357.391357421875.
[rank: 0] Seed set to 9
GPU available: True (cuda), used: True
TPU available: False, using: 0 TPU cores
HPU available: False, using: 0 HPUs
LOCAL_RANK: 0 - CUDA_VISIBLE_DEVICES: [0,1,2,3,4,5,6,7]

  | Name         | Type          | Params | Mode 
-------------------------------------------------------
0 | loss         | RMSE          | 0      | train
1 | padder_train | ConstantPad1d | 0      | train
2 | scaler       | TemporalNorm  | 0      | train
3 | blocks       | ModuleList    | 2.4 M  | train
-------------------------------------------------------
2.4 M     Trainable params
0         Non-trainable params
2.4 M     Total params
9.765     Total estimated model params size (MB)
34        Modules in train mode
0         Modules in eval mode
SLURM auto-requeueing enabled. Setting signal handlers.
`Trainer.fit` stopped: `max_steps=500.0` reached.
[I 2025-01-14 14:40:24,586] Trial 41 finished with value: 2478.234619140625 and parameters: {'n_pool_kernel_size': [2, 2, 1], 'n_freq_downsample': [60, 8, 1], 'learning_rate': 0.00025997817322010667, 'scaler_type': None, 'max_steps': 500.0, 'batch_size': 64, 'windows_batch_size': 256, 'random_seed': 9, 'input_size': 24, 'step_size': 1}. Best is trial 39 with value: 2357.391357421875.
[rank: 0] Seed set to 9
GPU available: True (cuda), used: True
TPU available: False, using: 0 TPU cores
HPU available: False, using: 0 HPUs
LOCAL_RANK: 0 - CUDA_VISIBLE_DEVICES: [0,1,2,3,4,5,6,7]

  | Name         | Type          | Params | Mode 
-------------------------------------------------------
0 | loss         | RMSE          | 0      | train
1 | padder_train | ConstantPad1d | 0      | train
2 | scaler       | TemporalNorm  | 0      | train
3 | blocks       | ModuleList    | 2.4 M  | train
-------------------------------------------------------
2.4 M     Trainable params
0         Non-trainable params
2.4 M     Total params
9.765     Total estimated model params size (MB)
34        Modules in train mode
0         Modules in eval mode
SLURM auto-requeueing enabled. Setting signal handlers.
`Trainer.fit` stopped: `max_steps=500.0` reached.
[I 2025-01-14 14:40:33,202] Trial 42 finished with value: 2456.259521484375 and parameters: {'n_pool_kernel_size': [2, 2, 1], 'n_freq_downsample': [60, 8, 1], 'learning_rate': 0.00027125308864979855, 'scaler_type': None, 'max_steps': 500.0, 'batch_size': 64, 'windows_batch_size': 256, 'random_seed': 9, 'input_size': 24, 'step_size': 1}. Best is trial 39 with value: 2357.391357421875.
[rank: 0] Seed set to 7
GPU available: True (cuda), used: True
TPU available: False, using: 0 TPU cores
HPU available: False, using: 0 HPUs
LOCAL_RANK: 0 - CUDA_VISIBLE_DEVICES: [0,1,2,3,4,5,6,7]

  | Name         | Type          | Params | Mode 
-------------------------------------------------------
0 | loss         | RMSE          | 0      | train
1 | padder_train | ConstantPad1d | 0      | train
2 | scaler       | TemporalNorm  | 0      | train
3 | blocks       | ModuleList    | 2.4 M  | train
-------------------------------------------------------
2.4 M     Trainable params
0         Non-trainable params
2.4 M     Total params
9.765     Total estimated model params size (MB)
34        Modules in train mode
0         Modules in eval mode
SLURM auto-requeueing enabled. Setting signal handlers.
`Trainer.fit` stopped: `max_steps=600.0` reached.
[I 2025-01-14 14:40:43,552] Trial 43 finished with value: 2781.505615234375 and parameters: {'n_pool_kernel_size': [2, 2, 1], 'n_freq_downsample': [60, 8, 1], 'learning_rate': 0.0009145704874910372, 'scaler_type': None, 'max_steps': 600.0, 'batch_size': 64, 'windows_batch_size': 256, 'random_seed': 7, 'input_size': 24, 'step_size': 1}. Best is trial 39 with value: 2357.391357421875.
[rank: 0] Seed set to 9
GPU available: True (cuda), used: True
TPU available: False, using: 0 TPU cores
HPU available: False, using: 0 HPUs
LOCAL_RANK: 0 - CUDA_VISIBLE_DEVICES: [0,1,2,3,4,5,6,7]

  | Name         | Type          | Params | Mode 
-------------------------------------------------------
0 | loss         | RMSE          | 0      | train
1 | padder_train | ConstantPad1d | 0      | train
2 | scaler       | TemporalNorm  | 0      | train
3 | blocks       | ModuleList    | 2.4 M  | train
-------------------------------------------------------
2.4 M     Trainable params
0         Non-trainable params
2.4 M     Total params
9.765     Total estimated model params size (MB)
34        Modules in train mode
0         Modules in eval mode
SLURM auto-requeueing enabled. Setting signal handlers.
`Trainer.fit` stopped: `max_steps=500.0` reached.
[I 2025-01-14 14:40:52,719] Trial 44 finished with value: 2982.910888671875 and parameters: {'n_pool_kernel_size': [2, 2, 1], 'n_freq_downsample': [60, 8, 1], 'learning_rate': 0.00045603661984508953, 'scaler_type': 'robust', 'max_steps': 500.0, 'batch_size': 64, 'windows_batch_size': 256, 'random_seed': 9, 'input_size': 24, 'step_size': 1}. Best is trial 39 with value: 2357.391357421875.
[rank: 0] Seed set to 8
GPU available: True (cuda), used: True
TPU available: False, using: 0 TPU cores
HPU available: False, using: 0 HPUs
LOCAL_RANK: 0 - CUDA_VISIBLE_DEVICES: [0,1,2,3,4,5,6,7]

  | Name         | Type          | Params | Mode 
-------------------------------------------------------
0 | loss         | RMSE          | 0      | train
1 | padder_train | ConstantPad1d | 0      | train
2 | scaler       | TemporalNorm  | 0      | train
3 | blocks       | ModuleList    | 2.6 M  | train
-------------------------------------------------------
2.6 M     Trainable params
0         Non-trainable params
2.6 M     Total params
10.503    Total estimated model params size (MB)
34        Modules in train mode
0         Modules in eval mode
SLURM auto-requeueing enabled. Setting signal handlers.
`Trainer.fit` stopped: `max_steps=1000.0` reached.
[I 2025-01-14 14:41:09,748] Trial 45 finished with value: 2810.9453125 and parameters: {'n_pool_kernel_size': [2, 2, 1], 'n_freq_downsample': [60, 8, 1], 'learning_rate': 0.0002054365363982658, 'scaler_type': None, 'max_steps': 1000.0, 'batch_size': 64, 'windows_batch_size': 256, 'random_seed': 8, 'input_size': 96, 'step_size': 1}. Best is trial 39 with value: 2357.391357421875.
[rank: 0] Seed set to 10
GPU available: True (cuda), used: True
TPU available: False, using: 0 TPU cores
HPU available: False, using: 0 HPUs
LOCAL_RANK: 0 - CUDA_VISIBLE_DEVICES: [0,1,2,3,4,5,6,7]

  | Name         | Type          | Params | Mode 
-------------------------------------------------------
0 | loss         | RMSE          | 0      | train
1 | padder_train | ConstantPad1d | 0      | train
2 | scaler       | TemporalNorm  | 0      | train
3 | blocks       | ModuleList    | 2.4 M  | train
-------------------------------------------------------
2.4 M     Trainable params
0         Non-trainable params
2.4 M     Total params
9.765     Total estimated model params size (MB)
34        Modules in train mode
0         Modules in eval mode
SLURM auto-requeueing enabled. Setting signal handlers.
`Trainer.fit` stopped: `max_steps=700.0` reached.
[I 2025-01-14 14:41:22,009] Trial 46 finished with value: 2607.0224609375 and parameters: {'n_pool_kernel_size': [2, 2, 1], 'n_freq_downsample': [60, 8, 1], 'learning_rate': 0.0003376681339390137, 'scaler_type': None, 'max_steps': 700.0, 'batch_size': 128, 'windows_batch_size': 128, 'random_seed': 10, 'input_size': 24, 'step_size': 1}. Best is trial 39 with value: 2357.391357421875.
[rank: 0] Seed set to 11
GPU available: True (cuda), used: True
TPU available: False, using: 0 TPU cores
HPU available: False, using: 0 HPUs
LOCAL_RANK: 0 - CUDA_VISIBLE_DEVICES: [0,1,2,3,4,5,6,7]

  | Name         | Type          | Params | Mode 
-------------------------------------------------------
0 | loss         | RMSE          | 0      | train
1 | padder_train | ConstantPad1d | 0      | train
2 | scaler       | TemporalNorm  | 0      | train
3 | blocks       | ModuleList    | 2.5 M  | train
-------------------------------------------------------
2.5 M     Trainable params
0         Non-trainable params
2.5 M     Total params
9.927     Total estimated model params size (MB)
34        Modules in train mode
0         Modules in eval mode
SLURM auto-requeueing enabled. Setting signal handlers.
`Trainer.fit` stopped: `max_steps=800.0` reached.
[I 2025-01-14 14:41:35,896] Trial 47 finished with value: 2875.60888671875 and parameters: {'n_pool_kernel_size': [16, 8, 1], 'n_freq_downsample': [168, 24, 1], 'learning_rate': 0.000158079670167169, 'scaler_type': None, 'max_steps': 800.0, 'batch_size': 64, 'windows_batch_size': 256, 'random_seed': 11, 'input_size': 48, 'step_size': 1}. Best is trial 39 with value: 2357.391357421875.
[rank: 0] Seed set to 7
GPU available: True (cuda), used: True
TPU available: False, using: 0 TPU cores
HPU available: False, using: 0 HPUs
LOCAL_RANK: 0 - CUDA_VISIBLE_DEVICES: [0,1,2,3,4,5,6,7]

  | Name         | Type          | Params | Mode 
-------------------------------------------------------
0 | loss         | RMSE          | 0      | train
1 | padder_train | ConstantPad1d | 0      | train
2 | scaler       | TemporalNorm  | 0      | train
3 | blocks       | ModuleList    | 2.4 M  | train
-------------------------------------------------------
2.4 M     Trainable params
0         Non-trainable params
2.4 M     Total params
9.765     Total estimated model params size (MB)
34        Modules in train mode
0         Modules in eval mode
SLURM auto-requeueing enabled. Setting signal handlers.
`Trainer.fit` stopped: `max_steps=1200.0` reached.
[I 2025-01-14 14:41:56,386] Trial 48 finished with value: 383624.9375 and parameters: {'n_pool_kernel_size': [2, 2, 1], 'n_freq_downsample': [60, 8, 1], 'learning_rate': 0.028027591834503256, 'scaler_type': None, 'max_steps': 1200.0, 'batch_size': 64, 'windows_batch_size': 256, 'random_seed': 7, 'input_size': 24, 'step_size': 24}. Best is trial 39 with value: 2357.391357421875.
[rank: 0] Seed set to 19
GPU available: True (cuda), used: True
TPU available: False, using: 0 TPU cores
HPU available: False, using: 0 HPUs
LOCAL_RANK: 0 - CUDA_VISIBLE_DEVICES: [0,1,2,3,4,5,6,7]

  | Name         | Type          | Params | Mode 
-------------------------------------------------------
0 | loss         | RMSE          | 0      | train
1 | padder_train | ConstantPad1d | 0      | train
2 | scaler       | TemporalNorm  | 0      | train
3 | blocks       | ModuleList    | 2.5 M  | train
-------------------------------------------------------
2.5 M     Trainable params
0         Non-trainable params
2.5 M     Total params
10.161    Total estimated model params size (MB)
34        Modules in train mode
0         Modules in eval mode
SLURM auto-requeueing enabled. Setting signal handlers.
`Trainer.fit` stopped: `max_steps=600.0` reached.
