[I 2025-01-14 13:57:26,417] Trial 32 finished with value: 2467.02099609375 and parameters: {'n_pool_kernel_size': [4, 4, 4], 'n_freq_downsample': [180, 60, 1], 'learning_rate': 0.0001415105508338203, 'scaler_type': 'robust', 'max_steps': 1000.0, 'batch_size': 64, 'windows_batch_size': 1024, 'random_seed': 16, 'input_size': 48, 'step_size': 24}. Best is trial 22 with value: 2387.56689453125.
[rank: 0] Seed set to 16
GPU available: True (cuda), used: True
TPU available: False, using: 0 TPU cores
HPU available: False, using: 0 HPUs
LOCAL_RANK: 0 - CUDA_VISIBLE_DEVICES: [0,1,2,3,4,5,6,7]

  | Name         | Type          | Params | Mode 
-------------------------------------------------------
0 | loss         | RMSE          | 0      | train
1 | padder_train | ConstantPad1d | 0      | train
2 | scaler       | TemporalNorm  | 0      | train
3 | blocks       | ModuleList    | 2.5 M  | train
-------------------------------------------------------
2.5 M     Trainable params
0         Non-trainable params
2.5 M     Total params
9.884     Total estimated model params size (MB)
34        Modules in train mode
0         Modules in eval mode
SLURM auto-requeueing enabled. Setting signal handlers.
`Trainer.fit` stopped: `max_steps=900.0` reached.
[I 2025-01-14 13:57:42,485] Trial 33 finished with value: 2408.6376953125 and parameters: {'n_pool_kernel_size': [4, 4, 4], 'n_freq_downsample': [180, 60, 1], 'learning_rate': 0.00014111338593987037, 'scaler_type': 'robust', 'max_steps': 900.0, 'batch_size': 64, 'windows_batch_size': 1024, 'random_seed': 16, 'input_size': 48, 'step_size': 24}. Best is trial 22 with value: 2387.56689453125.
[rank: 0] Seed set to 13
GPU available: True (cuda), used: True
TPU available: False, using: 0 TPU cores
HPU available: False, using: 0 HPUs
LOCAL_RANK: 0 - CUDA_VISIBLE_DEVICES: [0,1,2,3,4,5,6,7]

  | Name         | Type          | Params | Mode 
-------------------------------------------------------
0 | loss         | RMSE          | 0      | train
1 | padder_train | ConstantPad1d | 0      | train
2 | scaler       | TemporalNorm  | 0      | train
3 | blocks       | ModuleList    | 2.5 M  | train
-------------------------------------------------------
2.5 M     Trainable params
0         Non-trainable params
2.5 M     Total params
9.884     Total estimated model params size (MB)
34        Modules in train mode
0         Modules in eval mode
SLURM auto-requeueing enabled. Setting signal handlers.
`Trainer.fit` stopped: `max_steps=900.0` reached.
[I 2025-01-14 13:57:57,656] Trial 34 finished with value: 4861.15869140625 and parameters: {'n_pool_kernel_size': [4, 4, 4], 'n_freq_downsample': [180, 60, 1], 'learning_rate': 0.00010273203740254594, 'scaler_type': None, 'max_steps': 900.0, 'batch_size': 32, 'windows_batch_size': 1024, 'random_seed': 13, 'input_size': 48, 'step_size': 1}. Best is trial 22 with value: 2387.56689453125.
[rank: 0] Seed set to 16
GPU available: True (cuda), used: True
TPU available: False, using: 0 TPU cores
HPU available: False, using: 0 HPUs
LOCAL_RANK: 0 - CUDA_VISIBLE_DEVICES: [0,1,2,3,4,5,6,7]

  | Name         | Type          | Params | Mode 
-------------------------------------------------------
0 | loss         | RMSE          | 0      | train
1 | padder_train | ConstantPad1d | 0      | train
2 | scaler       | TemporalNorm  | 0      | train
3 | blocks       | ModuleList    | 2.5 M  | train
-------------------------------------------------------
2.5 M     Trainable params
0         Non-trainable params
2.5 M     Total params
9.884     Total estimated model params size (MB)
34        Modules in train mode
0         Modules in eval mode
SLURM auto-requeueing enabled. Setting signal handlers.
`Trainer.fit` stopped: `max_steps=900.0` reached.
[I 2025-01-14 13:58:14,050] Trial 35 finished with value: 2498.630615234375 and parameters: {'n_pool_kernel_size': [4, 4, 4], 'n_freq_downsample': [168, 24, 1], 'learning_rate': 0.00014946797138388137, 'scaler_type': 'robust', 'max_steps': 900.0, 'batch_size': 64, 'windows_batch_size': 1024, 'random_seed': 16, 'input_size': 48, 'step_size': 24}. Best is trial 22 with value: 2387.56689453125.
[rank: 0] Seed set to 16
GPU available: True (cuda), used: True
TPU available: False, using: 0 TPU cores
HPU available: False, using: 0 HPUs
LOCAL_RANK: 0 - CUDA_VISIBLE_DEVICES: [0,1,2,3,4,5,6,7]

  | Name         | Type          | Params | Mode 
-------------------------------------------------------
0 | loss         | RMSE          | 0      | train
1 | padder_train | ConstantPad1d | 0      | train
2 | scaler       | TemporalNorm  | 0      | train
3 | blocks       | ModuleList    | 2.5 M  | train
-------------------------------------------------------
2.5 M     Trainable params
0         Non-trainable params
2.5 M     Total params
9.884     Total estimated model params size (MB)
34        Modules in train mode
0         Modules in eval mode
SLURM auto-requeueing enabled. Setting signal handlers.
`Trainer.fit` stopped: `max_steps=1200.0` reached.
[I 2025-01-14 13:58:34,185] Trial 36 finished with value: 5932.07470703125 and parameters: {'n_pool_kernel_size': [4, 4, 4], 'n_freq_downsample': [168, 24, 1], 'learning_rate': 0.00016044034099897832, 'scaler_type': None, 'max_steps': 1200.0, 'batch_size': 64, 'windows_batch_size': 1024, 'random_seed': 16, 'input_size': 48, 'step_size': 1}. Best is trial 22 with value: 2387.56689453125.
[rank: 0] Seed set to 8
GPU available: True (cuda), used: True
TPU available: False, using: 0 TPU cores
HPU available: False, using: 0 HPUs
LOCAL_RANK: 0 - CUDA_VISIBLE_DEVICES: [0,1,2,3,4,5,6,7]

  | Name         | Type          | Params | Mode 
-------------------------------------------------------
0 | loss         | RMSE          | 0      | train
1 | padder_train | ConstantPad1d | 0      | train
2 | scaler       | TemporalNorm  | 0      | train
3 | blocks       | ModuleList    | 2.5 M  | train
-------------------------------------------------------
2.5 M     Trainable params
0         Non-trainable params
2.5 M     Total params
9.884     Total estimated model params size (MB)
34        Modules in train mode
0         Modules in eval mode
SLURM auto-requeueing enabled. Setting signal handlers.
`Trainer.fit` stopped: `max_steps=900.0` reached.
[I 2025-01-14 13:58:50,344] Trial 37 finished with value: 2203.994873046875 and parameters: {'n_pool_kernel_size': [4, 4, 4], 'n_freq_downsample': [168, 24, 1], 'learning_rate': 0.00013574520377257018, 'scaler_type': 'robust', 'max_steps': 900.0, 'batch_size': 64, 'windows_batch_size': 1024, 'random_seed': 8, 'input_size': 48, 'step_size': 24}. Best is trial 37 with value: 2203.994873046875.
[rank: 0] Seed set to 8
GPU available: True (cuda), used: True
TPU available: False, using: 0 TPU cores
HPU available: False, using: 0 HPUs
LOCAL_RANK: 0 - CUDA_VISIBLE_DEVICES: [0,1,2,3,4,5,6,7]

  | Name         | Type          | Params | Mode 
-------------------------------------------------------
0 | loss         | RMSE          | 0      | train
1 | padder_train | ConstantPad1d | 0      | train
2 | scaler       | TemporalNorm  | 0      | train
3 | blocks       | ModuleList    | 2.5 M  | train
-------------------------------------------------------
2.5 M     Trainable params
0         Non-trainable params
2.5 M     Total params
9.884     Total estimated model params size (MB)
34        Modules in train mode
0         Modules in eval mode
SLURM auto-requeueing enabled. Setting signal handlers.
`Trainer.fit` stopped: `max_steps=900.0` reached.
[I 2025-01-14 13:59:06,042] Trial 38 finished with value: 5167.7900390625 and parameters: {'n_pool_kernel_size': [4, 4, 4], 'n_freq_downsample': [168, 24, 1], 'learning_rate': 0.00012438490162437497, 'scaler_type': 'standard', 'max_steps': 900.0, 'batch_size': 64, 'windows_batch_size': 1024, 'random_seed': 8, 'input_size': 48, 'step_size': 1}. Best is trial 37 with value: 2203.994873046875.
[rank: 0] Seed set to 6
GPU available: True (cuda), used: True
TPU available: False, using: 0 TPU cores
HPU available: False, using: 0 HPUs
LOCAL_RANK: 0 - CUDA_VISIBLE_DEVICES: [0,1,2,3,4,5,6,7]

  | Name         | Type          | Params | Mode 
-------------------------------------------------------
0 | loss         | RMSE          | 0      | train
1 | padder_train | ConstantPad1d | 0      | train
2 | scaler       | TemporalNorm  | 0      | train
3 | blocks       | ModuleList    | 2.5 M  | train
-------------------------------------------------------
2.5 M     Trainable params
0         Non-trainable params
2.5 M     Total params
9.946     Total estimated model params size (MB)
34        Modules in train mode
0         Modules in eval mode
SLURM auto-requeueing enabled. Setting signal handlers.
`Trainer.fit` stopped: `max_steps=1000.0` reached.
[I 2025-01-14 13:59:24,475] Trial 39 finished with value: 2358.0263671875 and parameters: {'n_pool_kernel_size': [8, 4, 1], 'n_freq_downsample': [168, 24, 1], 'learning_rate': 0.00024746801358673757, 'scaler_type': 'robust', 'max_steps': 1000.0, 'batch_size': 32, 'windows_batch_size': 1024, 'random_seed': 6, 'input_size': 48, 'step_size': 24}. Best is trial 37 with value: 2203.994873046875.
[rank: 0] Seed set to 4
GPU available: True (cuda), used: True
TPU available: False, using: 0 TPU cores
HPU available: False, using: 0 HPUs
LOCAL_RANK: 0 - CUDA_VISIBLE_DEVICES: [0,1,2,3,4,5,6,7]

  | Name         | Type          | Params | Mode 
-------------------------------------------------------
0 | loss         | RMSE          | 0      | train
1 | padder_train | ConstantPad1d | 0      | train
2 | scaler       | TemporalNorm  | 0      | train
3 | blocks       | ModuleList    | 2.5 M  | train
-------------------------------------------------------
2.5 M     Trainable params
0         Non-trainable params
2.5 M     Total params
10.161    Total estimated model params size (MB)
34        Modules in train mode
0         Modules in eval mode
SLURM auto-requeueing enabled. Setting signal handlers.
`Trainer.fit` stopped: `max_steps=1100.0` reached.
[I 2025-01-14 13:59:42,805] Trial 40 finished with value: 2339.858642578125 and parameters: {'n_pool_kernel_size': [8, 4, 1], 'n_freq_downsample': [168, 24, 1], 'learning_rate': 0.00021992393171601216, 'scaler_type': None, 'max_steps': 1100.0, 'batch_size': 32, 'windows_batch_size': 128, 'random_seed': 4, 'input_size': 72, 'step_size': 24}. Best is trial 37 with value: 2203.994873046875.
[rank: 0] Seed set to 3
GPU available: True (cuda), used: True
TPU available: False, using: 0 TPU cores
HPU available: False, using: 0 HPUs
LOCAL_RANK: 0 - CUDA_VISIBLE_DEVICES: [0,1,2,3,4,5,6,7]

  | Name         | Type          | Params | Mode 
-------------------------------------------------------
0 | loss         | RMSE          | 0      | train
1 | padder_train | ConstantPad1d | 0      | train
2 | scaler       | TemporalNorm  | 0      | train
3 | blocks       | ModuleList    | 2.5 M  | train
-------------------------------------------------------
2.5 M     Trainable params
0         Non-trainable params
2.5 M     Total params
10.161    Total estimated model params size (MB)
34        Modules in train mode
0         Modules in eval mode
SLURM auto-requeueing enabled. Setting signal handlers.
`Trainer.fit` stopped: `max_steps=1200.0` reached.
[I 2025-01-14 14:00:02,621] Trial 41 finished with value: 2181.247802734375 and parameters: {'n_pool_kernel_size': [8, 4, 1], 'n_freq_downsample': [168, 24, 1], 'learning_rate': 0.00022779303474688975, 'scaler_type': None, 'max_steps': 1200.0, 'batch_size': 32, 'windows_batch_size': 128, 'random_seed': 3, 'input_size': 72, 'step_size': 24}. Best is trial 41 with value: 2181.247802734375.
[rank: 0] Seed set to 3
GPU available: True (cuda), used: True
TPU available: False, using: 0 TPU cores
HPU available: False, using: 0 HPUs
LOCAL_RANK: 0 - CUDA_VISIBLE_DEVICES: [0,1,2,3,4,5,6,7]

  | Name         | Type          | Params | Mode 
-------------------------------------------------------
0 | loss         | RMSE          | 0      | train
1 | padder_train | ConstantPad1d | 0      | train
2 | scaler       | TemporalNorm  | 0      | train
3 | blocks       | ModuleList    | 2.5 M  | train
-------------------------------------------------------
2.5 M     Trainable params
0         Non-trainable params
2.5 M     Total params
10.161    Total estimated model params size (MB)
34        Modules in train mode
0         Modules in eval mode
SLURM auto-requeueing enabled. Setting signal handlers.
`Trainer.fit` stopped: `max_steps=1200.0` reached.
[I 2025-01-14 14:00:22,449] Trial 42 finished with value: 2231.16650390625 and parameters: {'n_pool_kernel_size': [8, 4, 1], 'n_freq_downsample': [168, 24, 1], 'learning_rate': 0.0002285287988023337, 'scaler_type': None, 'max_steps': 1200.0, 'batch_size': 32, 'windows_batch_size': 128, 'random_seed': 3, 'input_size': 72, 'step_size': 24}. Best is trial 41 with value: 2181.247802734375.
[rank: 0] Seed set to 3
GPU available: True (cuda), used: True
TPU available: False, using: 0 TPU cores
HPU available: False, using: 0 HPUs
LOCAL_RANK: 0 - CUDA_VISIBLE_DEVICES: [0,1,2,3,4,5,6,7]

  | Name         | Type          | Params | Mode 
-------------------------------------------------------
0 | loss         | RMSE          | 0      | train
1 | padder_train | ConstantPad1d | 0      | train
2 | scaler       | TemporalNorm  | 0      | train
3 | blocks       | ModuleList    | 2.5 M  | train
-------------------------------------------------------
2.5 M     Trainable params
0         Non-trainable params
2.5 M     Total params
10.161    Total estimated model params size (MB)
34        Modules in train mode
0         Modules in eval mode
SLURM auto-requeueing enabled. Setting signal handlers.
`Trainer.fit` stopped: `max_steps=1200.0` reached.
[I 2025-01-14 14:00:42,633] Trial 43 finished with value: 2308.2314453125 and parameters: {'n_pool_kernel_size': [8, 4, 1], 'n_freq_downsample': [168, 24, 1], 'learning_rate': 0.00021654800904808677, 'scaler_type': None, 'max_steps': 1200.0, 'batch_size': 32, 'windows_batch_size': 128, 'random_seed': 3, 'input_size': 72, 'step_size': 24}. Best is trial 41 with value: 2181.247802734375.
[rank: 0] Seed set to 3
GPU available: True (cuda), used: True
TPU available: False, using: 0 TPU cores
HPU available: False, using: 0 HPUs
LOCAL_RANK: 0 - CUDA_VISIBLE_DEVICES: [0,1,2,3,4,5,6,7]

  | Name         | Type          | Params | Mode 
-------------------------------------------------------
0 | loss         | RMSE          | 0      | train
1 | padder_train | ConstantPad1d | 0      | train
2 | scaler       | TemporalNorm  | 0      | train
3 | blocks       | ModuleList    | 2.5 M  | train
-------------------------------------------------------
2.5 M     Trainable params
0         Non-trainable params
2.5 M     Total params
10.161    Total estimated model params size (MB)
34        Modules in train mode
0         Modules in eval mode
SLURM auto-requeueing enabled. Setting signal handlers.
`Trainer.fit` stopped: `max_steps=1200.0` reached.
[I 2025-01-14 14:01:02,808] Trial 44 finished with value: 2565.04833984375 and parameters: {'n_pool_kernel_size': [8, 4, 1], 'n_freq_downsample': [168, 24, 1], 'learning_rate': 0.0028392995351604567, 'scaler_type': None, 'max_steps': 1200.0, 'batch_size': 32, 'windows_batch_size': 128, 'random_seed': 3, 'input_size': 72, 'step_size': 24}. Best is trial 41 with value: 2181.247802734375.
[rank: 0] Seed set to 4
GPU available: True (cuda), used: True
TPU available: False, using: 0 TPU cores
HPU available: False, using: 0 HPUs
LOCAL_RANK: 0 - CUDA_VISIBLE_DEVICES: [0,1,2,3,4,5,6,7]

  | Name         | Type          | Params | Mode 
-------------------------------------------------------
0 | loss         | RMSE          | 0      | train
1 | padder_train | ConstantPad1d | 0      | train
2 | scaler       | TemporalNorm  | 0      | train
3 | blocks       | ModuleList    | 2.5 M  | train
-------------------------------------------------------
2.5 M     Trainable params
0         Non-trainable params
2.5 M     Total params
10.161    Total estimated model params size (MB)
34        Modules in train mode
0         Modules in eval mode
SLURM auto-requeueing enabled. Setting signal handlers.
`Trainer.fit` stopped: `max_steps=1100.0` reached.
[I 2025-01-14 14:01:21,024] Trial 45 finished with value: 5938.4248046875 and parameters: {'n_pool_kernel_size': [8, 4, 1], 'n_freq_downsample': [168, 24, 1], 'learning_rate': 0.0007156253988688302, 'scaler_type': None, 'max_steps': 1100.0, 'batch_size': 32, 'windows_batch_size': 128, 'random_seed': 4, 'input_size': 72, 'step_size': 1}. Best is trial 41 with value: 2181.247802734375.
[rank: 0] Seed set to 1
GPU available: True (cuda), used: True
TPU available: False, using: 0 TPU cores
HPU available: False, using: 0 HPUs
LOCAL_RANK: 0 - CUDA_VISIBLE_DEVICES: [0,1,2,3,4,5,6,7]

  | Name         | Type          | Params | Mode 
-------------------------------------------------------
0 | loss         | RMSE          | 0      | train
1 | padder_train | ConstantPad1d | 0      | train
2 | scaler       | TemporalNorm  | 0      | train
3 | blocks       | ModuleList    | 2.5 M  | train
-------------------------------------------------------
2.5 M     Trainable params
0         Non-trainable params
2.5 M     Total params
10.161    Total estimated model params size (MB)
34        Modules in train mode
0         Modules in eval mode
SLURM auto-requeueing enabled. Setting signal handlers.
`Trainer.fit` stopped: `max_steps=1300.0` reached.
[I 2025-01-14 14:01:42,473] Trial 46 finished with value: 43822268.0 and parameters: {'n_pool_kernel_size': [8, 4, 1], 'n_freq_downsample': [168, 24, 1], 'learning_rate': 0.05330887141759734, 'scaler_type': None, 'max_steps': 1300.0, 'batch_size': 32, 'windows_batch_size': 128, 'random_seed': 1, 'input_size': 72, 'step_size': 24}. Best is trial 41 with value: 2181.247802734375.
[rank: 0] Seed set to 5
GPU available: True (cuda), used: True
TPU available: False, using: 0 TPU cores
HPU available: False, using: 0 HPUs
LOCAL_RANK: 0 - CUDA_VISIBLE_DEVICES: [0,1,2,3,4,5,6,7]

  | Name         | Type          | Params | Mode 
-------------------------------------------------------
0 | loss         | RMSE          | 0      | train
1 | padder_train | ConstantPad1d | 0      | train
2 | scaler       | TemporalNorm  | 0      | train
3 | blocks       | ModuleList    | 2.5 M  | train
-------------------------------------------------------
2.5 M     Trainable params
0         Non-trainable params
2.5 M     Total params
10.161    Total estimated model params size (MB)
34        Modules in train mode
0         Modules in eval mode
SLURM auto-requeueing enabled. Setting signal handlers.
`Trainer.fit` stopped: `max_steps=1400.0` reached.
[I 2025-01-14 14:02:05,711] Trial 47 finished with value: 2311.078369140625 and parameters: {'n_pool_kernel_size': [8, 4, 1], 'n_freq_downsample': [168, 24, 1], 'learning_rate': 0.00019614725024340575, 'scaler_type': None, 'max_steps': 1400.0, 'batch_size': 32, 'windows_batch_size': 128, 'random_seed': 5, 'input_size': 72, 'step_size': 24}. Best is trial 41 with value: 2181.247802734375.
[rank: 0] Seed set to 5
GPU available: True (cuda), used: True
TPU available: False, using: 0 TPU cores
HPU available: False, using: 0 HPUs
LOCAL_RANK: 0 - CUDA_VISIBLE_DEVICES: [0,1,2,3,4,5,6,7]

  | Name         | Type          | Params | Mode 
-------------------------------------------------------
0 | loss         | RMSE          | 0      | train
1 | padder_train | ConstantPad1d | 0      | train
2 | scaler       | TemporalNorm  | 0      | train
3 | blocks       | ModuleList    | 2.5 M  | train
-------------------------------------------------------
2.5 M     Trainable params
0         Non-trainable params
2.5 M     Total params
10.161    Total estimated model params size (MB)
34        Modules in train mode
0         Modules in eval mode
SLURM auto-requeueing enabled. Setting signal handlers.
`Trainer.fit` stopped: `max_steps=1400.0` reached.
[I 2025-01-14 14:02:28,950] Trial 48 finished with value: 2520.2607421875 and parameters: {'n_pool_kernel_size': [8, 4, 1], 'n_freq_downsample': [168, 24, 1], 'learning_rate': 0.00034495003779888957, 'scaler_type': None, 'max_steps': 1400.0, 'batch_size': 32, 'windows_batch_size': 128, 'random_seed': 5, 'input_size': 72, 'step_size': 24}. Best is trial 41 with value: 2181.247802734375.
[rank: 0] Seed set to 7
GPU available: True (cuda), used: True
TPU available: False, using: 0 TPU cores
HPU available: False, using: 0 HPUs
LOCAL_RANK: 0 - CUDA_VISIBLE_DEVICES: [0,1,2,3,4,5,6,7]

  | Name         | Type          | Params | Mode 
-------------------------------------------------------
0 | loss         | RMSE          | 0      | train
1 | padder_train | ConstantPad1d | 0      | train
2 | scaler       | TemporalNorm  | 0      | train
3 | blocks       | ModuleList    | 2.5 M  | train
-------------------------------------------------------
2.5 M     Trainable params
0         Non-trainable params
2.5 M     Total params
10.161    Total estimated model params size (MB)
34        Modules in train mode
0         Modules in eval mode
SLURM auto-requeueing enabled. Setting signal handlers.
`Trainer.fit` stopped: `max_steps=1500.0` reached.
