[I 2025-01-14 19:24:29,575] Trial 49 finished with value: 3818.255126953125 and parameters: {'n_pool_kernel_size': [16, 8, 1], 'n_freq_downsample': [24, 12, 1], 'learning_rate': 0.00030782643631317654, 'scaler_type': 'robust', 'max_steps': 500.0, 'batch_size': 32, 'windows_batch_size': 128, 'random_seed': 15, 'input_size': 72, 'step_size': 24}. Best is trial 26 with value: 1492.1568603515625.
[rank: 0] Seed set to 18
GPU available: True (cuda), used: True
TPU available: False, using: 0 TPU cores
HPU available: False, using: 0 HPUs
LOCAL_RANK: 0 - CUDA_VISIBLE_DEVICES: [0,1,2,3,4,5,6,7]

  | Name         | Type          | Params | Mode 
-------------------------------------------------------
0 | loss         | RMSE          | 0      | train
1 | padder_train | ConstantPad1d | 0      | train
2 | scaler       | TemporalNorm  | 0      | train
3 | blocks       | ModuleList    | 2.4 M  | train
-------------------------------------------------------
2.4 M     Trainable params
0         Non-trainable params
2.4 M     Total params
9.700     Total estimated model params size (MB)
34        Modules in train mode
0         Modules in eval mode
SLURM auto-requeueing enabled. Setting signal handlers.
`Trainer.fit` stopped: `max_steps=800.0` reached.
GPU available: True (cuda), used: True
TPU available: False, using: 0 TPU cores
HPU available: False, using: 0 HPUs
LOCAL_RANK: 0 - CUDA_VISIBLE_DEVICES: [0,1,2,3,4,5,6,7]
SLURM auto-requeueing enabled. Setting signal handlers.
[I 2025-01-14 19:24:45,078] A new study created in memory with name: no-name-275287c4-6c51-4c5e-9bec-5ef14196b1e1
[rank: 0] Seed set to 3
GPU available: True (cuda), used: True
TPU available: False, using: 0 TPU cores
HPU available: False, using: 0 HPUs
LOCAL_RANK: 0 - CUDA_VISIBLE_DEVICES: [0,1,2,3,4,5,6,7]

  | Name         | Type          | Params | Mode 
-------------------------------------------------------
0 | loss         | RMSE          | 0      | train
1 | padder_train | ConstantPad1d | 0      | train
2 | scaler       | TemporalNorm  | 0      | train
3 | blocks       | ModuleList    | 2.4 M  | train
-------------------------------------------------------
2.4 M     Trainable params
0         Non-trainable params
2.4 M     Total params
9.761     Total estimated model params size (MB)
34        Modules in train mode
0         Modules in eval mode
SLURM auto-requeueing enabled. Setting signal handlers.
`Trainer.fit` stopped: `max_steps=1100.0` reached.
[I 2025-01-14 19:25:05,868] Trial 0 finished with value: 2288.636962890625 and parameters: {'n_pool_kernel_size': [2, 2, 1], 'n_freq_downsample': [168, 24, 1], 'learning_rate': 0.00254165369488209, 'scaler_type': 'robust', 'max_steps': 1100.0, 'batch_size': 64, 'windows_batch_size': 256, 'random_seed': 3, 'input_size': 24, 'step_size': 1}. Best is trial 0 with value: 2288.636962890625.
[rank: 0] Seed set to 13
GPU available: True (cuda), used: True
TPU available: False, using: 0 TPU cores
HPU available: False, using: 0 HPUs
LOCAL_RANK: 0 - CUDA_VISIBLE_DEVICES: [0,1,2,3,4,5,6,7]

  | Name         | Type          | Params | Mode 
-------------------------------------------------------
0 | loss         | RMSE          | 0      | train
1 | padder_train | ConstantPad1d | 0      | train
2 | scaler       | TemporalNorm  | 0      | train
3 | blocks       | ModuleList    | 2.6 M  | train
-------------------------------------------------------
2.6 M     Trainable params
0         Non-trainable params
2.6 M     Total params
10.378    Total estimated model params size (MB)
34        Modules in train mode
0         Modules in eval mode
SLURM auto-requeueing enabled. Setting signal handlers.
`Trainer.fit` stopped: `max_steps=700.0` reached.
[I 2025-01-14 19:25:18,436] Trial 1 finished with value: 159623520.0 and parameters: {'n_pool_kernel_size': [8, 4, 1], 'n_freq_downsample': [24, 12, 1], 'learning_rate': 0.0635481432585188, 'scaler_type': None, 'max_steps': 700.0, 'batch_size': 32, 'windows_batch_size': 256, 'random_seed': 13, 'input_size': 96, 'step_size': 24}. Best is trial 0 with value: 2288.636962890625.
[rank: 0] Seed set to 9
GPU available: True (cuda), used: True
TPU available: False, using: 0 TPU cores
HPU available: False, using: 0 HPUs
LOCAL_RANK: 0 - CUDA_VISIBLE_DEVICES: [0,1,2,3,4,5,6,7]

  | Name         | Type          | Params | Mode 
-------------------------------------------------------
0 | loss         | RMSE          | 0      | train
1 | padder_train | ConstantPad1d | 0      | train
2 | scaler       | TemporalNorm  | 0      | train
3 | blocks       | ModuleList    | 2.5 M  | train
-------------------------------------------------------
2.5 M     Trainable params
0         Non-trainable params
2.5 M     Total params
10.110    Total estimated model params size (MB)
34        Modules in train mode
0         Modules in eval mode
SLURM auto-requeueing enabled. Setting signal handlers.
`Trainer.fit` stopped: `max_steps=1400.0` reached.
[I 2025-01-14 19:25:44,387] Trial 2 finished with value: 4459.90673828125 and parameters: {'n_pool_kernel_size': [1, 1, 1], 'n_freq_downsample': [60, 8, 1], 'learning_rate': 0.014445311061951792, 'scaler_type': 'robust', 'max_steps': 1400.0, 'batch_size': 64, 'windows_batch_size': 512, 'random_seed': 9, 'input_size': 48, 'step_size': 24}. Best is trial 0 with value: 2288.636962890625.
[rank: 0] Seed set to 1
GPU available: True (cuda), used: True
TPU available: False, using: 0 TPU cores
HPU available: False, using: 0 HPUs
LOCAL_RANK: 0 - CUDA_VISIBLE_DEVICES: [0,1,2,3,4,5,6,7]

  | Name         | Type          | Params | Mode 
-------------------------------------------------------
0 | loss         | RMSE          | 0      | train
1 | padder_train | ConstantPad1d | 0      | train
2 | scaler       | TemporalNorm  | 0      | train
3 | blocks       | ModuleList    | 2.5 M  | train
-------------------------------------------------------
2.5 M     Trainable params
0         Non-trainable params
2.5 M     Total params
10.163    Total estimated model params size (MB)
34        Modules in train mode
0         Modules in eval mode
SLURM auto-requeueing enabled. Setting signal handlers.
`Trainer.fit` stopped: `max_steps=600.0` reached.
[I 2025-01-14 19:25:55,841] Trial 3 finished with value: 3586.7099609375 and parameters: {'n_pool_kernel_size': [4, 4, 4], 'n_freq_downsample': [1, 1, 1], 'learning_rate': 0.00030399598864337766, 'scaler_type': 'robust', 'max_steps': 600.0, 'batch_size': 64, 'windows_batch_size': 1024, 'random_seed': 1, 'input_size': 72, 'step_size': 1}. Best is trial 0 with value: 2288.636962890625.
[rank: 0] Seed set to 18
GPU available: True (cuda), used: True
TPU available: False, using: 0 TPU cores
HPU available: False, using: 0 HPUs
LOCAL_RANK: 0 - CUDA_VISIBLE_DEVICES: [0,1,2,3,4,5,6,7]

  | Name         | Type          | Params | Mode 
-------------------------------------------------------
0 | loss         | RMSE          | 0      | train
1 | padder_train | ConstantPad1d | 0      | train
2 | scaler       | TemporalNorm  | 0      | train
3 | blocks       | ModuleList    | 2.5 M  | train
-------------------------------------------------------
2.5 M     Trainable params
0         Non-trainable params
2.5 M     Total params
9.979     Total estimated model params size (MB)
34        Modules in train mode
0         Modules in eval mode
SLURM auto-requeueing enabled. Setting signal handlers.
`Trainer.fit` stopped: `max_steps=800.0` reached.
[I 2025-01-14 19:26:10,589] Trial 4 finished with value: 2308.890869140625 and parameters: {'n_pool_kernel_size': [4, 4, 4], 'n_freq_downsample': [1, 1, 1], 'learning_rate': 0.012754180442082522, 'scaler_type': None, 'max_steps': 800.0, 'batch_size': 64, 'windows_batch_size': 1024, 'random_seed': 18, 'input_size': 48, 'step_size': 24}. Best is trial 0 with value: 2288.636962890625.
[rank: 0] Seed set to 10
GPU available: True (cuda), used: True
TPU available: False, using: 0 TPU cores
HPU available: False, using: 0 HPUs
LOCAL_RANK: 0 - CUDA_VISIBLE_DEVICES: [0,1,2,3,4,5,6,7]

  | Name         | Type          | Params | Mode 
-------------------------------------------------------
0 | loss         | RMSE          | 0      | train
1 | padder_train | ConstantPad1d | 0      | train
2 | scaler       | TemporalNorm  | 0      | train
3 | blocks       | ModuleList    | 2.5 M  | train
-------------------------------------------------------
2.5 M     Trainable params
0         Non-trainable params
2.5 M     Total params
10.011    Total estimated model params size (MB)
34        Modules in train mode
0         Modules in eval mode
SLURM auto-requeueing enabled. Setting signal handlers.
`Trainer.fit` stopped: `max_steps=1300.0` reached.
[I 2025-01-14 19:26:34,282] Trial 5 finished with value: 2819.143798828125 and parameters: {'n_pool_kernel_size': [2, 2, 1], 'n_freq_downsample': [60, 8, 1], 'learning_rate': 0.0006010293214480375, 'scaler_type': None, 'max_steps': 1300.0, 'batch_size': 64, 'windows_batch_size': 1024, 'random_seed': 10, 'input_size': 48, 'step_size': 24}. Best is trial 0 with value: 2288.636962890625.
[rank: 0] Seed set to 20
GPU available: True (cuda), used: True
TPU available: False, using: 0 TPU cores
HPU available: False, using: 0 HPUs
LOCAL_RANK: 0 - CUDA_VISIBLE_DEVICES: [0,1,2,3,4,5,6,7]

  | Name         | Type          | Params | Mode 
-------------------------------------------------------
0 | loss         | RMSE          | 0      | train
1 | padder_train | ConstantPad1d | 0      | train
2 | scaler       | TemporalNorm  | 0      | train
3 | blocks       | ModuleList    | 2.5 M  | train
-------------------------------------------------------
2.5 M     Trainable params
0         Non-trainable params
2.5 M     Total params
9.884     Total estimated model params size (MB)
34        Modules in train mode
0         Modules in eval mode
SLURM auto-requeueing enabled. Setting signal handlers.
`Trainer.fit` stopped: `max_steps=800.0` reached.
[I 2025-01-14 19:26:48,654] Trial 6 finished with value: 5268.30517578125 and parameters: {'n_pool_kernel_size': [4, 4, 4], 'n_freq_downsample': [168, 24, 1], 'learning_rate': 0.004576030357441512, 'scaler_type': None, 'max_steps': 800.0, 'batch_size': 256, 'windows_batch_size': 512, 'random_seed': 20, 'input_size': 48, 'step_size': 24}. Best is trial 0 with value: 2288.636962890625.
[rank: 0] Seed set to 17
GPU available: True (cuda), used: True
TPU available: False, using: 0 TPU cores
HPU available: False, using: 0 HPUs
LOCAL_RANK: 0 - CUDA_VISIBLE_DEVICES: [0,1,2,3,4,5,6,7]

  | Name         | Type          | Params | Mode 
-------------------------------------------------------
0 | loss         | RMSE          | 0      | train
1 | padder_train | ConstantPad1d | 0      | train
2 | scaler       | TemporalNorm  | 0      | train
3 | blocks       | ModuleList    | 2.5 M  | train
-------------------------------------------------------
2.5 M     Trainable params
0         Non-trainable params
2.5 M     Total params
10.184    Total estimated model params size (MB)
34        Modules in train mode
0         Modules in eval mode
SLURM auto-requeueing enabled. Setting signal handlers.
`Trainer.fit` stopped: `max_steps=500.0` reached.
[I 2025-01-14 19:26:58,026] Trial 7 finished with value: 1475.9033203125 and parameters: {'n_pool_kernel_size': [2, 2, 2], 'n_freq_downsample': [60, 8, 1], 'learning_rate': 0.002862200088658155, 'scaler_type': 'robust', 'max_steps': 500.0, 'batch_size': 64, 'windows_batch_size': 512, 'random_seed': 17, 'input_size': 72, 'step_size': 24}. Best is trial 7 with value: 1475.9033203125.
[rank: 0] Seed set to 15
GPU available: True (cuda), used: True
TPU available: False, using: 0 TPU cores
HPU available: False, using: 0 HPUs
LOCAL_RANK: 0 - CUDA_VISIBLE_DEVICES: [0,1,2,3,4,5,6,7]

  | Name         | Type          | Params | Mode 
-------------------------------------------------------
0 | loss         | RMSE          | 0      | train
1 | padder_train | ConstantPad1d | 0      | train
2 | scaler       | TemporalNorm  | 0      | train
3 | blocks       | ModuleList    | 2.5 M  | train
-------------------------------------------------------
2.5 M     Trainable params
0         Non-trainable params
2.5 M     Total params
10.161    Total estimated model params size (MB)
34        Modules in train mode
0         Modules in eval mode
SLURM auto-requeueing enabled. Setting signal handlers.
`Trainer.fit` stopped: `max_steps=1100.0` reached.
[I 2025-01-14 19:27:17,852] Trial 8 finished with value: 1343.7330322265625 and parameters: {'n_pool_kernel_size': [8, 4, 1], 'n_freq_downsample': [180, 60, 1], 'learning_rate': 0.0006170277638231491, 'scaler_type': 'standard', 'max_steps': 1100.0, 'batch_size': 256, 'windows_batch_size': 128, 'random_seed': 15, 'input_size': 72, 'step_size': 24}. Best is trial 8 with value: 1343.7330322265625.
[rank: 0] Seed set to 13
GPU available: True (cuda), used: True
TPU available: False, using: 0 TPU cores
HPU available: False, using: 0 HPUs
LOCAL_RANK: 0 - CUDA_VISIBLE_DEVICES: [0,1,2,3,4,5,6,7]

  | Name         | Type          | Params | Mode 
-------------------------------------------------------
0 | loss         | RMSE          | 0      | train
1 | padder_train | ConstantPad1d | 0      | train
2 | scaler       | TemporalNorm  | 0      | train
3 | blocks       | ModuleList    | 2.4 M  | train
-------------------------------------------------------
2.4 M     Trainable params
0         Non-trainable params
2.4 M     Total params
9.737     Total estimated model params size (MB)
34        Modules in train mode
0         Modules in eval mode
SLURM auto-requeueing enabled. Setting signal handlers.
`Trainer.fit` stopped: `max_steps=1200.0` reached.
[I 2025-01-14 19:27:40,596] Trial 9 finished with value: 2433.627197265625 and parameters: {'n_pool_kernel_size': [2, 2, 2], 'n_freq_downsample': [168, 24, 1], 'learning_rate': 0.0006267967715930213, 'scaler_type': 'robust', 'max_steps': 1200.0, 'batch_size': 256, 'windows_batch_size': 1024, 'random_seed': 13, 'input_size': 24, 'step_size': 24}. Best is trial 8 with value: 1343.7330322265625.
[rank: 0] Seed set to 5
GPU available: True (cuda), used: True
TPU available: False, using: 0 TPU cores
HPU available: False, using: 0 HPUs
LOCAL_RANK: 0 - CUDA_VISIBLE_DEVICES: [0,1,2,3,4,5,6,7]

  | Name         | Type          | Params | Mode 
-------------------------------------------------------
0 | loss         | RMSE          | 0      | train
1 | padder_train | ConstantPad1d | 0      | train
2 | scaler       | TemporalNorm  | 0      | train
3 | blocks       | ModuleList    | 2.6 M  | train
-------------------------------------------------------
2.6 M     Trainable params
0         Non-trainable params
2.6 M     Total params
10.592    Total estimated model params size (MB)
34        Modules in train mode
0         Modules in eval mode
SLURM auto-requeueing enabled. Setting signal handlers.
`Trainer.fit` stopped: `max_steps=1000.0` reached.
[I 2025-01-14 19:27:59,321] Trial 10 finished with value: 2798.63037109375 and parameters: {'n_pool_kernel_size': [8, 4, 1], 'n_freq_downsample': [180, 60, 1], 'learning_rate': 0.0001033781682068154, 'scaler_type': 'standard', 'max_steps': 1000.0, 'batch_size': 128, 'windows_batch_size': 128, 'random_seed': 5, 'input_size': 120, 'step_size': 1}. Best is trial 8 with value: 1343.7330322265625.
[rank: 0] Seed set to 16
GPU available: True (cuda), used: True
TPU available: False, using: 0 TPU cores
HPU available: False, using: 0 HPUs
LOCAL_RANK: 0 - CUDA_VISIBLE_DEVICES: [0,1,2,3,4,5,6,7]

  | Name         | Type          | Params | Mode 
-------------------------------------------------------
0 | loss         | RMSE          | 0      | train
1 | padder_train | ConstantPad1d | 0      | train
2 | scaler       | TemporalNorm  | 0      | train
3 | blocks       | ModuleList    | 2.5 M  | train
-------------------------------------------------------
2.5 M     Trainable params
0         Non-trainable params
2.5 M     Total params
10.180    Total estimated model params size (MB)
34        Modules in train mode
0         Modules in eval mode
SLURM auto-requeueing enabled. Setting signal handlers.
`Trainer.fit` stopped: `max_steps=1000.0` reached.
[I 2025-01-14 19:28:17,566] Trial 11 finished with value: 1370.0169677734375 and parameters: {'n_pool_kernel_size': [2, 2, 2], 'n_freq_downsample': [40, 20, 1], 'learning_rate': 0.001718377862464793, 'scaler_type': 'standard', 'max_steps': 1000.0, 'batch_size': 256, 'windows_batch_size': 128, 'random_seed': 16, 'input_size': 72, 'step_size': 24}. Best is trial 8 with value: 1343.7330322265625.
[rank: 0] Seed set to 15
GPU available: True (cuda), used: True
TPU available: False, using: 0 TPU cores
HPU available: False, using: 0 HPUs
LOCAL_RANK: 0 - CUDA_VISIBLE_DEVICES: [0,1,2,3,4,5,6,7]

  | Name         | Type          | Params | Mode 
-------------------------------------------------------
0 | loss         | RMSE          | 0      | train
1 | padder_train | ConstantPad1d | 0      | train
2 | scaler       | TemporalNorm  | 0      | train
3 | blocks       | ModuleList    | 2.5 M  | train
-------------------------------------------------------
2.5 M     Trainable params
0         Non-trainable params
2.5 M     Total params
10.134    Total estimated model params size (MB)
34        Modules in train mode
0         Modules in eval mode
SLURM auto-requeueing enabled. Setting signal handlers.
`Trainer.fit` stopped: `max_steps=900.0` reached.
[I 2025-01-14 19:28:33,841] Trial 12 finished with value: 1188.0716552734375 and parameters: {'n_pool_kernel_size': [16, 8, 1], 'n_freq_downsample': [40, 20, 1], 'learning_rate': 0.00109920521755388, 'scaler_type': 'standard', 'max_steps': 900.0, 'batch_size': 256, 'windows_batch_size': 128, 'random_seed': 15, 'input_size': 72, 'step_size': 24}. Best is trial 12 with value: 1188.0716552734375.
[rank: 0] Seed set to 15
GPU available: True (cuda), used: True
TPU available: False, using: 0 TPU cores
HPU available: False, using: 0 HPUs
LOCAL_RANK: 0 - CUDA_VISIBLE_DEVICES: [0,1,2,3,4,5,6,7]

  | Name         | Type          | Params | Mode 
-------------------------------------------------------
0 | loss         | RMSE          | 0      | train
1 | padder_train | ConstantPad1d | 0      | train
2 | scaler       | TemporalNorm  | 0      | train
3 | blocks       | ModuleList    | 2.5 M  | train
-------------------------------------------------------
2.5 M     Trainable params
0         Non-trainable params
2.5 M     Total params
10.134    Total estimated model params size (MB)
34        Modules in train mode
0         Modules in eval mode
SLURM auto-requeueing enabled. Setting signal handlers.
`Trainer.fit` stopped: `max_steps=1500.0` reached.
[I 2025-01-14 19:29:00,979] Trial 13 finished with value: 1049.3682861328125 and parameters: {'n_pool_kernel_size': [16, 8, 1], 'n_freq_downsample': [40, 20, 1], 'learning_rate': 0.00020622500187202517, 'scaler_type': 'standard', 'max_steps': 1500.0, 'batch_size': 256, 'windows_batch_size': 128, 'random_seed': 15, 'input_size': 72, 'step_size': 24}. Best is trial 13 with value: 1049.3682861328125.
[rank: 0] Seed set to 13
GPU available: True (cuda), used: True
TPU available: False, using: 0 TPU cores
HPU available: False, using: 0 HPUs
LOCAL_RANK: 0 - CUDA_VISIBLE_DEVICES: [0,1,2,3,4,5,6,7]

  | Name         | Type          | Params | Mode 
-------------------------------------------------------
0 | loss         | RMSE          | 0      | train
1 | padder_train | ConstantPad1d | 0      | train
2 | scaler       | TemporalNorm  | 0      | train
3 | blocks       | ModuleList    | 2.5 M  | train
-------------------------------------------------------
2.5 M     Trainable params
0         Non-trainable params
2.5 M     Total params
10.134    Total estimated model params size (MB)
34        Modules in train mode
0         Modules in eval mode
SLURM auto-requeueing enabled. Setting signal handlers.
`Trainer.fit` stopped: `max_steps=1500.0` reached.
[I 2025-01-14 19:29:28,008] Trial 14 finished with value: 1534.231689453125 and parameters: {'n_pool_kernel_size': [16, 8, 1], 'n_freq_downsample': [40, 20, 1], 'learning_rate': 0.00010311292501169091, 'scaler_type': 'standard', 'max_steps': 1500.0, 'batch_size': 256, 'windows_batch_size': 128, 'random_seed': 13, 'input_size': 72, 'step_size': 1}. Best is trial 13 with value: 1049.3682861328125.
[rank: 0] Seed set to 8
GPU available: True (cuda), used: True
TPU available: False, using: 0 TPU cores
HPU available: False, using: 0 HPUs
LOCAL_RANK: 0 - CUDA_VISIBLE_DEVICES: [0,1,2,3,4,5,6,7]

  | Name         | Type          | Params | Mode 
-------------------------------------------------------
0 | loss         | RMSE          | 0      | train
1 | padder_train | ConstantPad1d | 0      | train
2 | scaler       | TemporalNorm  | 0      | train
3 | blocks       | ModuleList    | 2.6 M  | train
-------------------------------------------------------
2.6 M     Trainable params
0         Non-trainable params
2.6 M     Total params
10.340    Total estimated model params size (MB)
34        Modules in train mode
0         Modules in eval mode
SLURM auto-requeueing enabled. Setting signal handlers.
`Trainer.fit` stopped: `max_steps=900.0` reached.
