[I 2025-01-14 18:37:22,331] Trial 15 finished with value: 6984350.0 and parameters: {'n_pool_kernel_size': [4, 4, 4], 'n_freq_downsample': [40, 20, 1], 'learning_rate': 0.05522518493806252, 'scaler_type': None, 'max_steps': 800.0, 'batch_size': 256, 'windows_batch_size': 1024, 'random_seed': 17, 'input_size': 120, 'step_size': 24}. Best is trial 13 with value: 1399.3955078125.
[rank: 0] Seed set to 16
GPU available: True (cuda), used: True
TPU available: False, using: 0 TPU cores
HPU available: False, using: 0 HPUs
LOCAL_RANK: 0 - CUDA_VISIBLE_DEVICES: [0,1,2,3,4,5,6,7]

  | Name         | Type          | Params | Mode 
-------------------------------------------------------
0 | loss         | RMSE          | 0      | train
1 | padder_train | ConstantPad1d | 0      | train
2 | scaler       | TemporalNorm  | 0      | train
3 | blocks       | ModuleList    | 2.5 M  | train
-------------------------------------------------------
2.5 M     Trainable params
0         Non-trainable params
2.5 M     Total params
10.040    Total estimated model params size (MB)
34        Modules in train mode
0         Modules in eval mode
SLURM auto-requeueing enabled. Setting signal handlers.
`Trainer.fit` stopped: `max_steps=1200.0` reached.
[I 2025-01-14 18:37:43,749] Trial 16 finished with value: 2231008.25 and parameters: {'n_pool_kernel_size': [8, 4, 1], 'n_freq_downsample': [1, 1, 1], 'learning_rate': 0.031520125654265915, 'scaler_type': None, 'max_steps': 1200.0, 'batch_size': 256, 'windows_batch_size': 1024, 'random_seed': 16, 'input_size': 48, 'step_size': 24}. Best is trial 13 with value: 1399.3955078125.
[rank: 0] Seed set to 15
GPU available: True (cuda), used: True
TPU available: False, using: 0 TPU cores
HPU available: False, using: 0 HPUs
LOCAL_RANK: 0 - CUDA_VISIBLE_DEVICES: [0,1,2,3,4,5,6,7]

  | Name         | Type          | Params | Mode 
-------------------------------------------------------
0 | loss         | RMSE          | 0      | train
1 | padder_train | ConstantPad1d | 0      | train
2 | scaler       | TemporalNorm  | 0      | train
3 | blocks       | ModuleList    | 2.6 M  | train
-------------------------------------------------------
2.6 M     Trainable params
0         Non-trainable params
2.6 M     Total params
10.549    Total estimated model params size (MB)
34        Modules in train mode
0         Modules in eval mode
SLURM auto-requeueing enabled. Setting signal handlers.
`Trainer.fit` stopped: `max_steps=700.0` reached.
[I 2025-01-14 18:37:56,139] Trial 17 finished with value: 1878.762451171875 and parameters: {'n_pool_kernel_size': [16, 8, 1], 'n_freq_downsample': [24, 12, 1], 'learning_rate': 0.007069479337059099, 'scaler_type': None, 'max_steps': 700.0, 'batch_size': 128, 'windows_batch_size': 1024, 'random_seed': 15, 'input_size': 120, 'step_size': 24}. Best is trial 13 with value: 1399.3955078125.
[rank: 0] Seed set to 5
GPU available: True (cuda), used: True
TPU available: False, using: 0 TPU cores
HPU available: False, using: 0 HPUs
LOCAL_RANK: 0 - CUDA_VISIBLE_DEVICES: [0,1,2,3,4,5,6,7]

  | Name         | Type          | Params | Mode 
-------------------------------------------------------
0 | loss         | RMSE          | 0      | train
1 | padder_train | ConstantPad1d | 0      | train
2 | scaler       | TemporalNorm  | 0      | train
3 | blocks       | ModuleList    | 2.6 M  | train
-------------------------------------------------------
2.6 M     Trainable params
0         Non-trainable params
2.6 M     Total params
10.549    Total estimated model params size (MB)
34        Modules in train mode
0         Modules in eval mode
SLURM auto-requeueing enabled. Setting signal handlers.
`Trainer.fit` stopped: `max_steps=700.0` reached.
[I 2025-01-14 18:38:08,320] Trial 18 finished with value: 1926.3514404296875 and parameters: {'n_pool_kernel_size': [16, 8, 1], 'n_freq_downsample': [24, 12, 1], 'learning_rate': 0.006698451591048868, 'scaler_type': None, 'max_steps': 700.0, 'batch_size': 256, 'windows_batch_size': 128, 'random_seed': 5, 'input_size': 120, 'step_size': 1}. Best is trial 13 with value: 1399.3955078125.
[rank: 0] Seed set to 16
GPU available: True (cuda), used: True
TPU available: False, using: 0 TPU cores
HPU available: False, using: 0 HPUs
LOCAL_RANK: 0 - CUDA_VISIBLE_DEVICES: [0,1,2,3,4,5,6,7]

  | Name         | Type          | Params | Mode 
-------------------------------------------------------
0 | loss         | RMSE          | 0      | train
1 | padder_train | ConstantPad1d | 0      | train
2 | scaler       | TemporalNorm  | 0      | train
3 | blocks       | ModuleList    | 2.6 M  | train
-------------------------------------------------------
2.6 M     Trainable params
0         Non-trainable params
2.6 M     Total params
10.549    Total estimated model params size (MB)
34        Modules in train mode
0         Modules in eval mode
SLURM auto-requeueing enabled. Setting signal handlers.
`Trainer.fit` stopped: `max_steps=500.0` reached.
[I 2025-01-14 18:38:17,647] Trial 19 finished with value: 8543.5478515625 and parameters: {'n_pool_kernel_size': [16, 8, 1], 'n_freq_downsample': [24, 12, 1], 'learning_rate': 0.026685266559428374, 'scaler_type': 'robust', 'max_steps': 500.0, 'batch_size': 128, 'windows_batch_size': 1024, 'random_seed': 16, 'input_size': 120, 'step_size': 24}. Best is trial 13 with value: 1399.3955078125.
[rank: 0] Seed set to 19
GPU available: True (cuda), used: True
TPU available: False, using: 0 TPU cores
HPU available: False, using: 0 HPUs
LOCAL_RANK: 0 - CUDA_VISIBLE_DEVICES: [0,1,2,3,4,5,6,7]

  | Name         | Type          | Params | Mode 
-------------------------------------------------------
0 | loss         | RMSE          | 0      | train
1 | padder_train | ConstantPad1d | 0      | train
2 | scaler       | TemporalNorm  | 0      | train
3 | blocks       | ModuleList    | 2.6 M  | train
-------------------------------------------------------
2.6 M     Trainable params
0         Non-trainable params
2.6 M     Total params
10.549    Total estimated model params size (MB)
34        Modules in train mode
0         Modules in eval mode
SLURM auto-requeueing enabled. Setting signal handlers.
`Trainer.fit` stopped: `max_steps=700.0` reached.
[I 2025-01-14 18:38:30,068] Trial 20 finished with value: 1742.3831787109375 and parameters: {'n_pool_kernel_size': [16, 8, 1], 'n_freq_downsample': [24, 12, 1], 'learning_rate': 0.004413143556428603, 'scaler_type': None, 'max_steps': 700.0, 'batch_size': 128, 'windows_batch_size': 1024, 'random_seed': 19, 'input_size': 120, 'step_size': 24}. Best is trial 13 with value: 1399.3955078125.
[rank: 0] Seed set to 19
GPU available: True (cuda), used: True
TPU available: False, using: 0 TPU cores
HPU available: False, using: 0 HPUs
LOCAL_RANK: 0 - CUDA_VISIBLE_DEVICES: [0,1,2,3,4,5,6,7]

  | Name         | Type          | Params | Mode 
-------------------------------------------------------
0 | loss         | RMSE          | 0      | train
1 | padder_train | ConstantPad1d | 0      | train
2 | scaler       | TemporalNorm  | 0      | train
3 | blocks       | ModuleList    | 2.6 M  | train
-------------------------------------------------------
2.6 M     Trainable params
0         Non-trainable params
2.6 M     Total params
10.549    Total estimated model params size (MB)
34        Modules in train mode
0         Modules in eval mode
SLURM auto-requeueing enabled. Setting signal handlers.
`Trainer.fit` stopped: `max_steps=700.0` reached.
[I 2025-01-14 18:38:42,468] Trial 21 finished with value: 1389.1646728515625 and parameters: {'n_pool_kernel_size': [16, 8, 1], 'n_freq_downsample': [24, 12, 1], 'learning_rate': 0.005755758842824755, 'scaler_type': None, 'max_steps': 700.0, 'batch_size': 128, 'windows_batch_size': 1024, 'random_seed': 19, 'input_size': 120, 'step_size': 24}. Best is trial 21 with value: 1389.1646728515625.
[rank: 0] Seed set to 19
GPU available: True (cuda), used: True
TPU available: False, using: 0 TPU cores
HPU available: False, using: 0 HPUs
LOCAL_RANK: 0 - CUDA_VISIBLE_DEVICES: [0,1,2,3,4,5,6,7]

  | Name         | Type          | Params | Mode 
-------------------------------------------------------
0 | loss         | RMSE          | 0      | train
1 | padder_train | ConstantPad1d | 0      | train
2 | scaler       | TemporalNorm  | 0      | train
3 | blocks       | ModuleList    | 2.6 M  | train
-------------------------------------------------------
2.6 M     Trainable params
0         Non-trainable params
2.6 M     Total params
10.549    Total estimated model params size (MB)
34        Modules in train mode
0         Modules in eval mode
SLURM auto-requeueing enabled. Setting signal handlers.
`Trainer.fit` stopped: `max_steps=700.0` reached.
[I 2025-01-14 18:38:54,920] Trial 22 finished with value: 1682.1534423828125 and parameters: {'n_pool_kernel_size': [16, 8, 1], 'n_freq_downsample': [24, 12, 1], 'learning_rate': 0.004763331896545867, 'scaler_type': None, 'max_steps': 700.0, 'batch_size': 128, 'windows_batch_size': 1024, 'random_seed': 19, 'input_size': 120, 'step_size': 24}. Best is trial 21 with value: 1389.1646728515625.
[rank: 0] Seed set to 18
GPU available: True (cuda), used: True
TPU available: False, using: 0 TPU cores
HPU available: False, using: 0 HPUs
LOCAL_RANK: 0 - CUDA_VISIBLE_DEVICES: [0,1,2,3,4,5,6,7]

  | Name         | Type          | Params | Mode 
-------------------------------------------------------
0 | loss         | RMSE          | 0      | train
1 | padder_train | ConstantPad1d | 0      | train
2 | scaler       | TemporalNorm  | 0      | train
3 | blocks       | ModuleList    | 2.6 M  | train
-------------------------------------------------------
2.6 M     Trainable params
0         Non-trainable params
2.6 M     Total params
10.549    Total estimated model params size (MB)
34        Modules in train mode
0         Modules in eval mode
SLURM auto-requeueing enabled. Setting signal handlers.
`Trainer.fit` stopped: `max_steps=800.0` reached.
[I 2025-01-14 18:39:09,357] Trial 23 finished with value: 1971.3731689453125 and parameters: {'n_pool_kernel_size': [16, 8, 1], 'n_freq_downsample': [24, 12, 1], 'learning_rate': 0.00164079706025899, 'scaler_type': None, 'max_steps': 800.0, 'batch_size': 128, 'windows_batch_size': 1024, 'random_seed': 18, 'input_size': 120, 'step_size': 24}. Best is trial 21 with value: 1389.1646728515625.
[rank: 0] Seed set to 20
GPU available: True (cuda), used: True
TPU available: False, using: 0 TPU cores
HPU available: False, using: 0 HPUs
LOCAL_RANK: 0 - CUDA_VISIBLE_DEVICES: [0,1,2,3,4,5,6,7]

  | Name         | Type          | Params | Mode 
-------------------------------------------------------
0 | loss         | RMSE          | 0      | train
1 | padder_train | ConstantPad1d | 0      | train
2 | scaler       | TemporalNorm  | 0      | train
3 | blocks       | ModuleList    | 2.5 M  | train
-------------------------------------------------------
2.5 M     Trainable params
0         Non-trainable params
2.5 M     Total params
10.134    Total estimated model params size (MB)
34        Modules in train mode
0         Modules in eval mode
SLURM auto-requeueing enabled. Setting signal handlers.
`Trainer.fit` stopped: `max_steps=600.0` reached.
[I 2025-01-14 18:39:19,985] Trial 24 finished with value: 9494.1611328125 and parameters: {'n_pool_kernel_size': [16, 8, 1], 'n_freq_downsample': [168, 24, 1], 'learning_rate': 0.020186156824977673, 'scaler_type': None, 'max_steps': 600.0, 'batch_size': 256, 'windows_batch_size': 1024, 'random_seed': 20, 'input_size': 72, 'step_size': 24}. Best is trial 21 with value: 1389.1646728515625.
[rank: 0] Seed set to 18
GPU available: True (cuda), used: True
TPU available: False, using: 0 TPU cores
HPU available: False, using: 0 HPUs
LOCAL_RANK: 0 - CUDA_VISIBLE_DEVICES: [0,1,2,3,4,5,6,7]

  | Name         | Type          | Params | Mode 
-------------------------------------------------------
0 | loss         | RMSE          | 0      | train
1 | padder_train | ConstantPad1d | 0      | train
2 | scaler       | TemporalNorm  | 0      | train
3 | blocks       | ModuleList    | 2.7 M  | train
-------------------------------------------------------
2.7 M     Trainable params
0         Non-trainable params
2.7 M     Total params
10.641    Total estimated model params size (MB)
34        Modules in train mode
0         Modules in eval mode
SLURM auto-requeueing enabled. Setting signal handlers.
`Trainer.fit` stopped: `max_steps=900.0` reached.
[I 2025-01-14 18:39:36,127] Trial 25 finished with value: 2020.8480224609375 and parameters: {'n_pool_kernel_size': [16, 8, 1], 'n_freq_downsample': [1, 1, 1], 'learning_rate': 0.00764584316191922, 'scaler_type': None, 'max_steps': 900.0, 'batch_size': 128, 'windows_batch_size': 1024, 'random_seed': 18, 'input_size': 120, 'step_size': 24}. Best is trial 21 with value: 1389.1646728515625.
[rank: 0] Seed set to 20
GPU available: True (cuda), used: True
TPU available: False, using: 0 TPU cores
HPU available: False, using: 0 HPUs
LOCAL_RANK: 0 - CUDA_VISIBLE_DEVICES: [0,1,2,3,4,5,6,7]

  | Name         | Type          | Params | Mode 
-------------------------------------------------------
0 | loss         | RMSE          | 0      | train
1 | padder_train | ConstantPad1d | 0      | train
2 | scaler       | TemporalNorm  | 0      | train
3 | blocks       | ModuleList    | 2.7 M  | train
-------------------------------------------------------
2.7 M     Trainable params
0         Non-trainable params
2.7 M     Total params
10.622    Total estimated model params size (MB)
34        Modules in train mode
0         Modules in eval mode
SLURM auto-requeueing enabled. Setting signal handlers.
`Trainer.fit` stopped: `max_steps=700.0` reached.
[I 2025-01-14 18:39:48,835] Trial 26 finished with value: 2282.515380859375 and parameters: {'n_pool_kernel_size': [2, 2, 2], 'n_freq_downsample': [40, 20, 1], 'learning_rate': 0.00475406977984097, 'scaler_type': None, 'max_steps': 700.0, 'batch_size': 128, 'windows_batch_size': 128, 'random_seed': 20, 'input_size': 120, 'step_size': 1}. Best is trial 21 with value: 1389.1646728515625.
[rank: 0] Seed set to 18
GPU available: True (cuda), used: True
TPU available: False, using: 0 TPU cores
HPU available: False, using: 0 HPUs
LOCAL_RANK: 0 - CUDA_VISIBLE_DEVICES: [0,1,2,3,4,5,6,7]

  | Name         | Type          | Params | Mode 
-------------------------------------------------------
0 | loss         | RMSE          | 0      | train
1 | padder_train | ConstantPad1d | 0      | train
2 | scaler       | TemporalNorm  | 0      | train
3 | blocks       | ModuleList    | 2.7 M  | train
-------------------------------------------------------
2.7 M     Trainable params
0         Non-trainable params
2.7 M     Total params
10.747    Total estimated model params size (MB)
34        Modules in train mode
0         Modules in eval mode
SLURM auto-requeueing enabled. Setting signal handlers.
`Trainer.fit` stopped: `max_steps=800.0` reached.
[I 2025-01-14 18:40:02,964] Trial 27 finished with value: 1602.3436279296875 and parameters: {'n_pool_kernel_size': [2, 2, 1], 'n_freq_downsample': [24, 12, 1], 'learning_rate': 0.0011336465919913347, 'scaler_type': None, 'max_steps': 800.0, 'batch_size': 256, 'windows_batch_size': 256, 'random_seed': 18, 'input_size': 120, 'step_size': 24}. Best is trial 21 with value: 1389.1646728515625.
[rank: 0] Seed set to 16
GPU available: True (cuda), used: True
TPU available: False, using: 0 TPU cores
HPU available: False, using: 0 HPUs
LOCAL_RANK: 0 - CUDA_VISIBLE_DEVICES: [0,1,2,3,4,5,6,7]

  | Name         | Type          | Params | Mode 
-------------------------------------------------------
0 | loss         | RMSE          | 0      | train
1 | padder_train | ConstantPad1d | 0      | train
2 | scaler       | TemporalNorm  | 0      | train
3 | blocks       | ModuleList    | 2.7 M  | train
-------------------------------------------------------
2.7 M     Trainable params
0         Non-trainable params
2.7 M     Total params
10.747    Total estimated model params size (MB)
34        Modules in train mode
0         Modules in eval mode
SLURM auto-requeueing enabled. Setting signal handlers.
`Trainer.fit` stopped: `max_steps=900.0` reached.
[I 2025-01-14 18:40:19,193] Trial 28 finished with value: 1829.1112060546875 and parameters: {'n_pool_kernel_size': [2, 2, 1], 'n_freq_downsample': [24, 12, 1], 'learning_rate': 0.0009357674987540953, 'scaler_type': 'standard', 'max_steps': 900.0, 'batch_size': 256, 'windows_batch_size': 256, 'random_seed': 16, 'input_size': 120, 'step_size': 24}. Best is trial 21 with value: 1389.1646728515625.
[rank: 0] Seed set to 13
GPU available: True (cuda), used: True
TPU available: False, using: 0 TPU cores
HPU available: False, using: 0 HPUs
LOCAL_RANK: 0 - CUDA_VISIBLE_DEVICES: [0,1,2,3,4,5,6,7]

  | Name         | Type          | Params | Mode 
-------------------------------------------------------
0 | loss         | RMSE          | 0      | train
1 | padder_train | ConstantPad1d | 0      | train
2 | scaler       | TemporalNorm  | 0      | train
3 | blocks       | ModuleList    | 2.6 M  | train
-------------------------------------------------------
2.6 M     Trainable params
0         Non-trainable params
2.6 M     Total params
10.255    Total estimated model params size (MB)
34        Modules in train mode
0         Modules in eval mode
SLURM auto-requeueing enabled. Setting signal handlers.
`Trainer.fit` stopped: `max_steps=800.0` reached.
[I 2025-01-14 18:40:33,963] Trial 29 finished with value: 3904.898193359375 and parameters: {'n_pool_kernel_size': [2, 2, 1], 'n_freq_downsample': [24, 12, 1], 'learning_rate': 0.0025456773921587374, 'scaler_type': 'robust', 'max_steps': 800.0, 'batch_size': 256, 'windows_batch_size': 256, 'random_seed': 13, 'input_size': 72, 'step_size': 1}. Best is trial 21 with value: 1389.1646728515625.
[rank: 0] Seed set to 15
GPU available: True (cuda), used: True
TPU available: False, using: 0 TPU cores
HPU available: False, using: 0 HPUs
LOCAL_RANK: 0 - CUDA_VISIBLE_DEVICES: [0,1,2,3,4,5,6,7]

  | Name         | Type          | Params | Mode 
-------------------------------------------------------
0 | loss         | RMSE          | 0      | train
1 | padder_train | ConstantPad1d | 0      | train
2 | scaler       | TemporalNorm  | 0      | train
3 | blocks       | ModuleList    | 2.7 M  | train
-------------------------------------------------------
2.7 M     Trainable params
0         Non-trainable params
2.7 M     Total params
10.747    Total estimated model params size (MB)
34        Modules in train mode
0         Modules in eval mode
SLURM auto-requeueing enabled. Setting signal handlers.
`Trainer.fit` stopped: `max_steps=600.0` reached.
[I 2025-01-14 18:40:44,498] Trial 30 finished with value: 1517.753662109375 and parameters: {'n_pool_kernel_size': [2, 2, 1], 'n_freq_downsample': [24, 12, 1], 'learning_rate': 0.00018162723867116924, 'scaler_type': None, 'max_steps': 600.0, 'batch_size': 256, 'windows_batch_size': 512, 'random_seed': 15, 'input_size': 120, 'step_size': 24}. Best is trial 21 with value: 1389.1646728515625.
[rank: 0] Seed set to 15
GPU available: True (cuda), used: True
TPU available: False, using: 0 TPU cores
HPU available: False, using: 0 HPUs
LOCAL_RANK: 0 - CUDA_VISIBLE_DEVICES: [0,1,2,3,4,5,6,7]

  | Name         | Type          | Params | Mode 
-------------------------------------------------------
0 | loss         | RMSE          | 0      | train
1 | padder_train | ConstantPad1d | 0      | train
2 | scaler       | TemporalNorm  | 0      | train
3 | blocks       | ModuleList    | 2.7 M  | train
-------------------------------------------------------
2.7 M     Trainable params
0         Non-trainable params
2.7 M     Total params
10.747    Total estimated model params size (MB)
34        Modules in train mode
0         Modules in eval mode
SLURM auto-requeueing enabled. Setting signal handlers.
`Trainer.fit` stopped: `max_steps=600.0` reached.
[I 2025-01-14 18:40:55,222] Trial 31 finished with value: 1546.451171875 and parameters: {'n_pool_kernel_size': [2, 2, 1], 'n_freq_downsample': [24, 12, 1], 'learning_rate': 0.00012763252994688547, 'scaler_type': None, 'max_steps': 600.0, 'batch_size': 256, 'windows_batch_size': 512, 'random_seed': 15, 'input_size': 120, 'step_size': 24}. Best is trial 21 with value: 1389.1646728515625.
[rank: 0] Seed set to 14
GPU available: True (cuda), used: True
TPU available: False, using: 0 TPU cores
HPU available: False, using: 0 HPUs
LOCAL_RANK: 0 - CUDA_VISIBLE_DEVICES: [0,1,2,3,4,5,6,7]

  | Name         | Type          | Params | Mode 
-------------------------------------------------------
0 | loss         | RMSE          | 0      | train
1 | padder_train | ConstantPad1d | 0      | train
2 | scaler       | TemporalNorm  | 0      | train
3 | blocks       | ModuleList    | 2.7 M  | train
-------------------------------------------------------
2.7 M     Trainable params
0         Non-trainable params
2.7 M     Total params
10.747    Total estimated model params size (MB)
34        Modules in train mode
0         Modules in eval mode
SLURM auto-requeueing enabled. Setting signal handlers.
`Trainer.fit` stopped: `max_steps=500.0` reached.
