[I 2025-01-14 16:26:10,688] Trial 32 finished with value: 1848.2713623046875 and parameters: {'n_pool_kernel_size': [2, 2, 1], 'n_freq_downsample': [180, 60, 1], 'learning_rate': 0.00016076541377361224, 'scaler_type': 'standard', 'max_steps': 1300.0, 'batch_size': 128, 'windows_batch_size': 256, 'random_seed': 5, 'input_size': 24, 'step_size': 1}. Best is trial 8 with value: 967.596435546875.
[rank: 0] Seed set to 8
GPU available: True (cuda), used: True
TPU available: False, using: 0 TPU cores
HPU available: False, using: 0 HPUs
LOCAL_RANK: 0 - CUDA_VISIBLE_DEVICES: [0,1,2,3,4,5,6,7]

  | Name         | Type          | Params | Mode 
-------------------------------------------------------
0 | loss         | RMSE          | 0      | train
1 | padder_train | ConstantPad1d | 0      | train
2 | scaler       | TemporalNorm  | 0      | train
3 | blocks       | ModuleList    | 2.6 M  | train
-------------------------------------------------------
2.6 M     Trainable params
0         Non-trainable params
2.6 M     Total params
10.499    Total estimated model params size (MB)
34        Modules in train mode
0         Modules in eval mode
SLURM auto-requeueing enabled. Setting signal handlers.
`Trainer.fit` stopped: `max_steps=1200.0` reached.
[I 2025-01-14 16:26:31,821] Trial 33 finished with value: 2367.996826171875 and parameters: {'n_pool_kernel_size': [2, 2, 1], 'n_freq_downsample': [180, 60, 1], 'learning_rate': 0.0002895565757540312, 'scaler_type': 'standard', 'max_steps': 1200.0, 'batch_size': 128, 'windows_batch_size': 256, 'random_seed': 8, 'input_size': 96, 'step_size': 1}. Best is trial 8 with value: 967.596435546875.
[rank: 0] Seed set to 8
GPU available: True (cuda), used: True
TPU available: False, using: 0 TPU cores
HPU available: False, using: 0 HPUs
LOCAL_RANK: 0 - CUDA_VISIBLE_DEVICES: [0,1,2,3,4,5,6,7]

  | Name         | Type          | Params | Mode 
-------------------------------------------------------
0 | loss         | RMSE          | 0      | train
1 | padder_train | ConstantPad1d | 0      | train
2 | scaler       | TemporalNorm  | 0      | train
3 | blocks       | ModuleList    | 2.4 M  | train
-------------------------------------------------------
2.4 M     Trainable params
0         Non-trainable params
2.4 M     Total params
9.700     Total estimated model params size (MB)
34        Modules in train mode
0         Modules in eval mode
SLURM auto-requeueing enabled. Setting signal handlers.
`Trainer.fit` stopped: `max_steps=1100.0` reached.
[I 2025-01-14 16:26:52,026] Trial 34 finished with value: 2810.51171875 and parameters: {'n_pool_kernel_size': [4, 4, 4], 'n_freq_downsample': [180, 60, 1], 'learning_rate': 0.00013948592046328075, 'scaler_type': 'standard', 'max_steps': 1100.0, 'batch_size': 256, 'windows_batch_size': 256, 'random_seed': 8, 'input_size': 24, 'step_size': 1}. Best is trial 8 with value: 967.596435546875.
[rank: 0] Seed set to 6
GPU available: True (cuda), used: True
TPU available: False, using: 0 TPU cores
HPU available: False, using: 0 HPUs
LOCAL_RANK: 0 - CUDA_VISIBLE_DEVICES: [0,1,2,3,4,5,6,7]

  | Name         | Type          | Params | Mode 
-------------------------------------------------------
0 | loss         | RMSE          | 0      | train
1 | padder_train | ConstantPad1d | 0      | train
2 | scaler       | TemporalNorm  | 0      | train
3 | blocks       | ModuleList    | 2.7 M  | train
-------------------------------------------------------
2.7 M     Trainable params
0         Non-trainable params
2.7 M     Total params
10.745    Total estimated model params size (MB)
34        Modules in train mode
0         Modules in eval mode
SLURM auto-requeueing enabled. Setting signal handlers.
`Trainer.fit` stopped: `max_steps=1300.0` reached.
[I 2025-01-14 16:27:14,165] Trial 35 finished with value: 2216.00439453125 and parameters: {'n_pool_kernel_size': [2, 2, 1], 'n_freq_downsample': [168, 24, 1], 'learning_rate': 0.0010051412236447522, 'scaler_type': None, 'max_steps': 1300.0, 'batch_size': 128, 'windows_batch_size': 256, 'random_seed': 6, 'input_size': 120, 'step_size': 1}. Best is trial 8 with value: 967.596435546875.
[rank: 0] Seed set to 3
GPU available: True (cuda), used: True
TPU available: False, using: 0 TPU cores
HPU available: False, using: 0 HPUs
LOCAL_RANK: 0 - CUDA_VISIBLE_DEVICES: [0,1,2,3,4,5,6,7]

  | Name         | Type          | Params | Mode 
-------------------------------------------------------
0 | loss         | RMSE          | 0      | train
1 | padder_train | ConstantPad1d | 0      | train
2 | scaler       | TemporalNorm  | 0      | train
3 | blocks       | ModuleList    | 2.4 M  | train
-------------------------------------------------------
2.4 M     Trainable params
0         Non-trainable params
2.4 M     Total params
9.702     Total estimated model params size (MB)
34        Modules in train mode
0         Modules in eval mode
SLURM auto-requeueing enabled. Setting signal handlers.
`Trainer.fit` stopped: `max_steps=500.0` reached.
[I 2025-01-14 16:27:23,054] Trial 36 finished with value: 2517.836181640625 and parameters: {'n_pool_kernel_size': [4, 4, 4], 'n_freq_downsample': [24, 12, 1], 'learning_rate': 0.007154619255544134, 'scaler_type': 'standard', 'max_steps': 500.0, 'batch_size': 256, 'windows_batch_size': 1024, 'random_seed': 3, 'input_size': 24, 'step_size': 1}. Best is trial 8 with value: 967.596435546875.
[rank: 0] Seed set to 10
GPU available: True (cuda), used: True
TPU available: False, using: 0 TPU cores
HPU available: False, using: 0 HPUs
LOCAL_RANK: 0 - CUDA_VISIBLE_DEVICES: [0,1,2,3,4,5,6,7]

  | Name         | Type          | Params | Mode 
-------------------------------------------------------
0 | loss         | RMSE          | 0      | train
1 | padder_train | ConstantPad1d | 0      | train
2 | scaler       | TemporalNorm  | 0      | train
3 | blocks       | ModuleList    | 2.6 M  | train
-------------------------------------------------------
2.6 M     Trainable params
0         Non-trainable params
2.6 M     Total params
10.401    Total estimated model params size (MB)
34        Modules in train mode
0         Modules in eval mode
SLURM auto-requeueing enabled. Setting signal handlers.
`Trainer.fit` stopped: `max_steps=1400.0` reached.
[I 2025-01-14 16:27:46,788] Trial 37 finished with value: 1557.531005859375 and parameters: {'n_pool_kernel_size': [1, 1, 1], 'n_freq_downsample': [168, 24, 1], 'learning_rate': 0.01397281433919862, 'scaler_type': 'standard', 'max_steps': 1400.0, 'batch_size': 128, 'windows_batch_size': 512, 'random_seed': 10, 'input_size': 72, 'step_size': 24}. Best is trial 8 with value: 967.596435546875.
[rank: 0] Seed set to 13
GPU available: True (cuda), used: True
TPU available: False, using: 0 TPU cores
HPU available: False, using: 0 HPUs
LOCAL_RANK: 0 - CUDA_VISIBLE_DEVICES: [0,1,2,3,4,5,6,7]

  | Name         | Type          | Params | Mode 
-------------------------------------------------------
0 | loss         | RMSE          | 0      | train
1 | padder_train | ConstantPad1d | 0      | train
2 | scaler       | TemporalNorm  | 0      | train
3 | blocks       | ModuleList    | 2.6 M  | train
-------------------------------------------------------
2.6 M     Trainable params
0         Non-trainable params
2.6 M     Total params
10.403    Total estimated model params size (MB)
34        Modules in train mode
0         Modules in eval mode
SLURM auto-requeueing enabled. Setting signal handlers.
`Trainer.fit` stopped: `max_steps=1200.0` reached.
[I 2025-01-14 16:28:06,509] Trial 38 finished with value: 2267.59619140625 and parameters: {'n_pool_kernel_size': [2, 2, 2], 'n_freq_downsample': [24, 12, 1], 'learning_rate': 0.00047380723689653844, 'scaler_type': None, 'max_steps': 1200.0, 'batch_size': 128, 'windows_batch_size': 128, 'random_seed': 13, 'input_size': 96, 'step_size': 24}. Best is trial 8 with value: 967.596435546875.
[rank: 0] Seed set to 11
GPU available: True (cuda), used: True
TPU available: False, using: 0 TPU cores
HPU available: False, using: 0 HPUs
LOCAL_RANK: 0 - CUDA_VISIBLE_DEVICES: [0,1,2,3,4,5,6,7]

  | Name         | Type          | Params | Mode 
-------------------------------------------------------
0 | loss         | RMSE          | 0      | train
1 | padder_train | ConstantPad1d | 0      | train
2 | scaler       | TemporalNorm  | 0      | train
3 | blocks       | ModuleList    | 2.6 M  | train
-------------------------------------------------------
2.6 M     Trainable params
0         Non-trainable params
2.6 M     Total params
10.547    Total estimated model params size (MB)
34        Modules in train mode
0         Modules in eval mode
SLURM auto-requeueing enabled. Setting signal handlers.
`Trainer.fit` stopped: `max_steps=1000.0` reached.
[I 2025-01-14 16:28:23,491] Trial 39 finished with value: 2236.50634765625 and parameters: {'n_pool_kernel_size': [16, 8, 1], 'n_freq_downsample': [180, 60, 1], 'learning_rate': 0.00016422485270473246, 'scaler_type': 'standard', 'max_steps': 1000.0, 'batch_size': 256, 'windows_batch_size': 128, 'random_seed': 11, 'input_size': 120, 'step_size': 1}. Best is trial 8 with value: 967.596435546875.
[rank: 0] Seed set to 6
GPU available: True (cuda), used: True
TPU available: False, using: 0 TPU cores
HPU available: False, using: 0 HPUs
LOCAL_RANK: 0 - CUDA_VISIBLE_DEVICES: [0,1,2,3,4,5,6,7]

  | Name         | Type          | Params | Mode 
-------------------------------------------------------
0 | loss         | RMSE          | 0      | train
1 | padder_train | ConstantPad1d | 0      | train
2 | scaler       | TemporalNorm  | 0      | train
3 | blocks       | ModuleList    | 2.4 M  | train
-------------------------------------------------------
2.4 M     Trainable params
0         Non-trainable params
2.4 M     Total params
9.761     Total estimated model params size (MB)
34        Modules in train mode
0         Modules in eval mode
SLURM auto-requeueing enabled. Setting signal handlers.
`Trainer.fit` stopped: `max_steps=1100.0` reached.
[I 2025-01-14 16:28:42,503] Trial 40 finished with value: 1853.08154296875 and parameters: {'n_pool_kernel_size': [2, 2, 1], 'n_freq_downsample': [40, 20, 1], 'learning_rate': 0.002310027404393523, 'scaler_type': 'robust', 'max_steps': 1100.0, 'batch_size': 128, 'windows_batch_size': 256, 'random_seed': 6, 'input_size': 24, 'step_size': 24}. Best is trial 8 with value: 967.596435546875.
[rank: 0] Seed set to 8
GPU available: True (cuda), used: True
TPU available: False, using: 0 TPU cores
HPU available: False, using: 0 HPUs
LOCAL_RANK: 0 - CUDA_VISIBLE_DEVICES: [0,1,2,3,4,5,6,7]

  | Name         | Type          | Params | Mode 
-------------------------------------------------------
0 | loss         | RMSE          | 0      | train
1 | padder_train | ConstantPad1d | 0      | train
2 | scaler       | TemporalNorm  | 0      | train
3 | blocks       | ModuleList    | 2.4 M  | train
-------------------------------------------------------
2.4 M     Trainable params
0         Non-trainable params
2.4 M     Total params
9.761     Total estimated model params size (MB)
34        Modules in train mode
0         Modules in eval mode
SLURM auto-requeueing enabled. Setting signal handlers.
`Trainer.fit` stopped: `max_steps=1200.0` reached.
[I 2025-01-14 16:29:03,012] Trial 41 finished with value: 1489.619140625 and parameters: {'n_pool_kernel_size': [2, 2, 1], 'n_freq_downsample': [180, 60, 1], 'learning_rate': 0.00010147410670837925, 'scaler_type': 'standard', 'max_steps': 1200.0, 'batch_size': 128, 'windows_batch_size': 256, 'random_seed': 8, 'input_size': 24, 'step_size': 1}. Best is trial 8 with value: 967.596435546875.
[rank: 0] Seed set to 7
GPU available: True (cuda), used: True
TPU available: False, using: 0 TPU cores
HPU available: False, using: 0 HPUs
LOCAL_RANK: 0 - CUDA_VISIBLE_DEVICES: [0,1,2,3,4,5,6,7]

  | Name         | Type          | Params | Mode 
-------------------------------------------------------
0 | loss         | RMSE          | 0      | train
1 | padder_train | ConstantPad1d | 0      | train
2 | scaler       | TemporalNorm  | 0      | train
3 | blocks       | ModuleList    | 2.4 M  | train
-------------------------------------------------------
2.4 M     Trainable params
0         Non-trainable params
2.4 M     Total params
9.761     Total estimated model params size (MB)
34        Modules in train mode
0         Modules in eval mode
SLURM auto-requeueing enabled. Setting signal handlers.
`Trainer.fit` stopped: `max_steps=1200.0` reached.
[I 2025-01-14 16:29:23,503] Trial 42 finished with value: 1449.420166015625 and parameters: {'n_pool_kernel_size': [2, 2, 1], 'n_freq_downsample': [180, 60, 1], 'learning_rate': 0.00010987165189645458, 'scaler_type': 'standard', 'max_steps': 1200.0, 'batch_size': 128, 'windows_batch_size': 256, 'random_seed': 7, 'input_size': 24, 'step_size': 1}. Best is trial 8 with value: 967.596435546875.
[rank: 0] Seed set to 9
GPU available: True (cuda), used: True
TPU available: False, using: 0 TPU cores
HPU available: False, using: 0 HPUs
LOCAL_RANK: 0 - CUDA_VISIBLE_DEVICES: [0,1,2,3,4,5,6,7]

  | Name         | Type          | Params | Mode 
-------------------------------------------------------
0 | loss         | RMSE          | 0      | train
1 | padder_train | ConstantPad1d | 0      | train
2 | scaler       | TemporalNorm  | 0      | train
3 | blocks       | ModuleList    | 2.4 M  | train
-------------------------------------------------------
2.4 M     Trainable params
0         Non-trainable params
2.4 M     Total params
9.761     Total estimated model params size (MB)
34        Modules in train mode
0         Modules in eval mode
SLURM auto-requeueing enabled. Setting signal handlers.
`Trainer.fit` stopped: `max_steps=1300.0` reached.
[I 2025-01-14 16:29:45,770] Trial 43 finished with value: 2035.1768798828125 and parameters: {'n_pool_kernel_size': [2, 2, 1], 'n_freq_downsample': [180, 60, 1], 'learning_rate': 0.0002890966852317255, 'scaler_type': 'standard', 'max_steps': 1300.0, 'batch_size': 128, 'windows_batch_size': 256, 'random_seed': 9, 'input_size': 24, 'step_size': 1}. Best is trial 8 with value: 967.596435546875.
[rank: 0] Seed set to 7
GPU available: True (cuda), used: True
TPU available: False, using: 0 TPU cores
HPU available: False, using: 0 HPUs
LOCAL_RANK: 0 - CUDA_VISIBLE_DEVICES: [0,1,2,3,4,5,6,7]

  | Name         | Type          | Params | Mode 
-------------------------------------------------------
0 | loss         | RMSE          | 0      | train
1 | padder_train | ConstantPad1d | 0      | train
2 | scaler       | TemporalNorm  | 0      | train
3 | blocks       | ModuleList    | 2.4 M  | train
-------------------------------------------------------
2.4 M     Trainable params
0         Non-trainable params
2.4 M     Total params
9.765     Total estimated model params size (MB)
34        Modules in train mode
0         Modules in eval mode
SLURM auto-requeueing enabled. Setting signal handlers.
`Trainer.fit` stopped: `max_steps=1100.0` reached.
[I 2025-01-14 16:30:04,607] Trial 44 finished with value: 1739.5662841796875 and parameters: {'n_pool_kernel_size': [2, 2, 1], 'n_freq_downsample': [60, 8, 1], 'learning_rate': 0.0001574955563271593, 'scaler_type': 'standard', 'max_steps': 1100.0, 'batch_size': 128, 'windows_batch_size': 256, 'random_seed': 7, 'input_size': 24, 'step_size': 1}. Best is trial 8 with value: 967.596435546875.
[rank: 0] Seed set to 5
GPU available: True (cuda), used: True
TPU available: False, using: 0 TPU cores
HPU available: False, using: 0 HPUs
LOCAL_RANK: 0 - CUDA_VISIBLE_DEVICES: [0,1,2,3,4,5,6,7]

  | Name         | Type          | Params | Mode 
-------------------------------------------------------
0 | loss         | RMSE          | 0      | train
1 | padder_train | ConstantPad1d | 0      | train
2 | scaler       | TemporalNorm  | 0      | train
3 | blocks       | ModuleList    | 2.5 M  | train
-------------------------------------------------------
2.5 M     Trainable params
0         Non-trainable params
2.5 M     Total params
10.161    Total estimated model params size (MB)
34        Modules in train mode
0         Modules in eval mode
SLURM auto-requeueing enabled. Setting signal handlers.
`Trainer.fit` stopped: `max_steps=1200.0` reached.
[I 2025-01-14 16:30:25,178] Trial 45 finished with value: 2035.170654296875 and parameters: {'n_pool_kernel_size': [8, 4, 1], 'n_freq_downsample': [180, 60, 1], 'learning_rate': 0.004923739624751812, 'scaler_type': 'standard', 'max_steps': 1200.0, 'batch_size': 32, 'windows_batch_size': 256, 'random_seed': 5, 'input_size': 72, 'step_size': 1}. Best is trial 8 with value: 967.596435546875.
[rank: 0] Seed set to 10
GPU available: True (cuda), used: True
TPU available: False, using: 0 TPU cores
HPU available: False, using: 0 HPUs
LOCAL_RANK: 0 - CUDA_VISIBLE_DEVICES: [0,1,2,3,4,5,6,7]

  | Name         | Type          | Params | Mode 
-------------------------------------------------------
0 | loss         | RMSE          | 0      | train
1 | padder_train | ConstantPad1d | 0      | train
2 | scaler       | TemporalNorm  | 0      | train
3 | blocks       | ModuleList    | 2.4 M  | train
-------------------------------------------------------
2.4 M     Trainable params
0         Non-trainable params
2.4 M     Total params
9.702     Total estimated model params size (MB)
34        Modules in train mode
0         Modules in eval mode
SLURM auto-requeueing enabled. Setting signal handlers.
`Trainer.fit` stopped: `max_steps=1500.0` reached.
[I 2025-01-14 16:30:50,586] Trial 46 finished with value: 1634.503173828125 and parameters: {'n_pool_kernel_size': [4, 4, 4], 'n_freq_downsample': [24, 12, 1], 'learning_rate': 0.00020666429339916714, 'scaler_type': None, 'max_steps': 1500.0, 'batch_size': 128, 'windows_batch_size': 1024, 'random_seed': 10, 'input_size': 24, 'step_size': 24}. Best is trial 8 with value: 967.596435546875.
[rank: 0] Seed set to 13
GPU available: True (cuda), used: True
TPU available: False, using: 0 TPU cores
HPU available: False, using: 0 HPUs
LOCAL_RANK: 0 - CUDA_VISIBLE_DEVICES: [0,1,2,3,4,5,6,7]

  | Name         | Type          | Params | Mode 
-------------------------------------------------------
0 | loss         | RMSE          | 0      | train
1 | padder_train | ConstantPad1d | 0      | train
2 | scaler       | TemporalNorm  | 0      | train
3 | blocks       | ModuleList    | 2.4 M  | train
-------------------------------------------------------
2.4 M     Trainable params
0         Non-trainable params
2.4 M     Total params
9.722     Total estimated model params size (MB)
34        Modules in train mode
0         Modules in eval mode
SLURM auto-requeueing enabled. Setting signal handlers.
`Trainer.fit` stopped: `max_steps=1000.0` reached.
[I 2025-01-14 16:31:08,032] Trial 47 finished with value: 2229.12744140625 and parameters: {'n_pool_kernel_size': [16, 8, 1], 'n_freq_downsample': [168, 24, 1], 'learning_rate': 0.00013008703138622018, 'scaler_type': 'standard', 'max_steps': 1000.0, 'batch_size': 64, 'windows_batch_size': 128, 'random_seed': 13, 'input_size': 24, 'step_size': 24}. Best is trial 8 with value: 967.596435546875.
[rank: 0] Seed set to 15
GPU available: True (cuda), used: True
TPU available: False, using: 0 TPU cores
HPU available: False, using: 0 HPUs
LOCAL_RANK: 0 - CUDA_VISIBLE_DEVICES: [0,1,2,3,4,5,6,7]

  | Name         | Type          | Params | Mode 
-------------------------------------------------------
0 | loss         | RMSE          | 0      | train
1 | padder_train | ConstantPad1d | 0      | train
2 | scaler       | TemporalNorm  | 0      | train
3 | blocks       | ModuleList    | 2.5 M  | train
-------------------------------------------------------
2.5 M     Trainable params
0         Non-trainable params
2.5 M     Total params
9.905     Total estimated model params size (MB)
34        Modules in train mode
0         Modules in eval mode
SLURM auto-requeueing enabled. Setting signal handlers.
`Trainer.fit` stopped: `max_steps=1300.0` reached.
[I 2025-01-14 16:31:30,676] Trial 48 finished with value: 1978.9471435546875 and parameters: {'n_pool_kernel_size': [1, 1, 1], 'n_freq_downsample': [1, 1, 1], 'learning_rate': 0.0003359695486901543, 'scaler_type': 'robust', 'max_steps': 1300.0, 'batch_size': 128, 'windows_batch_size': 512, 'random_seed': 15, 'input_size': 24, 'step_size': 1}. Best is trial 8 with value: 967.596435546875.
[rank: 0] Seed set to 6
GPU available: True (cuda), used: True
TPU available: False, using: 0 TPU cores
HPU available: False, using: 0 HPUs
LOCAL_RANK: 0 - CUDA_VISIBLE_DEVICES: [0,1,2,3,4,5,6,7]

  | Name         | Type          | Params | Mode 
-------------------------------------------------------
0 | loss         | RMSE          | 0      | train
1 | padder_train | ConstantPad1d | 0      | train
2 | scaler       | TemporalNorm  | 0      | train
3 | blocks       | ModuleList    | 2.5 M  | train
-------------------------------------------------------
2.5 M     Trainable params
0         Non-trainable params
2.5 M     Total params
10.007    Total estimated model params size (MB)
34        Modules in train mode
0         Modules in eval mode
SLURM auto-requeueing enabled. Setting signal handlers.
`Trainer.fit` stopped: `max_steps=1200.0` reached.
