[I 2025-01-14 17:37:33,346] Trial 32 finished with value: 0.0 and parameters: {'n_pool_kernel_size': [1, 1, 1], 'n_freq_downsample': [60, 8, 1], 'learning_rate': 0.0921735050761377, 'scaler_type': None, 'max_steps': 1500.0, 'batch_size': 128, 'windows_batch_size': 512, 'random_seed': 20, 'input_size': 48, 'step_size': 1}. Best is trial 2 with value: 0.0.
[rank: 0] Seed set to 19
GPU available: True (cuda), used: True
TPU available: False, using: 0 TPU cores
HPU available: False, using: 0 HPUs
LOCAL_RANK: 0 - CUDA_VISIBLE_DEVICES: [0,1,2,3,4,5,6,7]

  | Name         | Type          | Params | Mode 
-------------------------------------------------------
0 | loss         | RMSE          | 0      | train
1 | padder_train | ConstantPad1d | 0      | train
2 | scaler       | TemporalNorm  | 0      | train
3 | blocks       | ModuleList    | 2.5 M  | train
-------------------------------------------------------
2.5 M     Trainable params
0         Non-trainable params
2.5 M     Total params
10.110    Total estimated model params size (MB)
34        Modules in train mode
0         Modules in eval mode
SLURM auto-requeueing enabled. Setting signal handlers.
`Trainer.fit` stopped: `max_steps=1400.0` reached.
[I 2025-01-14 17:37:57,512] Trial 33 finished with value: 4092.57861328125 and parameters: {'n_pool_kernel_size': [1, 1, 1], 'n_freq_downsample': [60, 8, 1], 'learning_rate': 0.0003146757307100751, 'scaler_type': None, 'max_steps': 1400.0, 'batch_size': 128, 'windows_batch_size': 512, 'random_seed': 19, 'input_size': 48, 'step_size': 1}. Best is trial 2 with value: 0.0.
[rank: 0] Seed set to 16
GPU available: True (cuda), used: True
TPU available: False, using: 0 TPU cores
HPU available: False, using: 0 HPUs
LOCAL_RANK: 0 - CUDA_VISIBLE_DEVICES: [0,1,2,3,4,5,6,7]

  | Name         | Type          | Params | Mode 
-------------------------------------------------------
0 | loss         | RMSE          | 0      | train
1 | padder_train | ConstantPad1d | 0      | train
2 | scaler       | TemporalNorm  | 0      | train
3 | blocks       | ModuleList    | 2.6 M  | train
-------------------------------------------------------
2.6 M     Trainable params
0         Non-trainable params
2.6 M     Total params
10.442    Total estimated model params size (MB)
34        Modules in train mode
0         Modules in eval mode
SLURM auto-requeueing enabled. Setting signal handlers.
`Trainer.fit` stopped: `max_steps=1300.0` reached.
[I 2025-01-14 17:38:19,794] Trial 34 finished with value: 1087599.0 and parameters: {'n_pool_kernel_size': [4, 4, 4], 'n_freq_downsample': [60, 8, 1], 'learning_rate': 0.042059694631371984, 'scaler_type': None, 'max_steps': 1300.0, 'batch_size': 256, 'windows_batch_size': 512, 'random_seed': 16, 'input_size': 120, 'step_size': 1}. Best is trial 2 with value: 0.0.
[rank: 0] Seed set to 18
GPU available: True (cuda), used: True
TPU available: False, using: 0 TPU cores
HPU available: False, using: 0 HPUs
LOCAL_RANK: 0 - CUDA_VISIBLE_DEVICES: [0,1,2,3,4,5,6,7]

  | Name         | Type          | Params | Mode 
-------------------------------------------------------
0 | loss         | RMSE          | 0      | train
1 | padder_train | ConstantPad1d | 0      | train
2 | scaler       | TemporalNorm  | 0      | train
3 | blocks       | ModuleList    | 2.5 M  | train
-------------------------------------------------------
2.5 M     Trainable params
0         Non-trainable params
2.5 M     Total params
10.102    Total estimated model params size (MB)
34        Modules in train mode
0         Modules in eval mode
SLURM auto-requeueing enabled. Setting signal handlers.
`Trainer.fit` stopped: `max_steps=1500.0` reached.
[I 2025-01-14 17:38:46,137] Trial 35 finished with value: 3133.5830078125 and parameters: {'n_pool_kernel_size': [2, 2, 1], 'n_freq_downsample': [1, 1, 1], 'learning_rate': 0.01495599348726283, 'scaler_type': 'standard', 'max_steps': 1500.0, 'batch_size': 128, 'windows_batch_size': 256, 'random_seed': 18, 'input_size': 48, 'step_size': 1}. Best is trial 2 with value: 0.0.
[rank: 0] Seed set to 17
GPU available: True (cuda), used: True
TPU available: False, using: 0 TPU cores
HPU available: False, using: 0 HPUs
LOCAL_RANK: 0 - CUDA_VISIBLE_DEVICES: [0,1,2,3,4,5,6,7]

  | Name         | Type          | Params | Mode 
-------------------------------------------------------
0 | loss         | RMSE          | 0      | train
1 | padder_train | ConstantPad1d | 0      | train
2 | scaler       | TemporalNorm  | 0      | train
3 | blocks       | ModuleList    | 2.5 M  | train
-------------------------------------------------------
2.5 M     Trainable params
0         Non-trainable params
2.5 M     Total params
10.110    Total estimated model params size (MB)
34        Modules in train mode
0         Modules in eval mode
SLURM auto-requeueing enabled. Setting signal handlers.
`Trainer.fit` stopped: `max_steps=1300.0` reached.
[I 2025-01-14 17:39:08,431] Trial 36 finished with value: 683727.9375 and parameters: {'n_pool_kernel_size': [1, 1, 1], 'n_freq_downsample': [60, 8, 1], 'learning_rate': 0.030856371000158294, 'scaler_type': None, 'max_steps': 1300.0, 'batch_size': 128, 'windows_batch_size': 512, 'random_seed': 17, 'input_size': 48, 'step_size': 1}. Best is trial 2 with value: 0.0.
[rank: 0] Seed set to 19
GPU available: True (cuda), used: True
TPU available: False, using: 0 TPU cores
HPU available: False, using: 0 HPUs
LOCAL_RANK: 0 - CUDA_VISIBLE_DEVICES: [0,1,2,3,4,5,6,7]

  | Name         | Type          | Params | Mode 
-------------------------------------------------------
0 | loss         | RMSE          | 0      | train
1 | padder_train | ConstantPad1d | 0      | train
2 | scaler       | TemporalNorm  | 0      | train
3 | blocks       | ModuleList    | 2.4 M  | train
-------------------------------------------------------
2.4 M     Trainable params
0         Non-trainable params
2.4 M     Total params
9.700     Total estimated model params size (MB)
34        Modules in train mode
0         Modules in eval mode
SLURM auto-requeueing enabled. Setting signal handlers.
`Trainer.fit` stopped: `max_steps=700.0` reached.
[I 2025-01-14 17:39:20,554] Trial 37 finished with value: 996797.9375 and parameters: {'n_pool_kernel_size': [4, 4, 4], 'n_freq_downsample': [168, 24, 1], 'learning_rate': 0.059248732394997235, 'scaler_type': None, 'max_steps': 700.0, 'batch_size': 256, 'windows_batch_size': 128, 'random_seed': 19, 'input_size': 24, 'step_size': 24}. Best is trial 2 with value: 0.0.
[rank: 0] Seed set to 14
GPU available: True (cuda), used: True
TPU available: False, using: 0 TPU cores
HPU available: False, using: 0 HPUs
LOCAL_RANK: 0 - CUDA_VISIBLE_DEVICES: [0,1,2,3,4,5,6,7]

  | Name         | Type          | Params | Mode 
-------------------------------------------------------
0 | loss         | RMSE          | 0      | train
1 | padder_train | ConstantPad1d | 0      | train
2 | scaler       | TemporalNorm  | 0      | train
3 | blocks       | ModuleList    | 2.8 M  | train
-------------------------------------------------------
2.8 M     Trainable params
0         Non-trainable params
2.8 M     Total params
11.086    Total estimated model params size (MB)
34        Modules in train mode
0         Modules in eval mode
SLURM auto-requeueing enabled. Setting signal handlers.
`Trainer.fit` stopped: `max_steps=1400.0` reached.
[I 2025-01-14 17:39:44,696] Trial 38 finished with value: 4166.24951171875 and parameters: {'n_pool_kernel_size': [1, 1, 1], 'n_freq_downsample': [1, 1, 1], 'learning_rate': 0.00646311139571439, 'scaler_type': None, 'max_steps': 1400.0, 'batch_size': 64, 'windows_batch_size': 256, 'random_seed': 14, 'input_size': 120, 'step_size': 1}. Best is trial 2 with value: 0.0.
[rank: 0] Seed set to 20
GPU available: True (cuda), used: True
TPU available: False, using: 0 TPU cores
HPU available: False, using: 0 HPUs
LOCAL_RANK: 0 - CUDA_VISIBLE_DEVICES: [0,1,2,3,4,5,6,7]

  | Name         | Type          | Params | Mode 
-------------------------------------------------------
0 | loss         | RMSE          | 0      | train
1 | padder_train | ConstantPad1d | 0      | train
2 | scaler       | TemporalNorm  | 0      | train
3 | blocks       | ModuleList    | 2.6 M  | train
-------------------------------------------------------
2.6 M     Trainable params
0         Non-trainable params
2.6 M     Total params
10.499    Total estimated model params size (MB)
34        Modules in train mode
0         Modules in eval mode
SLURM auto-requeueing enabled. Setting signal handlers.
`Trainer.fit` stopped: `max_steps=1200.0` reached.
[I 2025-01-14 17:40:06,864] Trial 39 finished with value: 3214.50146484375 and parameters: {'n_pool_kernel_size': [2, 2, 1], 'n_freq_downsample': [40, 20, 1], 'learning_rate': 0.020511793415993494, 'scaler_type': 'robust', 'max_steps': 1200.0, 'batch_size': 32, 'windows_batch_size': 128, 'random_seed': 20, 'input_size': 96, 'step_size': 24}. Best is trial 2 with value: 0.0.
[rank: 0] Seed set to 1
GPU available: True (cuda), used: True
TPU available: False, using: 0 TPU cores
HPU available: False, using: 0 HPUs
LOCAL_RANK: 0 - CUDA_VISIBLE_DEVICES: [0,1,2,3,4,5,6,7]

  | Name         | Type          | Params | Mode 
-------------------------------------------------------
0 | loss         | RMSE          | 0      | train
1 | padder_train | ConstantPad1d | 0      | train
2 | scaler       | TemporalNorm  | 0      | train
3 | blocks       | ModuleList    | 2.5 M  | train
-------------------------------------------------------
2.5 M     Trainable params
0         Non-trainable params
2.5 M     Total params
9.958     Total estimated model params size (MB)
34        Modules in train mode
0         Modules in eval mode
SLURM auto-requeueing enabled. Setting signal handlers.
`Trainer.fit` stopped: `max_steps=1500.0` reached.
[I 2025-01-14 17:40:34,076] Trial 40 finished with value: 414141.75 and parameters: {'n_pool_kernel_size': [2, 2, 2], 'n_freq_downsample': [180, 60, 1], 'learning_rate': 0.03594936611391561, 'scaler_type': 'standard', 'max_steps': 1500.0, 'batch_size': 128, 'windows_batch_size': 1024, 'random_seed': 1, 'input_size': 48, 'step_size': 1}. Best is trial 2 with value: 0.0.
[rank: 0] Seed set to 19
GPU available: True (cuda), used: True
TPU available: False, using: 0 TPU cores
HPU available: False, using: 0 HPUs
LOCAL_RANK: 0 - CUDA_VISIBLE_DEVICES: [0,1,2,3,4,5,6,7]

  | Name         | Type          | Params | Mode 
-------------------------------------------------------
0 | loss         | RMSE          | 0      | train
1 | padder_train | ConstantPad1d | 0      | train
2 | scaler       | TemporalNorm  | 0      | train
3 | blocks       | ModuleList    | 2.5 M  | train
-------------------------------------------------------
2.5 M     Trainable params
0         Non-trainable params
2.5 M     Total params
10.110    Total estimated model params size (MB)
34        Modules in train mode
0         Modules in eval mode
SLURM auto-requeueing enabled. Setting signal handlers.
`Trainer.fit` stopped: `max_steps=1300.0` reached.
[I 2025-01-14 17:40:56,480] Trial 41 finished with value: 0.0 and parameters: {'n_pool_kernel_size': [1, 1, 1], 'n_freq_downsample': [60, 8, 1], 'learning_rate': 0.06742541548372165, 'scaler_type': None, 'max_steps': 1300.0, 'batch_size': 128, 'windows_batch_size': 512, 'random_seed': 19, 'input_size': 48, 'step_size': 1}. Best is trial 2 with value: 0.0.
[rank: 0] Seed set to 19
GPU available: True (cuda), used: True
TPU available: False, using: 0 TPU cores
HPU available: False, using: 0 HPUs
LOCAL_RANK: 0 - CUDA_VISIBLE_DEVICES: [0,1,2,3,4,5,6,7]

  | Name         | Type          | Params | Mode 
-------------------------------------------------------
0 | loss         | RMSE          | 0      | train
1 | padder_train | ConstantPad1d | 0      | train
2 | scaler       | TemporalNorm  | 0      | train
3 | blocks       | ModuleList    | 2.5 M  | train
-------------------------------------------------------
2.5 M     Trainable params
0         Non-trainable params
2.5 M     Total params
10.110    Total estimated model params size (MB)
34        Modules in train mode
0         Modules in eval mode
SLURM auto-requeueing enabled. Setting signal handlers.
`Trainer.fit` stopped: `max_steps=1400.0` reached.
[I 2025-01-14 17:41:20,447] Trial 42 finished with value: 15309.9306640625 and parameters: {'n_pool_kernel_size': [1, 1, 1], 'n_freq_downsample': [60, 8, 1], 'learning_rate': 0.05119710734690657, 'scaler_type': None, 'max_steps': 1400.0, 'batch_size': 128, 'windows_batch_size': 512, 'random_seed': 19, 'input_size': 48, 'step_size': 1}. Best is trial 2 with value: 0.0.
[rank: 0] Seed set to 17
GPU available: True (cuda), used: True
TPU available: False, using: 0 TPU cores
HPU available: False, using: 0 HPUs
LOCAL_RANK: 0 - CUDA_VISIBLE_DEVICES: [0,1,2,3,4,5,6,7]

  | Name         | Type          | Params | Mode 
-------------------------------------------------------
0 | loss         | RMSE          | 0      | train
1 | padder_train | ConstantPad1d | 0      | train
2 | scaler       | TemporalNorm  | 0      | train
3 | blocks       | ModuleList    | 2.5 M  | train
-------------------------------------------------------
2.5 M     Trainable params
0         Non-trainable params
2.5 M     Total params
10.110    Total estimated model params size (MB)
34        Modules in train mode
0         Modules in eval mode
SLURM auto-requeueing enabled. Setting signal handlers.
`Trainer.fit` stopped: `max_steps=1500.0` reached.
[I 2025-01-14 17:41:46,498] Trial 43 finished with value: 0.0 and parameters: {'n_pool_kernel_size': [1, 1, 1], 'n_freq_downsample': [60, 8, 1], 'learning_rate': 0.09761638130716134, 'scaler_type': None, 'max_steps': 1500.0, 'batch_size': 128, 'windows_batch_size': 512, 'random_seed': 17, 'input_size': 48, 'step_size': 1}. Best is trial 2 with value: 0.0.
[rank: 0] Seed set to 16
GPU available: True (cuda), used: True
TPU available: False, using: 0 TPU cores
HPU available: False, using: 0 HPUs
LOCAL_RANK: 0 - CUDA_VISIBLE_DEVICES: [0,1,2,3,4,5,6,7]

  | Name         | Type          | Params | Mode 
-------------------------------------------------------
0 | loss         | RMSE          | 0      | train
1 | padder_train | ConstantPad1d | 0      | train
2 | scaler       | TemporalNorm  | 0      | train
3 | blocks       | ModuleList    | 2.5 M  | train
-------------------------------------------------------
2.5 M     Trainable params
0         Non-trainable params
2.5 M     Total params
10.110    Total estimated model params size (MB)
34        Modules in train mode
0         Modules in eval mode
SLURM auto-requeueing enabled. Setting signal handlers.
`Trainer.fit` stopped: `max_steps=900.0` reached.
[I 2025-01-14 17:42:02,246] Trial 44 finished with value: 0.0 and parameters: {'n_pool_kernel_size': [1, 1, 1], 'n_freq_downsample': [60, 8, 1], 'learning_rate': 0.06835624793261294, 'scaler_type': None, 'max_steps': 900.0, 'batch_size': 128, 'windows_batch_size': 512, 'random_seed': 16, 'input_size': 48, 'step_size': 1}. Best is trial 2 with value: 0.0.
[rank: 0] Seed set to 20
GPU available: True (cuda), used: True
TPU available: False, using: 0 TPU cores
HPU available: False, using: 0 HPUs
LOCAL_RANK: 0 - CUDA_VISIBLE_DEVICES: [0,1,2,3,4,5,6,7]

  | Name         | Type          | Params | Mode 
-------------------------------------------------------
0 | loss         | RMSE          | 0      | train
1 | padder_train | ConstantPad1d | 0      | train
2 | scaler       | TemporalNorm  | 0      | train
3 | blocks       | ModuleList    | 2.7 M  | train
-------------------------------------------------------
2.7 M     Trainable params
0         Non-trainable params
2.7 M     Total params
10.700    Total estimated model params size (MB)
34        Modules in train mode
0         Modules in eval mode
SLURM auto-requeueing enabled. Setting signal handlers.
`Trainer.fit` stopped: `max_steps=1200.0` reached.
[I 2025-01-14 17:42:23,710] Trial 45 finished with value: 0.0 and parameters: {'n_pool_kernel_size': [1, 1, 1], 'n_freq_downsample': [60, 8, 1], 'learning_rate': 0.04600639196942685, 'scaler_type': None, 'max_steps': 1200.0, 'batch_size': 256, 'windows_batch_size': 512, 'random_seed': 20, 'input_size': 96, 'step_size': 24}. Best is trial 2 with value: 0.0.
[rank: 0] Seed set to 18
GPU available: True (cuda), used: True
TPU available: False, using: 0 TPU cores
HPU available: False, using: 0 HPUs
LOCAL_RANK: 0 - CUDA_VISIBLE_DEVICES: [0,1,2,3,4,5,6,7]

  | Name         | Type          | Params | Mode 
-------------------------------------------------------
0 | loss         | RMSE          | 0      | train
1 | padder_train | ConstantPad1d | 0      | train
2 | scaler       | TemporalNorm  | 0      | train
3 | blocks       | ModuleList    | 2.4 M  | train
-------------------------------------------------------
2.4 M     Trainable params
0         Non-trainable params
2.4 M     Total params
9.732     Total estimated model params size (MB)
34        Modules in train mode
0         Modules in eval mode
SLURM auto-requeueing enabled. Setting signal handlers.
`Trainer.fit` stopped: `max_steps=1400.0` reached.
[I 2025-01-14 17:42:48,518] Trial 46 finished with value: 10163.5537109375 and parameters: {'n_pool_kernel_size': [8, 4, 1], 'n_freq_downsample': [24, 12, 1], 'learning_rate': 0.02467629930902196, 'scaler_type': None, 'max_steps': 1400.0, 'batch_size': 128, 'windows_batch_size': 512, 'random_seed': 18, 'input_size': 24, 'step_size': 1}. Best is trial 2 with value: 0.0.
[rank: 0] Seed set to 19
GPU available: True (cuda), used: True
TPU available: False, using: 0 TPU cores
HPU available: False, using: 0 HPUs
LOCAL_RANK: 0 - CUDA_VISIBLE_DEVICES: [0,1,2,3,4,5,6,7]

  | Name         | Type          | Params | Mode 
-------------------------------------------------------
0 | loss         | RMSE          | 0      | train
1 | padder_train | ConstantPad1d | 0      | train
2 | scaler       | TemporalNorm  | 0      | train
3 | blocks       | ModuleList    | 2.5 M  | train
-------------------------------------------------------
2.5 M     Trainable params
0         Non-trainable params
2.5 M     Total params
9.931     Total estimated model params size (MB)
34        Modules in train mode
0         Modules in eval mode
SLURM auto-requeueing enabled. Setting signal handlers.
`Trainer.fit` stopped: `max_steps=1500.0` reached.
[I 2025-01-14 17:43:14,956] Trial 47 finished with value: 3820.93701171875 and parameters: {'n_pool_kernel_size': [16, 8, 1], 'n_freq_downsample': [60, 8, 1], 'learning_rate': 0.0001684455252857155, 'scaler_type': None, 'max_steps': 1500.0, 'batch_size': 128, 'windows_batch_size': 128, 'random_seed': 19, 'input_size': 48, 'step_size': 1}. Best is trial 2 with value: 0.0.
[rank: 0] Seed set to 12
GPU available: True (cuda), used: True
TPU available: False, using: 0 TPU cores
HPU available: False, using: 0 HPUs
LOCAL_RANK: 0 - CUDA_VISIBLE_DEVICES: [0,1,2,3,4,5,6,7]

  | Name         | Type          | Params | Mode 
-------------------------------------------------------
0 | loss         | RMSE          | 0      | train
1 | padder_train | ConstantPad1d | 0      | train
2 | scaler       | TemporalNorm  | 0      | train
3 | blocks       | ModuleList    | 2.5 M  | train
-------------------------------------------------------
2.5 M     Trainable params
0         Non-trainable params
2.5 M     Total params
10.163    Total estimated model params size (MB)
34        Modules in train mode
0         Modules in eval mode
SLURM auto-requeueing enabled. Setting signal handlers.
`Trainer.fit` stopped: `max_steps=1300.0` reached.
[I 2025-01-14 17:43:38,296] Trial 48 finished with value: 3403.57763671875 and parameters: {'n_pool_kernel_size': [4, 4, 4], 'n_freq_downsample': [1, 1, 1], 'learning_rate': 0.002654250673420446, 'scaler_type': None, 'max_steps': 1300.0, 'batch_size': 128, 'windows_batch_size': 256, 'random_seed': 12, 'input_size': 72, 'step_size': 1}. Best is trial 2 with value: 0.0.
[rank: 0] Seed set to 17
GPU available: True (cuda), used: True
TPU available: False, using: 0 TPU cores
HPU available: False, using: 0 HPUs
LOCAL_RANK: 0 - CUDA_VISIBLE_DEVICES: [0,1,2,3,4,5,6,7]

  | Name         | Type          | Params | Mode 
-------------------------------------------------------
0 | loss         | RMSE          | 0      | train
1 | padder_train | ConstantPad1d | 0      | train
2 | scaler       | TemporalNorm  | 0      | train
3 | blocks       | ModuleList    | 2.7 M  | train
-------------------------------------------------------
2.7 M     Trainable params
0         Non-trainable params
2.7 M     Total params
10.696    Total estimated model params size (MB)
34        Modules in train mode
0         Modules in eval mode
SLURM auto-requeueing enabled. Setting signal handlers.
`Trainer.fit` stopped: `max_steps=1100.0` reached.
