[I 2025-01-14 18:18:07,129] Trial 49 finished with value: 1313.3974609375 and parameters: {'n_pool_kernel_size': [2, 2, 2], 'n_freq_downsample': [1, 1, 1], 'learning_rate': 0.0004123243589731168, 'scaler_type': None, 'max_steps': 700.0, 'batch_size': 32, 'windows_batch_size': 512, 'random_seed': 19, 'input_size': 96, 'step_size': 24}. Best is trial 8 with value: 1082.7440185546875.
[rank: 0] Seed set to 20
GPU available: True (cuda), used: True
TPU available: False, using: 0 TPU cores
HPU available: False, using: 0 HPUs
LOCAL_RANK: 0 - CUDA_VISIBLE_DEVICES: [0,1,2,3,4,5,6,7]

  | Name         | Type          | Params | Mode 
-------------------------------------------------------
0 | loss         | RMSE          | 0      | train
1 | padder_train | ConstantPad1d | 0      | train
2 | scaler       | TemporalNorm  | 0      | train
3 | blocks       | ModuleList    | 2.6 M  | train
-------------------------------------------------------
2.6 M     Trainable params
0         Non-trainable params
2.6 M     Total params
10.403    Total estimated model params size (MB)
34        Modules in train mode
0         Modules in eval mode
SLURM auto-requeueing enabled. Setting signal handlers.
`Trainer.fit` stopped: `max_steps=1500.0` reached.
GPU available: True (cuda), used: True
TPU available: False, using: 0 TPU cores
HPU available: False, using: 0 HPUs
LOCAL_RANK: 0 - CUDA_VISIBLE_DEVICES: [0,1,2,3,4,5,6,7]
SLURM auto-requeueing enabled. Setting signal handlers.
[I 2025-01-14 18:18:34,183] A new study created in memory with name: no-name-e5eb1a63-c6a2-48c2-bd95-9e3ca523e02f
[rank: 0] Seed set to 8
GPU available: True (cuda), used: True
TPU available: False, using: 0 TPU cores
HPU available: False, using: 0 HPUs
LOCAL_RANK: 0 - CUDA_VISIBLE_DEVICES: [0,1,2,3,4,5,6,7]

  | Name         | Type          | Params | Mode 
-------------------------------------------------------
0 | loss         | RMSE          | 0      | train
1 | padder_train | ConstantPad1d | 0      | train
2 | scaler       | TemporalNorm  | 0      | train
3 | blocks       | ModuleList    | 2.5 M  | train
-------------------------------------------------------
2.5 M     Trainable params
0         Non-trainable params
2.5 M     Total params
9.946     Total estimated model params size (MB)
34        Modules in train mode
0         Modules in eval mode
SLURM auto-requeueing enabled. Setting signal handlers.
`Trainer.fit` stopped: `max_steps=600.0` reached.
[I 2025-01-14 18:18:45,404] Trial 0 finished with value: 2629.03271484375 and parameters: {'n_pool_kernel_size': [8, 4, 1], 'n_freq_downsample': [40, 20, 1], 'learning_rate': 0.0004054184496901369, 'scaler_type': 'robust', 'max_steps': 600.0, 'batch_size': 256, 'windows_batch_size': 128, 'random_seed': 8, 'input_size': 48, 'step_size': 1}. Best is trial 0 with value: 2629.03271484375.
[rank: 0] Seed set to 13
GPU available: True (cuda), used: True
TPU available: False, using: 0 TPU cores
HPU available: False, using: 0 HPUs
LOCAL_RANK: 0 - CUDA_VISIBLE_DEVICES: [0,1,2,3,4,5,6,7]

  | Name         | Type          | Params | Mode 
-------------------------------------------------------
0 | loss         | RMSE          | 0      | train
1 | padder_train | ConstantPad1d | 0      | train
2 | scaler       | TemporalNorm  | 0      | train
3 | blocks       | ModuleList    | 2.4 M  | train
-------------------------------------------------------
2.4 M     Trainable params
0         Non-trainable params
2.4 M     Total params
9.765     Total estimated model params size (MB)
34        Modules in train mode
0         Modules in eval mode
SLURM auto-requeueing enabled. Setting signal handlers.
`Trainer.fit` stopped: `max_steps=600.0` reached.
[I 2025-01-14 18:18:56,029] Trial 1 finished with value: 2978.684326171875 and parameters: {'n_pool_kernel_size': [2, 2, 1], 'n_freq_downsample': [60, 8, 1], 'learning_rate': 0.003717183816083157, 'scaler_type': None, 'max_steps': 600.0, 'batch_size': 64, 'windows_batch_size': 512, 'random_seed': 13, 'input_size': 24, 'step_size': 1}. Best is trial 0 with value: 2629.03271484375.
[rank: 0] Seed set to 6
GPU available: True (cuda), used: True
TPU available: False, using: 0 TPU cores
HPU available: False, using: 0 HPUs
LOCAL_RANK: 0 - CUDA_VISIBLE_DEVICES: [0,1,2,3,4,5,6,7]

  | Name         | Type          | Params | Mode 
-------------------------------------------------------
0 | loss         | RMSE          | 0      | train
1 | padder_train | ConstantPad1d | 0      | train
2 | scaler       | TemporalNorm  | 0      | train
3 | blocks       | ModuleList    | 2.5 M  | train
-------------------------------------------------------
2.5 M     Trainable params
0         Non-trainable params
2.5 M     Total params
9.884     Total estimated model params size (MB)
34        Modules in train mode
0         Modules in eval mode
SLURM auto-requeueing enabled. Setting signal handlers.
`Trainer.fit` stopped: `max_steps=600.0` reached.
[I 2025-01-14 18:19:06,986] Trial 2 finished with value: 364781.8125 and parameters: {'n_pool_kernel_size': [4, 4, 4], 'n_freq_downsample': [40, 20, 1], 'learning_rate': 0.03120397644510838, 'scaler_type': 'standard', 'max_steps': 600.0, 'batch_size': 32, 'windows_batch_size': 512, 'random_seed': 6, 'input_size': 48, 'step_size': 24}. Best is trial 0 with value: 2629.03271484375.
[rank: 0] Seed set to 18
GPU available: True (cuda), used: True
TPU available: False, using: 0 TPU cores
HPU available: False, using: 0 HPUs
LOCAL_RANK: 0 - CUDA_VISIBLE_DEVICES: [0,1,2,3,4,5,6,7]

  | Name         | Type          | Params | Mode 
-------------------------------------------------------
0 | loss         | RMSE          | 0      | train
1 | padder_train | ConstantPad1d | 0      | train
2 | scaler       | TemporalNorm  | 0      | train
3 | blocks       | ModuleList    | 2.5 M  | train
-------------------------------------------------------
2.5 M     Trainable params
0         Non-trainable params
2.5 M     Total params
10.161    Total estimated model params size (MB)
34        Modules in train mode
0         Modules in eval mode
SLURM auto-requeueing enabled. Setting signal handlers.
`Trainer.fit` stopped: `max_steps=800.0` reached.
[I 2025-01-14 18:19:21,251] Trial 3 finished with value: 9932.306640625 and parameters: {'n_pool_kernel_size': [8, 4, 1], 'n_freq_downsample': [40, 20, 1], 'learning_rate': 0.012834331766286471, 'scaler_type': None, 'max_steps': 800.0, 'batch_size': 32, 'windows_batch_size': 128, 'random_seed': 18, 'input_size': 72, 'step_size': 1}. Best is trial 0 with value: 2629.03271484375.
[rank: 0] Seed set to 15
GPU available: True (cuda), used: True
TPU available: False, using: 0 TPU cores
HPU available: False, using: 0 HPUs
LOCAL_RANK: 0 - CUDA_VISIBLE_DEVICES: [0,1,2,3,4,5,6,7]

  | Name         | Type          | Params | Mode 
-------------------------------------------------------
0 | loss         | RMSE          | 0      | train
1 | padder_train | ConstantPad1d | 0      | train
2 | scaler       | TemporalNorm  | 0      | train
3 | blocks       | ModuleList    | 2.4 M  | train
-------------------------------------------------------
2.4 M     Trainable params
0         Non-trainable params
2.4 M     Total params
9.722     Total estimated model params size (MB)
34        Modules in train mode
0         Modules in eval mode
SLURM auto-requeueing enabled. Setting signal handlers.
`Trainer.fit` stopped: `max_steps=1400.0` reached.
[I 2025-01-14 18:19:47,111] Trial 4 finished with value: 3950.32763671875 and parameters: {'n_pool_kernel_size': [16, 8, 1], 'n_freq_downsample': [40, 20, 1], 'learning_rate': 0.00010248912986231601, 'scaler_type': 'robust', 'max_steps': 1400.0, 'batch_size': 128, 'windows_batch_size': 512, 'random_seed': 15, 'input_size': 24, 'step_size': 24}. Best is trial 0 with value: 2629.03271484375.
[rank: 0] Seed set to 20
GPU available: True (cuda), used: True
TPU available: False, using: 0 TPU cores
HPU available: False, using: 0 HPUs
LOCAL_RANK: 0 - CUDA_VISIBLE_DEVICES: [0,1,2,3,4,5,6,7]

  | Name         | Type          | Params | Mode 
-------------------------------------------------------
0 | loss         | RMSE          | 0      | train
1 | padder_train | ConstantPad1d | 0      | train
2 | scaler       | TemporalNorm  | 0      | train
3 | blocks       | ModuleList    | 2.7 M  | train
-------------------------------------------------------
2.7 M     Trainable params
0         Non-trainable params
2.7 M     Total params
10.745    Total estimated model params size (MB)
34        Modules in train mode
0         Modules in eval mode
SLURM auto-requeueing enabled. Setting signal handlers.
`Trainer.fit` stopped: `max_steps=700.0` reached.
[I 2025-01-14 18:20:00,003] Trial 5 finished with value: 2454.2958984375 and parameters: {'n_pool_kernel_size': [2, 2, 1], 'n_freq_downsample': [180, 60, 1], 'learning_rate': 0.0024702158263923313, 'scaler_type': 'robust', 'max_steps': 700.0, 'batch_size': 32, 'windows_batch_size': 128, 'random_seed': 20, 'input_size': 120, 'step_size': 24}. Best is trial 5 with value: 2454.2958984375.
[rank: 0] Seed set to 11
GPU available: True (cuda), used: True
TPU available: False, using: 0 TPU cores
HPU available: False, using: 0 HPUs
LOCAL_RANK: 0 - CUDA_VISIBLE_DEVICES: [0,1,2,3,4,5,6,7]

  | Name         | Type          | Params | Mode 
-------------------------------------------------------
0 | loss         | RMSE          | 0      | train
1 | padder_train | ConstantPad1d | 0      | train
2 | scaler       | TemporalNorm  | 0      | train
3 | blocks       | ModuleList    | 2.6 M  | train
-------------------------------------------------------
2.6 M     Trainable params
0         Non-trainable params
2.6 M     Total params
10.255    Total estimated model params size (MB)
34        Modules in train mode
0         Modules in eval mode
SLURM auto-requeueing enabled. Setting signal handlers.
`Trainer.fit` stopped: `max_steps=700.0` reached.
[I 2025-01-14 18:20:11,993] Trial 6 finished with value: 84797.2578125 and parameters: {'n_pool_kernel_size': [2, 2, 1], 'n_freq_downsample': [24, 12, 1], 'learning_rate': 0.03259277213496164, 'scaler_type': None, 'max_steps': 700.0, 'batch_size': 64, 'windows_batch_size': 512, 'random_seed': 11, 'input_size': 72, 'step_size': 24}. Best is trial 5 with value: 2454.2958984375.
[rank: 0] Seed set to 8
GPU available: True (cuda), used: True
TPU available: False, using: 0 TPU cores
HPU available: False, using: 0 HPUs
LOCAL_RANK: 0 - CUDA_VISIBLE_DEVICES: [0,1,2,3,4,5,6,7]

  | Name         | Type          | Params | Mode 
-------------------------------------------------------
0 | loss         | RMSE          | 0      | train
1 | padder_train | ConstantPad1d | 0      | train
2 | scaler       | TemporalNorm  | 0      | train
3 | blocks       | ModuleList    | 2.4 M  | train
-------------------------------------------------------
2.4 M     Trainable params
0         Non-trainable params
2.4 M     Total params
9.702     Total estimated model params size (MB)
34        Modules in train mode
0         Modules in eval mode
SLURM auto-requeueing enabled. Setting signal handlers.
`Trainer.fit` stopped: `max_steps=600.0` reached.
[I 2025-01-14 18:20:22,690] Trial 7 finished with value: 4100.884765625 and parameters: {'n_pool_kernel_size': [4, 4, 4], 'n_freq_downsample': [24, 12, 1], 'learning_rate': 0.0007367077611069569, 'scaler_type': 'standard', 'max_steps': 600.0, 'batch_size': 32, 'windows_batch_size': 512, 'random_seed': 8, 'input_size': 24, 'step_size': 24}. Best is trial 5 with value: 2454.2958984375.
[rank: 0] Seed set to 1
GPU available: True (cuda), used: True
TPU available: False, using: 0 TPU cores
HPU available: False, using: 0 HPUs
LOCAL_RANK: 0 - CUDA_VISIBLE_DEVICES: [0,1,2,3,4,5,6,7]

  | Name         | Type          | Params | Mode 
-------------------------------------------------------
0 | loss         | RMSE          | 0      | train
1 | padder_train | ConstantPad1d | 0      | train
2 | scaler       | TemporalNorm  | 0      | train
3 | blocks       | ModuleList    | 2.6 M  | train
-------------------------------------------------------
2.6 M     Trainable params
0         Non-trainable params
2.6 M     Total params
10.551    Total estimated model params size (MB)
34        Modules in train mode
0         Modules in eval mode
SLURM auto-requeueing enabled. Setting signal handlers.
`Trainer.fit` stopped: `max_steps=500.0` reached.
[I 2025-01-14 18:20:31,688] Trial 8 finished with value: 3084.50634765625 and parameters: {'n_pool_kernel_size': [16, 8, 1], 'n_freq_downsample': [60, 8, 1], 'learning_rate': 0.0001636317935728472, 'scaler_type': None, 'max_steps': 500.0, 'batch_size': 128, 'windows_batch_size': 512, 'random_seed': 1, 'input_size': 120, 'step_size': 1}. Best is trial 5 with value: 2454.2958984375.
[rank: 0] Seed set to 4
GPU available: True (cuda), used: True
TPU available: False, using: 0 TPU cores
HPU available: False, using: 0 HPUs
LOCAL_RANK: 0 - CUDA_VISIBLE_DEVICES: [0,1,2,3,4,5,6,7]

  | Name         | Type          | Params | Mode 
-------------------------------------------------------
0 | loss         | RMSE          | 0      | train
1 | padder_train | ConstantPad1d | 0      | train
2 | scaler       | TemporalNorm  | 0      | train
3 | blocks       | ModuleList    | 2.6 M  | train
-------------------------------------------------------
2.6 M     Trainable params
0         Non-trainable params
2.6 M     Total params
10.401    Total estimated model params size (MB)
34        Modules in train mode
0         Modules in eval mode
SLURM auto-requeueing enabled. Setting signal handlers.
`Trainer.fit` stopped: `max_steps=600.0` reached.
[I 2025-01-14 18:20:42,557] Trial 9 finished with value: 3249.5703125 and parameters: {'n_pool_kernel_size': [2, 2, 2], 'n_freq_downsample': [180, 60, 1], 'learning_rate': 0.0005057317406863559, 'scaler_type': None, 'max_steps': 600.0, 'batch_size': 32, 'windows_batch_size': 1024, 'random_seed': 4, 'input_size': 96, 'step_size': 1}. Best is trial 5 with value: 2454.2958984375.
[rank: 0] Seed set to 20
GPU available: True (cuda), used: True
TPU available: False, using: 0 TPU cores
HPU available: False, using: 0 HPUs
LOCAL_RANK: 0 - CUDA_VISIBLE_DEVICES: [0,1,2,3,4,5,6,7]

  | Name         | Type          | Params | Mode 
-------------------------------------------------------
0 | loss         | RMSE          | 0      | train
1 | padder_train | ConstantPad1d | 0      | train
2 | scaler       | TemporalNorm  | 0      | train
3 | blocks       | ModuleList    | 2.7 M  | train
-------------------------------------------------------
2.7 M     Trainable params
0         Non-trainable params
2.7 M     Total params
10.991    Total estimated model params size (MB)
34        Modules in train mode
0         Modules in eval mode
SLURM auto-requeueing enabled. Setting signal handlers.
`Trainer.fit` stopped: `max_steps=1100.0` reached.
[I 2025-01-14 18:21:03,307] Trial 10 finished with value: 2534.63134765625 and parameters: {'n_pool_kernel_size': [1, 1, 1], 'n_freq_downsample': [180, 60, 1], 'learning_rate': 0.0034653626566970696, 'scaler_type': 'robust', 'max_steps': 1100.0, 'batch_size': 256, 'windows_batch_size': 256, 'random_seed': 20, 'input_size': 120, 'step_size': 24}. Best is trial 5 with value: 2454.2958984375.
[rank: 0] Seed set to 20
GPU available: True (cuda), used: True
TPU available: False, using: 0 TPU cores
HPU available: False, using: 0 HPUs
LOCAL_RANK: 0 - CUDA_VISIBLE_DEVICES: [0,1,2,3,4,5,6,7]

  | Name         | Type          | Params | Mode 
-------------------------------------------------------
0 | loss         | RMSE          | 0      | train
1 | padder_train | ConstantPad1d | 0      | train
2 | scaler       | TemporalNorm  | 0      | train
3 | blocks       | ModuleList    | 2.7 M  | train
-------------------------------------------------------
2.7 M     Trainable params
0         Non-trainable params
2.7 M     Total params
10.991    Total estimated model params size (MB)
34        Modules in train mode
0         Modules in eval mode
SLURM auto-requeueing enabled. Setting signal handlers.
`Trainer.fit` stopped: `max_steps=1100.0` reached.
[I 2025-01-14 18:21:23,483] Trial 11 finished with value: 2452.10400390625 and parameters: {'n_pool_kernel_size': [1, 1, 1], 'n_freq_downsample': [180, 60, 1], 'learning_rate': 0.003046177554343493, 'scaler_type': 'robust', 'max_steps': 1100.0, 'batch_size': 256, 'windows_batch_size': 256, 'random_seed': 20, 'input_size': 120, 'step_size': 24}. Best is trial 11 with value: 2452.10400390625.
[rank: 0] Seed set to 18
GPU available: True (cuda), used: True
TPU available: False, using: 0 TPU cores
HPU available: False, using: 0 HPUs
LOCAL_RANK: 0 - CUDA_VISIBLE_DEVICES: [0,1,2,3,4,5,6,7]

  | Name         | Type          | Params | Mode 
-------------------------------------------------------
0 | loss         | RMSE          | 0      | train
1 | padder_train | ConstantPad1d | 0      | train
2 | scaler       | TemporalNorm  | 0      | train
3 | blocks       | ModuleList    | 2.7 M  | train
-------------------------------------------------------
2.7 M     Trainable params
0         Non-trainable params
2.7 M     Total params
10.991    Total estimated model params size (MB)
34        Modules in train mode
0         Modules in eval mode
SLURM auto-requeueing enabled. Setting signal handlers.
`Trainer.fit` stopped: `max_steps=1000.0` reached.
[I 2025-01-14 18:21:41,661] Trial 12 finished with value: 2413.859375 and parameters: {'n_pool_kernel_size': [1, 1, 1], 'n_freq_downsample': [180, 60, 1], 'learning_rate': 0.0017139041433944582, 'scaler_type': 'robust', 'max_steps': 1000.0, 'batch_size': 256, 'windows_batch_size': 256, 'random_seed': 18, 'input_size': 120, 'step_size': 24}. Best is trial 12 with value: 2413.859375.
[rank: 0] Seed set to 16
GPU available: True (cuda), used: True
TPU available: False, using: 0 TPU cores
HPU available: False, using: 0 HPUs
LOCAL_RANK: 0 - CUDA_VISIBLE_DEVICES: [0,1,2,3,4,5,6,7]

  | Name         | Type          | Params | Mode 
-------------------------------------------------------
0 | loss         | RMSE          | 0      | train
1 | padder_train | ConstantPad1d | 0      | train
2 | scaler       | TemporalNorm  | 0      | train
3 | blocks       | ModuleList    | 2.8 M  | train
-------------------------------------------------------
2.8 M     Trainable params
0         Non-trainable params
2.8 M     Total params
11.086    Total estimated model params size (MB)
34        Modules in train mode
0         Modules in eval mode
SLURM auto-requeueing enabled. Setting signal handlers.
`Trainer.fit` stopped: `max_steps=1100.0` reached.
[I 2025-01-14 18:22:01,570] Trial 13 finished with value: 5104.8232421875 and parameters: {'n_pool_kernel_size': [1, 1, 1], 'n_freq_downsample': [1, 1, 1], 'learning_rate': 0.008890540731085039, 'scaler_type': 'robust', 'max_steps': 1100.0, 'batch_size': 256, 'windows_batch_size': 256, 'random_seed': 16, 'input_size': 120, 'step_size': 24}. Best is trial 12 with value: 2413.859375.
[rank: 0] Seed set to 17
GPU available: True (cuda), used: True
TPU available: False, using: 0 TPU cores
HPU available: False, using: 0 HPUs
LOCAL_RANK: 0 - CUDA_VISIBLE_DEVICES: [0,1,2,3,4,5,6,7]

  | Name         | Type          | Params | Mode 
-------------------------------------------------------
0 | loss         | RMSE          | 0      | train
1 | padder_train | ConstantPad1d | 0      | train
2 | scaler       | TemporalNorm  | 0      | train
3 | blocks       | ModuleList    | 2.7 M  | train
-------------------------------------------------------
2.7 M     Trainable params
0         Non-trainable params
2.7 M     Total params
10.991    Total estimated model params size (MB)
34        Modules in train mode
0         Modules in eval mode
SLURM auto-requeueing enabled. Setting signal handlers.
`Trainer.fit` stopped: `max_steps=1300.0` reached.
[I 2025-01-14 18:22:25,652] Trial 14 finished with value: 2451.7451171875 and parameters: {'n_pool_kernel_size': [1, 1, 1], 'n_freq_downsample': [168, 24, 1], 'learning_rate': 0.0011654123789047698, 'scaler_type': 'robust', 'max_steps': 1300.0, 'batch_size': 256, 'windows_batch_size': 256, 'random_seed': 17, 'input_size': 120, 'step_size': 24}. Best is trial 12 with value: 2413.859375.
[rank: 0] Seed set to 16
GPU available: True (cuda), used: True
TPU available: False, using: 0 TPU cores
HPU available: False, using: 0 HPUs
LOCAL_RANK: 0 - CUDA_VISIBLE_DEVICES: [0,1,2,3,4,5,6,7]

  | Name         | Type          | Params | Mode 
-------------------------------------------------------
0 | loss         | RMSE          | 0      | train
1 | padder_train | ConstantPad1d | 0      | train
2 | scaler       | TemporalNorm  | 0      | train
3 | blocks       | ModuleList    | 2.7 M  | train
-------------------------------------------------------
2.7 M     Trainable params
0         Non-trainable params
2.7 M     Total params
10.696    Total estimated model params size (MB)
34        Modules in train mode
0         Modules in eval mode
SLURM auto-requeueing enabled. Setting signal handlers.
`Trainer.fit` stopped: `max_steps=1400.0` reached.
