[I 2025-01-14 18:49:38,607] Trial 15 finished with value: 2216.308349609375 and parameters: {'n_pool_kernel_size': [1, 1, 1], 'n_freq_downsample': [168, 24, 1], 'learning_rate': 0.0009398666446964514, 'scaler_type': None, 'max_steps': 1100.0, 'batch_size': 32, 'windows_batch_size': 512, 'random_seed': 18, 'input_size': 48, 'step_size': 24}. Best is trial 3 with value: 1399.870849609375.
[rank: 0] Seed set to 14
GPU available: True (cuda), used: True
TPU available: False, using: 0 TPU cores
HPU available: False, using: 0 HPUs
LOCAL_RANK: 0 - CUDA_VISIBLE_DEVICES: [0,1,2,3,4,5,6,7]

  | Name         | Type          | Params | Mode 
-------------------------------------------------------
0 | loss         | RMSE          | 0      | train
1 | padder_train | ConstantPad1d | 0      | train
2 | scaler       | TemporalNorm  | 0      | train
3 | blocks       | ModuleList    | 2.5 M  | train
-------------------------------------------------------
2.5 M     Trainable params
0         Non-trainable params
2.5 M     Total params
9.856     Total estimated model params size (MB)
34        Modules in train mode
0         Modules in eval mode
SLURM auto-requeueing enabled. Setting signal handlers.
`Trainer.fit` stopped: `max_steps=1300.0` reached.
[I 2025-01-14 18:50:00,731] Trial 16 finished with value: 1479.379638671875 and parameters: {'n_pool_kernel_size': [2, 2, 1], 'n_freq_downsample': [1, 1, 1], 'learning_rate': 0.00887508457582395, 'scaler_type': None, 'max_steps': 1300.0, 'batch_size': 32, 'windows_batch_size': 512, 'random_seed': 14, 'input_size': 24, 'step_size': 24}. Best is trial 3 with value: 1399.870849609375.
[rank: 0] Seed set to 13
GPU available: True (cuda), used: True
TPU available: False, using: 0 TPU cores
HPU available: False, using: 0 HPUs
LOCAL_RANK: 0 - CUDA_VISIBLE_DEVICES: [0,1,2,3,4,5,6,7]

  | Name         | Type          | Params | Mode 
-------------------------------------------------------
0 | loss         | RMSE          | 0      | train
1 | padder_train | ConstantPad1d | 0      | train
2 | scaler       | TemporalNorm  | 0      | train
3 | blocks       | ModuleList    | 2.5 M  | train
-------------------------------------------------------
2.5 M     Trainable params
0         Non-trainable params
2.5 M     Total params
9.856     Total estimated model params size (MB)
34        Modules in train mode
0         Modules in eval mode
SLURM auto-requeueing enabled. Setting signal handlers.
`Trainer.fit` stopped: `max_steps=1000.0` reached.
[I 2025-01-14 18:50:17,634] Trial 17 finished with value: 1481.641357421875 and parameters: {'n_pool_kernel_size': [2, 2, 1], 'n_freq_downsample': [1, 1, 1], 'learning_rate': 0.007990870626695411, 'scaler_type': None, 'max_steps': 1000.0, 'batch_size': 128, 'windows_batch_size': 512, 'random_seed': 13, 'input_size': 24, 'step_size': 24}. Best is trial 3 with value: 1399.870849609375.
[rank: 0] Seed set to 15
GPU available: True (cuda), used: True
TPU available: False, using: 0 TPU cores
HPU available: False, using: 0 HPUs
LOCAL_RANK: 0 - CUDA_VISIBLE_DEVICES: [0,1,2,3,4,5,6,7]

  | Name         | Type          | Params | Mode 
-------------------------------------------------------
0 | loss         | RMSE          | 0      | train
1 | padder_train | ConstantPad1d | 0      | train
2 | scaler       | TemporalNorm  | 0      | train
3 | blocks       | ModuleList    | 2.5 M  | train
-------------------------------------------------------
2.5 M     Trainable params
0         Non-trainable params
2.5 M     Total params
9.856     Total estimated model params size (MB)
34        Modules in train mode
0         Modules in eval mode
SLURM auto-requeueing enabled. Setting signal handlers.
`Trainer.fit` stopped: `max_steps=1400.0` reached.
[I 2025-01-14 18:50:42,472] Trial 18 finished with value: 8250.1552734375 and parameters: {'n_pool_kernel_size': [2, 2, 1], 'n_freq_downsample': [1, 1, 1], 'learning_rate': 0.019127889433809143, 'scaler_type': 'robust', 'max_steps': 1400.0, 'batch_size': 64, 'windows_batch_size': 128, 'random_seed': 15, 'input_size': 24, 'step_size': 1}. Best is trial 3 with value: 1399.870849609375.
[rank: 0] Seed set to 11
GPU available: True (cuda), used: True
TPU available: False, using: 0 TPU cores
HPU available: False, using: 0 HPUs
LOCAL_RANK: 0 - CUDA_VISIBLE_DEVICES: [0,1,2,3,4,5,6,7]

  | Name         | Type          | Params | Mode 
-------------------------------------------------------
0 | loss         | RMSE          | 0      | train
1 | padder_train | ConstantPad1d | 0      | train
2 | scaler       | TemporalNorm  | 0      | train
3 | blocks       | ModuleList    | 2.5 M  | train
-------------------------------------------------------
2.5 M     Trainable params
0         Non-trainable params
2.5 M     Total params
10.011    Total estimated model params size (MB)
34        Modules in train mode
0         Modules in eval mode
SLURM auto-requeueing enabled. Setting signal handlers.
`Trainer.fit` stopped: `max_steps=1300.0` reached.
[I 2025-01-14 18:51:04,402] Trial 19 finished with value: 5170.73291015625 and parameters: {'n_pool_kernel_size': [2, 2, 1], 'n_freq_downsample': [60, 8, 1], 'learning_rate': 0.010471481475826884, 'scaler_type': None, 'max_steps': 1300.0, 'batch_size': 32, 'windows_batch_size': 512, 'random_seed': 11, 'input_size': 48, 'step_size': 24}. Best is trial 3 with value: 1399.870849609375.
[rank: 0] Seed set to 9
GPU available: True (cuda), used: True
TPU available: False, using: 0 TPU cores
HPU available: False, using: 0 HPUs
LOCAL_RANK: 0 - CUDA_VISIBLE_DEVICES: [0,1,2,3,4,5,6,7]

  | Name         | Type          | Params | Mode 
-------------------------------------------------------
0 | loss         | RMSE          | 0      | train
1 | padder_train | ConstantPad1d | 0      | train
2 | scaler       | TemporalNorm  | 0      | train
3 | blocks       | ModuleList    | 2.6 M  | train
-------------------------------------------------------
2.6 M     Trainable params
0         Non-trainable params
2.6 M     Total params
10.253    Total estimated model params size (MB)
34        Modules in train mode
0         Modules in eval mode
SLURM auto-requeueing enabled. Setting signal handlers.
`Trainer.fit` stopped: `max_steps=1500.0` reached.
[I 2025-01-14 18:51:29,193] Trial 20 finished with value: 25895106.0 and parameters: {'n_pool_kernel_size': [2, 2, 1], 'n_freq_downsample': [40, 20, 1], 'learning_rate': 0.03429647994177124, 'scaler_type': None, 'max_steps': 1500.0, 'batch_size': 32, 'windows_batch_size': 512, 'random_seed': 9, 'input_size': 72, 'step_size': 24}. Best is trial 3 with value: 1399.870849609375.
[rank: 0] Seed set to 12
GPU available: True (cuda), used: True
TPU available: False, using: 0 TPU cores
HPU available: False, using: 0 HPUs
LOCAL_RANK: 0 - CUDA_VISIBLE_DEVICES: [0,1,2,3,4,5,6,7]

  | Name         | Type          | Params | Mode 
-------------------------------------------------------
0 | loss         | RMSE          | 0      | train
1 | padder_train | ConstantPad1d | 0      | train
2 | scaler       | TemporalNorm  | 0      | train
3 | blocks       | ModuleList    | 2.5 M  | train
-------------------------------------------------------
2.5 M     Trainable params
0         Non-trainable params
2.5 M     Total params
9.856     Total estimated model params size (MB)
34        Modules in train mode
0         Modules in eval mode
SLURM auto-requeueing enabled. Setting signal handlers.
`Trainer.fit` stopped: `max_steps=1000.0` reached.
[I 2025-01-14 18:51:45,738] Trial 21 finished with value: 1573.263427734375 and parameters: {'n_pool_kernel_size': [2, 2, 1], 'n_freq_downsample': [1, 1, 1], 'learning_rate': 0.0061104485644849615, 'scaler_type': None, 'max_steps': 1000.0, 'batch_size': 128, 'windows_batch_size': 512, 'random_seed': 12, 'input_size': 24, 'step_size': 24}. Best is trial 3 with value: 1399.870849609375.
[rank: 0] Seed set to 13
GPU available: True (cuda), used: True
TPU available: False, using: 0 TPU cores
HPU available: False, using: 0 HPUs
LOCAL_RANK: 0 - CUDA_VISIBLE_DEVICES: [0,1,2,3,4,5,6,7]

  | Name         | Type          | Params | Mode 
-------------------------------------------------------
0 | loss         | RMSE          | 0      | train
1 | padder_train | ConstantPad1d | 0      | train
2 | scaler       | TemporalNorm  | 0      | train
3 | blocks       | ModuleList    | 2.5 M  | train
-------------------------------------------------------
2.5 M     Trainable params
0         Non-trainable params
2.5 M     Total params
9.856     Total estimated model params size (MB)
34        Modules in train mode
0         Modules in eval mode
SLURM auto-requeueing enabled. Setting signal handlers.
`Trainer.fit` stopped: `max_steps=1000.0` reached.
[I 2025-01-14 18:52:02,385] Trial 22 finished with value: 1925.76611328125 and parameters: {'n_pool_kernel_size': [2, 2, 1], 'n_freq_downsample': [1, 1, 1], 'learning_rate': 0.007389787782981123, 'scaler_type': None, 'max_steps': 1000.0, 'batch_size': 128, 'windows_batch_size': 512, 'random_seed': 13, 'input_size': 24, 'step_size': 24}. Best is trial 3 with value: 1399.870849609375.
[rank: 0] Seed set to 15
GPU available: True (cuda), used: True
TPU available: False, using: 0 TPU cores
HPU available: False, using: 0 HPUs
LOCAL_RANK: 0 - CUDA_VISIBLE_DEVICES: [0,1,2,3,4,5,6,7]

  | Name         | Type          | Params | Mode 
-------------------------------------------------------
0 | loss         | RMSE          | 0      | train
1 | padder_train | ConstantPad1d | 0      | train
2 | scaler       | TemporalNorm  | 0      | train
3 | blocks       | ModuleList    | 2.5 M  | train
-------------------------------------------------------
2.5 M     Trainable params
0         Non-trainable params
2.5 M     Total params
9.856     Total estimated model params size (MB)
34        Modules in train mode
0         Modules in eval mode
SLURM auto-requeueing enabled. Setting signal handlers.
`Trainer.fit` stopped: `max_steps=1300.0` reached.
[I 2025-01-14 18:52:23,818] Trial 23 finished with value: 1652.984619140625 and parameters: {'n_pool_kernel_size': [2, 2, 1], 'n_freq_downsample': [1, 1, 1], 'learning_rate': 0.0017162266818227278, 'scaler_type': None, 'max_steps': 1300.0, 'batch_size': 128, 'windows_batch_size': 512, 'random_seed': 15, 'input_size': 24, 'step_size': 24}. Best is trial 3 with value: 1399.870849609375.
[rank: 0] Seed set to 17
GPU available: True (cuda), used: True
TPU available: False, using: 0 TPU cores
HPU available: False, using: 0 HPUs
LOCAL_RANK: 0 - CUDA_VISIBLE_DEVICES: [0,1,2,3,4,5,6,7]

  | Name         | Type          | Params | Mode 
-------------------------------------------------------
0 | loss         | RMSE          | 0      | train
1 | padder_train | ConstantPad1d | 0      | train
2 | scaler       | TemporalNorm  | 0      | train
3 | blocks       | ModuleList    | 2.5 M  | train
-------------------------------------------------------
2.5 M     Trainable params
0         Non-trainable params
2.5 M     Total params
9.856     Total estimated model params size (MB)
34        Modules in train mode
0         Modules in eval mode
SLURM auto-requeueing enabled. Setting signal handlers.
`Trainer.fit` stopped: `max_steps=1100.0` reached.
[I 2025-01-14 18:52:42,251] Trial 24 finished with value: 8720.7705078125 and parameters: {'n_pool_kernel_size': [2, 2, 1], 'n_freq_downsample': [1, 1, 1], 'learning_rate': 0.018787981649338054, 'scaler_type': None, 'max_steps': 1100.0, 'batch_size': 128, 'windows_batch_size': 512, 'random_seed': 17, 'input_size': 24, 'step_size': 24}. Best is trial 3 with value: 1399.870849609375.
[rank: 0] Seed set to 14
GPU available: True (cuda), used: True
TPU available: False, using: 0 TPU cores
HPU available: False, using: 0 HPUs
LOCAL_RANK: 0 - CUDA_VISIBLE_DEVICES: [0,1,2,3,4,5,6,7]

  | Name         | Type          | Params | Mode 
-------------------------------------------------------
0 | loss         | RMSE          | 0      | train
1 | padder_train | ConstantPad1d | 0      | train
2 | scaler       | TemporalNorm  | 0      | train
3 | blocks       | ModuleList    | 2.7 M  | train
-------------------------------------------------------
2.7 M     Trainable params
0         Non-trainable params
2.7 M     Total params
10.840    Total estimated model params size (MB)
34        Modules in train mode
0         Modules in eval mode
SLURM auto-requeueing enabled. Setting signal handlers.
`Trainer.fit` stopped: `max_steps=1100.0` reached.
[I 2025-01-14 18:53:02,358] Trial 25 finished with value: 4575.2822265625 and parameters: {'n_pool_kernel_size': [2, 2, 1], 'n_freq_downsample': [1, 1, 1], 'learning_rate': 0.008737998288687399, 'scaler_type': 'robust', 'max_steps': 1100.0, 'batch_size': 128, 'windows_batch_size': 512, 'random_seed': 14, 'input_size': 120, 'step_size': 24}. Best is trial 3 with value: 1399.870849609375.
[rank: 0] Seed set to 8
GPU available: True (cuda), used: True
TPU available: False, using: 0 TPU cores
HPU available: False, using: 0 HPUs
LOCAL_RANK: 0 - CUDA_VISIBLE_DEVICES: [0,1,2,3,4,5,6,7]

  | Name         | Type          | Params | Mode 
-------------------------------------------------------
0 | loss         | RMSE          | 0      | train
1 | padder_train | ConstantPad1d | 0      | train
2 | scaler       | TemporalNorm  | 0      | train
3 | blocks       | ModuleList    | 2.5 M  | train
-------------------------------------------------------
2.5 M     Trainable params
0         Non-trainable params
2.5 M     Total params
9.831     Total estimated model params size (MB)
34        Modules in train mode
0         Modules in eval mode
SLURM auto-requeueing enabled. Setting signal handlers.
`Trainer.fit` stopped: `max_steps=600.0` reached.
[I 2025-01-14 18:53:12,550] Trial 26 finished with value: 1736.986083984375 and parameters: {'n_pool_kernel_size': [2, 2, 2], 'n_freq_downsample': [1, 1, 1], 'learning_rate': 0.003228751268583913, 'scaler_type': None, 'max_steps': 600.0, 'batch_size': 256, 'windows_batch_size': 1024, 'random_seed': 8, 'input_size': 24, 'step_size': 1}. Best is trial 3 with value: 1399.870849609375.
[rank: 0] Seed set to 13
GPU available: True (cuda), used: True
TPU available: False, using: 0 TPU cores
HPU available: False, using: 0 HPUs
LOCAL_RANK: 0 - CUDA_VISIBLE_DEVICES: [0,1,2,3,4,5,6,7]

  | Name         | Type          | Params | Mode 
-------------------------------------------------------
0 | loss         | RMSE          | 0      | train
1 | padder_train | ConstantPad1d | 0      | train
2 | scaler       | TemporalNorm  | 0      | train
3 | blocks       | ModuleList    | 2.4 M  | train
-------------------------------------------------------
2.4 M     Trainable params
0         Non-trainable params
2.4 M     Total params
9.730     Total estimated model params size (MB)
34        Modules in train mode
0         Modules in eval mode
SLURM auto-requeueing enabled. Setting signal handlers.
`Trainer.fit` stopped: `max_steps=900.0` reached.
[I 2025-01-14 18:53:27,399] Trial 27 finished with value: 1831.8546142578125 and parameters: {'n_pool_kernel_size': [8, 4, 1], 'n_freq_downsample': [168, 24, 1], 'learning_rate': 0.0013237887855487283, 'scaler_type': None, 'max_steps': 900.0, 'batch_size': 64, 'windows_batch_size': 256, 'random_seed': 13, 'input_size': 24, 'step_size': 24}. Best is trial 3 with value: 1399.870849609375.
[rank: 0] Seed set to 18
GPU available: True (cuda), used: True
TPU available: False, using: 0 TPU cores
HPU available: False, using: 0 HPUs
LOCAL_RANK: 0 - CUDA_VISIBLE_DEVICES: [0,1,2,3,4,5,6,7]

  | Name         | Type          | Params | Mode 
-------------------------------------------------------
0 | loss         | RMSE          | 0      | train
1 | padder_train | ConstantPad1d | 0      | train
2 | scaler       | TemporalNorm  | 0      | train
3 | blocks       | ModuleList    | 2.5 M  | train
-------------------------------------------------------
2.5 M     Trainable params
0         Non-trainable params
2.5 M     Total params
9.814     Total estimated model params size (MB)
34        Modules in train mode
0         Modules in eval mode
SLURM auto-requeueing enabled. Setting signal handlers.
`Trainer.fit` stopped: `max_steps=1400.0` reached.
[I 2025-01-14 18:53:50,431] Trial 28 finished with value: 1626.7978515625 and parameters: {'n_pool_kernel_size': [1, 1, 1], 'n_freq_downsample': [60, 8, 1], 'learning_rate': 0.004736008788759503, 'scaler_type': None, 'max_steps': 1400.0, 'batch_size': 32, 'windows_batch_size': 128, 'random_seed': 18, 'input_size': 24, 'step_size': 24}. Best is trial 3 with value: 1399.870849609375.
[rank: 0] Seed set to 16
GPU available: True (cuda), used: True
TPU available: False, using: 0 TPU cores
HPU available: False, using: 0 HPUs
LOCAL_RANK: 0 - CUDA_VISIBLE_DEVICES: [0,1,2,3,4,5,6,7]

  | Name         | Type          | Params | Mode 
-------------------------------------------------------
0 | loss         | RMSE          | 0      | train
1 | padder_train | ConstantPad1d | 0      | train
2 | scaler       | TemporalNorm  | 0      | train
3 | blocks       | ModuleList    | 2.6 M  | train
-------------------------------------------------------
2.6 M     Trainable params
0         Non-trainable params
2.6 M     Total params
10.401    Total estimated model params size (MB)
34        Modules in train mode
0         Modules in eval mode
SLURM auto-requeueing enabled. Setting signal handlers.
`Trainer.fit` stopped: `max_steps=1500.0` reached.
[I 2025-01-14 18:54:15,488] Trial 29 finished with value: 1779098.875 and parameters: {'n_pool_kernel_size': [2, 2, 2], 'n_freq_downsample': [40, 20, 1], 'learning_rate': 0.035932469725745216, 'scaler_type': None, 'max_steps': 1500.0, 'batch_size': 32, 'windows_batch_size': 1024, 'random_seed': 16, 'input_size': 96, 'step_size': 1}. Best is trial 3 with value: 1399.870849609375.
[rank: 0] Seed set to 15
GPU available: True (cuda), used: True
TPU available: False, using: 0 TPU cores
HPU available: False, using: 0 HPUs
LOCAL_RANK: 0 - CUDA_VISIBLE_DEVICES: [0,1,2,3,4,5,6,7]

  | Name         | Type          | Params | Mode 
-------------------------------------------------------
0 | loss         | RMSE          | 0      | train
1 | padder_train | ConstantPad1d | 0      | train
2 | scaler       | TemporalNorm  | 0      | train
3 | blocks       | ModuleList    | 2.6 M  | train
-------------------------------------------------------
2.6 M     Trainable params
0         Non-trainable params
2.6 M     Total params
10.229    Total estimated model params size (MB)
34        Modules in train mode
0         Modules in eval mode
SLURM auto-requeueing enabled. Setting signal handlers.
`Trainer.fit` stopped: `max_steps=1300.0` reached.
[I 2025-01-14 18:54:37,925] Trial 30 finished with value: 2246.3046875 and parameters: {'n_pool_kernel_size': [16, 8, 1], 'n_freq_downsample': [1, 1, 1], 'learning_rate': 0.002928028868662363, 'scaler_type': 'robust', 'max_steps': 1300.0, 'batch_size': 128, 'windows_batch_size': 512, 'random_seed': 15, 'input_size': 72, 'step_size': 24}. Best is trial 3 with value: 1399.870849609375.
[rank: 0] Seed set to 12
GPU available: True (cuda), used: True
TPU available: False, using: 0 TPU cores
HPU available: False, using: 0 HPUs
LOCAL_RANK: 0 - CUDA_VISIBLE_DEVICES: [0,1,2,3,4,5,6,7]

  | Name         | Type          | Params | Mode 
-------------------------------------------------------
0 | loss         | RMSE          | 0      | train
1 | padder_train | ConstantPad1d | 0      | train
2 | scaler       | TemporalNorm  | 0      | train
3 | blocks       | ModuleList    | 2.5 M  | train
-------------------------------------------------------
2.5 M     Trainable params
0         Non-trainable params
2.5 M     Total params
9.856     Total estimated model params size (MB)
34        Modules in train mode
0         Modules in eval mode
SLURM auto-requeueing enabled. Setting signal handlers.
`Trainer.fit` stopped: `max_steps=1000.0` reached.
[I 2025-01-14 18:54:54,347] Trial 31 finished with value: 1606.5267333984375 and parameters: {'n_pool_kernel_size': [2, 2, 1], 'n_freq_downsample': [1, 1, 1], 'learning_rate': 0.005902212621641009, 'scaler_type': None, 'max_steps': 1000.0, 'batch_size': 128, 'windows_batch_size': 512, 'random_seed': 12, 'input_size': 24, 'step_size': 24}. Best is trial 3 with value: 1399.870849609375.
[rank: 0] Seed set to 12
GPU available: True (cuda), used: True
TPU available: False, using: 0 TPU cores
HPU available: False, using: 0 HPUs
LOCAL_RANK: 0 - CUDA_VISIBLE_DEVICES: [0,1,2,3,4,5,6,7]

  | Name         | Type          | Params | Mode 
-------------------------------------------------------
0 | loss         | RMSE          | 0      | train
1 | padder_train | ConstantPad1d | 0      | train
2 | scaler       | TemporalNorm  | 0      | train
3 | blocks       | ModuleList    | 2.5 M  | train
-------------------------------------------------------
2.5 M     Trainable params
0         Non-trainable params
2.5 M     Total params
9.856     Total estimated model params size (MB)
34        Modules in train mode
0         Modules in eval mode
SLURM auto-requeueing enabled. Setting signal handlers.
`Trainer.fit` stopped: `max_steps=900.0` reached.
