[I 2025-01-14 13:12:37,819] Trial 15 finished with value: 85696.859375 and parameters: {'n_pool_kernel_size': [4, 4, 4], 'n_freq_downsample': [40, 20, 1], 'learning_rate': 0.025352298276345886, 'scaler_type': None, 'max_steps': 800.0, 'batch_size': 32, 'windows_batch_size': 512, 'random_seed': 11, 'input_size': 96, 'step_size': 24}. Best is trial 3 with value: 0.0.
[rank: 0] Seed set to 17
GPU available: True (cuda), used: True
TPU available: False, using: 0 TPU cores
HPU available: False, using: 0 HPUs
LOCAL_RANK: 0 - CUDA_VISIBLE_DEVICES: [0,1,2,3,4,5,6,7]

  | Name         | Type          | Params | Mode 
-------------------------------------------------------
0 | loss         | RMSE          | 0      | train
1 | padder_train | ConstantPad1d | 0      | train
2 | scaler       | TemporalNorm  | 0      | train
3 | blocks       | ModuleList    | 2.4 M  | train
-------------------------------------------------------
2.4 M     Trainable params
0         Non-trainable params
2.4 M     Total params
9.722     Total estimated model params size (MB)
34        Modules in train mode
0         Modules in eval mode
SLURM auto-requeueing enabled. Setting signal handlers.
`Trainer.fit` stopped: `max_steps=900.0` reached.
[I 2025-01-14 13:12:53,333] Trial 16 finished with value: 2184.104736328125 and parameters: {'n_pool_kernel_size': [16, 8, 1], 'n_freq_downsample': [180, 60, 1], 'learning_rate': 0.0026727355885973673, 'scaler_type': None, 'max_steps': 900.0, 'batch_size': 128, 'windows_batch_size': 128, 'random_seed': 17, 'input_size': 24, 'step_size': 24}. Best is trial 3 with value: 0.0.
[rank: 0] Seed set to 14
GPU available: True (cuda), used: True
TPU available: False, using: 0 TPU cores
HPU available: False, using: 0 HPUs
LOCAL_RANK: 0 - CUDA_VISIBLE_DEVICES: [0,1,2,3,4,5,6,7]

  | Name         | Type          | Params | Mode 
-------------------------------------------------------
0 | loss         | RMSE          | 0      | train
1 | padder_train | ConstantPad1d | 0      | train
2 | scaler       | TemporalNorm  | 0      | train
3 | blocks       | ModuleList    | 2.4 M  | train
-------------------------------------------------------
2.4 M     Trainable params
0         Non-trainable params
2.4 M     Total params
9.737     Total estimated model params size (MB)
34        Modules in train mode
0         Modules in eval mode
SLURM auto-requeueing enabled. Setting signal handlers.
`Trainer.fit` stopped: `max_steps=1100.0` reached.
[I 2025-01-14 13:13:12,096] Trial 17 finished with value: 0.0 and parameters: {'n_pool_kernel_size': [2, 2, 2], 'n_freq_downsample': [168, 24, 1], 'learning_rate': 0.05520713978479282, 'scaler_type': None, 'max_steps': 1100.0, 'batch_size': 64, 'windows_batch_size': 512, 'random_seed': 14, 'input_size': 24, 'step_size': 24}. Best is trial 3 with value: 0.0.
[rank: 0] Seed set to 10
GPU available: True (cuda), used: True
TPU available: False, using: 0 TPU cores
HPU available: False, using: 0 HPUs
LOCAL_RANK: 0 - CUDA_VISIBLE_DEVICES: [0,1,2,3,4,5,6,7]

  | Name         | Type          | Params | Mode 
-------------------------------------------------------
0 | loss         | RMSE          | 0      | train
1 | padder_train | ConstantPad1d | 0      | train
2 | scaler       | TemporalNorm  | 0      | train
3 | blocks       | ModuleList    | 2.7 M  | train
-------------------------------------------------------
2.7 M     Trainable params
0         Non-trainable params
2.7 M     Total params
10.700    Total estimated model params size (MB)
34        Modules in train mode
0         Modules in eval mode
SLURM auto-requeueing enabled. Setting signal handlers.
`Trainer.fit` stopped: `max_steps=700.0` reached.
[I 2025-01-14 13:13:24,167] Trial 18 finished with value: 5672.845703125 and parameters: {'n_pool_kernel_size': [1, 1, 1], 'n_freq_downsample': [60, 8, 1], 'learning_rate': 0.0048093135791493795, 'scaler_type': None, 'max_steps': 700.0, 'batch_size': 32, 'windows_batch_size': 256, 'random_seed': 10, 'input_size': 96, 'step_size': 1}. Best is trial 3 with value: 0.0.
[rank: 0] Seed set to 18
GPU available: True (cuda), used: True
TPU available: False, using: 0 TPU cores
HPU available: False, using: 0 HPUs
LOCAL_RANK: 0 - CUDA_VISIBLE_DEVICES: [0,1,2,3,4,5,6,7]

  | Name         | Type          | Params | Mode 
-------------------------------------------------------
0 | loss         | RMSE          | 0      | train
1 | padder_train | ConstantPad1d | 0      | train
2 | scaler       | TemporalNorm  | 0      | train
3 | blocks       | ModuleList    | 2.5 M  | train
-------------------------------------------------------
2.5 M     Trainable params
0         Non-trainable params
2.5 M     Total params
10.073    Total estimated model params size (MB)
34        Modules in train mode
0         Modules in eval mode
SLURM auto-requeueing enabled. Setting signal handlers.
`Trainer.fit` stopped: `max_steps=1200.0` reached.
[I 2025-01-14 13:13:45,957] Trial 19 finished with value: 1681.6446533203125 and parameters: {'n_pool_kernel_size': [4, 4, 4], 'n_freq_downsample': [60, 8, 1], 'learning_rate': 0.016119786553529237, 'scaler_type': 'robust', 'max_steps': 1200.0, 'batch_size': 256, 'windows_batch_size': 128, 'random_seed': 18, 'input_size': 72, 'step_size': 24}. Best is trial 3 with value: 0.0.
[rank: 0] Seed set to 7
GPU available: True (cuda), used: True
TPU available: False, using: 0 TPU cores
HPU available: False, using: 0 HPUs
LOCAL_RANK: 0 - CUDA_VISIBLE_DEVICES: [0,1,2,3,4,5,6,7]

  | Name         | Type          | Params | Mode 
-------------------------------------------------------
0 | loss         | RMSE          | 0      | train
1 | padder_train | ConstantPad1d | 0      | train
2 | scaler       | TemporalNorm  | 0      | train
3 | blocks       | ModuleList    | 2.6 M  | train
-------------------------------------------------------
2.6 M     Trainable params
0         Non-trainable params
2.6 M     Total params
10.551    Total estimated model params size (MB)
34        Modules in train mode
0         Modules in eval mode
SLURM auto-requeueing enabled. Setting signal handlers.
`Trainer.fit` stopped: `max_steps=900.0` reached.
[I 2025-01-14 13:14:01,443] Trial 20 finished with value: 2818.117431640625 and parameters: {'n_pool_kernel_size': [16, 8, 1], 'n_freq_downsample': [60, 8, 1], 'learning_rate': 0.00011491921630279702, 'scaler_type': None, 'max_steps': 900.0, 'batch_size': 256, 'windows_batch_size': 512, 'random_seed': 7, 'input_size': 120, 'step_size': 24}. Best is trial 3 with value: 0.0.
[rank: 0] Seed set to 20
GPU available: True (cuda), used: True
TPU available: False, using: 0 TPU cores
HPU available: False, using: 0 HPUs
LOCAL_RANK: 0 - CUDA_VISIBLE_DEVICES: [0,1,2,3,4,5,6,7]

  | Name         | Type          | Params | Mode 
-------------------------------------------------------
0 | loss         | RMSE          | 0      | train
1 | padder_train | ConstantPad1d | 0      | train
2 | scaler       | TemporalNorm  | 0      | train
3 | blocks       | ModuleList    | 2.4 M  | train
-------------------------------------------------------
2.4 M     Trainable params
0         Non-trainable params
2.4 M     Total params
9.704     Total estimated model params size (MB)
34        Modules in train mode
0         Modules in eval mode
SLURM auto-requeueing enabled. Setting signal handlers.
`Trainer.fit` stopped: `max_steps=800.0` reached.
[I 2025-01-14 13:14:15,235] Trial 21 finished with value: 24965626.0 and parameters: {'n_pool_kernel_size': [4, 4, 4], 'n_freq_downsample': [60, 8, 1], 'learning_rate': 0.07778196512359091, 'scaler_type': None, 'max_steps': 800.0, 'batch_size': 256, 'windows_batch_size': 128, 'random_seed': 20, 'input_size': 24, 'step_size': 24}. Best is trial 3 with value: 0.0.
[rank: 0] Seed set to 20
GPU available: True (cuda), used: True
TPU available: False, using: 0 TPU cores
HPU available: False, using: 0 HPUs
LOCAL_RANK: 0 - CUDA_VISIBLE_DEVICES: [0,1,2,3,4,5,6,7]

  | Name         | Type          | Params | Mode 
-------------------------------------------------------
0 | loss         | RMSE          | 0      | train
1 | padder_train | ConstantPad1d | 0      | train
2 | scaler       | TemporalNorm  | 0      | train
3 | blocks       | ModuleList    | 2.4 M  | train
-------------------------------------------------------
2.4 M     Trainable params
0         Non-trainable params
2.4 M     Total params
9.704     Total estimated model params size (MB)
34        Modules in train mode
0         Modules in eval mode
SLURM auto-requeueing enabled. Setting signal handlers.
`Trainer.fit` stopped: `max_steps=700.0` reached.
[I 2025-01-14 13:14:27,521] Trial 22 finished with value: 0.0 and parameters: {'n_pool_kernel_size': [4, 4, 4], 'n_freq_downsample': [60, 8, 1], 'learning_rate': 0.09594362097879647, 'scaler_type': None, 'max_steps': 700.0, 'batch_size': 256, 'windows_batch_size': 128, 'random_seed': 20, 'input_size': 24, 'step_size': 24}. Best is trial 3 with value: 0.0.
[rank: 0] Seed set to 17
GPU available: True (cuda), used: True
TPU available: False, using: 0 TPU cores
HPU available: False, using: 0 HPUs
LOCAL_RANK: 0 - CUDA_VISIBLE_DEVICES: [0,1,2,3,4,5,6,7]

  | Name         | Type          | Params | Mode 
-------------------------------------------------------
0 | loss         | RMSE          | 0      | train
1 | padder_train | ConstantPad1d | 0      | train
2 | scaler       | TemporalNorm  | 0      | train
3 | blocks       | ModuleList    | 2.4 M  | train
-------------------------------------------------------
2.4 M     Trainable params
0         Non-trainable params
2.4 M     Total params
9.704     Total estimated model params size (MB)
34        Modules in train mode
0         Modules in eval mode
SLURM auto-requeueing enabled. Setting signal handlers.
`Trainer.fit` stopped: `max_steps=900.0` reached.
[I 2025-01-14 13:14:42,993] Trial 23 finished with value: 669599.75 and parameters: {'n_pool_kernel_size': [4, 4, 4], 'n_freq_downsample': [60, 8, 1], 'learning_rate': 0.03937203729433538, 'scaler_type': None, 'max_steps': 900.0, 'batch_size': 256, 'windows_batch_size': 128, 'random_seed': 17, 'input_size': 24, 'step_size': 24}. Best is trial 3 with value: 0.0.
[rank: 0] Seed set to 14
GPU available: True (cuda), used: True
TPU available: False, using: 0 TPU cores
HPU available: False, using: 0 HPUs
LOCAL_RANK: 0 - CUDA_VISIBLE_DEVICES: [0,1,2,3,4,5,6,7]

  | Name         | Type          | Params | Mode 
-------------------------------------------------------
0 | loss         | RMSE          | 0      | train
1 | padder_train | ConstantPad1d | 0      | train
2 | scaler       | TemporalNorm  | 0      | train
3 | blocks       | ModuleList    | 2.4 M  | train
-------------------------------------------------------
2.4 M     Trainable params
0         Non-trainable params
2.4 M     Total params
9.704     Total estimated model params size (MB)
34        Modules in train mode
0         Modules in eval mode
SLURM auto-requeueing enabled. Setting signal handlers.
`Trainer.fit` stopped: `max_steps=1100.0` reached.
[I 2025-01-14 13:15:01,853] Trial 24 finished with value: 7849.349609375 and parameters: {'n_pool_kernel_size': [4, 4, 4], 'n_freq_downsample': [60, 8, 1], 'learning_rate': 0.026985045672994812, 'scaler_type': None, 'max_steps': 1100.0, 'batch_size': 256, 'windows_batch_size': 128, 'random_seed': 14, 'input_size': 24, 'step_size': 24}. Best is trial 3 with value: 0.0.
[rank: 0] Seed set to 18
GPU available: True (cuda), used: True
TPU available: False, using: 0 TPU cores
HPU available: False, using: 0 HPUs
LOCAL_RANK: 0 - CUDA_VISIBLE_DEVICES: [0,1,2,3,4,5,6,7]

  | Name         | Type          | Params | Mode 
-------------------------------------------------------
0 | loss         | RMSE          | 0      | train
1 | padder_train | ConstantPad1d | 0      | train
2 | scaler       | TemporalNorm  | 0      | train
3 | blocks       | ModuleList    | 2.6 M  | train
-------------------------------------------------------
2.6 M     Trainable params
0         Non-trainable params
2.6 M     Total params
10.340    Total estimated model params size (MB)
34        Modules in train mode
0         Modules in eval mode
SLURM auto-requeueing enabled. Setting signal handlers.
`Trainer.fit` stopped: `max_steps=700.0` reached.
[I 2025-01-14 13:15:13,508] Trial 25 finished with value: 52879.4296875 and parameters: {'n_pool_kernel_size': [16, 8, 1], 'n_freq_downsample': [168, 24, 1], 'learning_rate': 0.05649579827375178, 'scaler_type': None, 'max_steps': 700.0, 'batch_size': 32, 'windows_batch_size': 128, 'random_seed': 18, 'input_size': 96, 'step_size': 24}. Best is trial 3 with value: 0.0.
[rank: 0] Seed set to 20
GPU available: True (cuda), used: True
TPU available: False, using: 0 TPU cores
HPU available: False, using: 0 HPUs
LOCAL_RANK: 0 - CUDA_VISIBLE_DEVICES: [0,1,2,3,4,5,6,7]

  | Name         | Type          | Params | Mode 
-------------------------------------------------------
0 | loss         | RMSE          | 0      | train
1 | padder_train | ConstantPad1d | 0      | train
2 | scaler       | TemporalNorm  | 0      | train
3 | blocks       | ModuleList    | 2.4 M  | train
-------------------------------------------------------
2.4 M     Trainable params
0         Non-trainable params
2.4 M     Total params
9.700     Total estimated model params size (MB)
34        Modules in train mode
0         Modules in eval mode
SLURM auto-requeueing enabled. Setting signal handlers.
`Trainer.fit` stopped: `max_steps=1000.0` reached.
[I 2025-01-14 13:15:30,069] Trial 26 finished with value: 8234108.5 and parameters: {'n_pool_kernel_size': [4, 4, 4], 'n_freq_downsample': [180, 60, 1], 'learning_rate': 0.09060219629321324, 'scaler_type': None, 'max_steps': 1000.0, 'batch_size': 128, 'windows_batch_size': 512, 'random_seed': 20, 'input_size': 24, 'step_size': 1}. Best is trial 3 with value: 0.0.
[rank: 0] Seed set to 11
GPU available: True (cuda), used: True
TPU available: False, using: 0 TPU cores
HPU available: False, using: 0 HPUs
LOCAL_RANK: 0 - CUDA_VISIBLE_DEVICES: [0,1,2,3,4,5,6,7]

  | Name         | Type          | Params | Mode 
-------------------------------------------------------
0 | loss         | RMSE          | 0      | train
1 | padder_train | ConstantPad1d | 0      | train
2 | scaler       | TemporalNorm  | 0      | train
3 | blocks       | ModuleList    | 2.4 M  | train
-------------------------------------------------------
2.4 M     Trainable params
0         Non-trainable params
2.4 M     Total params
9.763     Total estimated model params size (MB)
34        Modules in train mode
0         Modules in eval mode
SLURM auto-requeueing enabled. Setting signal handlers.
`Trainer.fit` stopped: `max_steps=1200.0` reached.
[I 2025-01-14 13:15:49,984] Trial 27 finished with value: 7010.767578125 and parameters: {'n_pool_kernel_size': [2, 2, 1], 'n_freq_downsample': [24, 12, 1], 'learning_rate': 0.01619182108019485, 'scaler_type': None, 'max_steps': 1200.0, 'batch_size': 64, 'windows_batch_size': 256, 'random_seed': 11, 'input_size': 24, 'step_size': 24}. Best is trial 3 with value: 0.0.
[rank: 0] Seed set to 3
GPU available: True (cuda), used: True
TPU available: False, using: 0 TPU cores
HPU available: False, using: 0 HPUs
LOCAL_RANK: 0 - CUDA_VISIBLE_DEVICES: [0,1,2,3,4,5,6,7]

  | Name         | Type          | Params | Mode 
-------------------------------------------------------
0 | loss         | RMSE          | 0      | train
1 | padder_train | ConstantPad1d | 0      | train
2 | scaler       | TemporalNorm  | 0      | train
3 | blocks       | ModuleList    | 2.7 M  | train
-------------------------------------------------------
2.7 M     Trainable params
0         Non-trainable params
2.7 M     Total params
10.696    Total estimated model params size (MB)
34        Modules in train mode
0         Modules in eval mode
SLURM auto-requeueing enabled. Setting signal handlers.
`Trainer.fit` stopped: `max_steps=900.0` reached.
[I 2025-01-14 13:16:05,922] Trial 28 finished with value: 10872038400.0 and parameters: {'n_pool_kernel_size': [1, 1, 1], 'n_freq_downsample': [40, 20, 1], 'learning_rate': 0.05130083950826497, 'scaler_type': 'robust', 'max_steps': 900.0, 'batch_size': 256, 'windows_batch_size': 128, 'random_seed': 3, 'input_size': 96, 'step_size': 24}. Best is trial 3 with value: 0.0.
[rank: 0] Seed set to 6
GPU available: True (cuda), used: True
TPU available: False, using: 0 TPU cores
HPU available: False, using: 0 HPUs
LOCAL_RANK: 0 - CUDA_VISIBLE_DEVICES: [0,1,2,3,4,5,6,7]

  | Name         | Type          | Params | Mode 
-------------------------------------------------------
0 | loss         | RMSE          | 0      | train
1 | padder_train | ConstantPad1d | 0      | train
2 | scaler       | TemporalNorm  | 0      | train
3 | blocks       | ModuleList    | 2.5 M  | train
-------------------------------------------------------
2.5 M     Trainable params
0         Non-trainable params
2.5 M     Total params
9.831     Total estimated model params size (MB)
34        Modules in train mode
0         Modules in eval mode
SLURM auto-requeueing enabled. Setting signal handlers.
`Trainer.fit` stopped: `max_steps=600.0` reached.
[I 2025-01-14 13:16:17,039] Trial 29 finished with value: 51941476.0 and parameters: {'n_pool_kernel_size': [2, 2, 2], 'n_freq_downsample': [1, 1, 1], 'learning_rate': 0.0936059828836915, 'scaler_type': 'standard', 'max_steps': 600.0, 'batch_size': 64, 'windows_batch_size': 1024, 'random_seed': 6, 'input_size': 24, 'step_size': 1}. Best is trial 3 with value: 0.0.
[rank: 0] Seed set to 9
GPU available: True (cuda), used: True
TPU available: False, using: 0 TPU cores
HPU available: False, using: 0 HPUs
LOCAL_RANK: 0 - CUDA_VISIBLE_DEVICES: [0,1,2,3,4,5,6,7]

  | Name         | Type          | Params | Mode 
-------------------------------------------------------
0 | loss         | RMSE          | 0      | train
1 | padder_train | ConstantPad1d | 0      | train
2 | scaler       | TemporalNorm  | 0      | train
3 | blocks       | ModuleList    | 2.5 M  | train
-------------------------------------------------------
2.5 M     Trainable params
0         Non-trainable params
2.5 M     Total params
9.931     Total estimated model params size (MB)
34        Modules in train mode
0         Modules in eval mode
SLURM auto-requeueing enabled. Setting signal handlers.
`Trainer.fit` stopped: `max_steps=1500.0` reached.
[I 2025-01-14 13:16:43,052] Trial 30 finished with value: 5165.53759765625 and parameters: {'n_pool_kernel_size': [16, 8, 1], 'n_freq_downsample': [60, 8, 1], 'learning_rate': 0.03319845092604117, 'scaler_type': 'standard', 'max_steps': 1500.0, 'batch_size': 32, 'windows_batch_size': 512, 'random_seed': 9, 'input_size': 48, 'step_size': 24}. Best is trial 3 with value: 0.0.
[rank: 0] Seed set to 15
GPU available: True (cuda), used: True
TPU available: False, using: 0 TPU cores
HPU available: False, using: 0 HPUs
LOCAL_RANK: 0 - CUDA_VISIBLE_DEVICES: [0,1,2,3,4,5,6,7]

  | Name         | Type          | Params | Mode 
-------------------------------------------------------
0 | loss         | RMSE          | 0      | train
1 | padder_train | ConstantPad1d | 0      | train
2 | scaler       | TemporalNorm  | 0      | train
3 | blocks       | ModuleList    | 2.4 M  | train
-------------------------------------------------------
2.4 M     Trainable params
0         Non-trainable params
2.4 M     Total params
9.737     Total estimated model params size (MB)
34        Modules in train mode
0         Modules in eval mode
SLURM auto-requeueing enabled. Setting signal handlers.
`Trainer.fit` stopped: `max_steps=1100.0` reached.
[I 2025-01-14 13:17:01,541] Trial 31 finished with value: 0.0 and parameters: {'n_pool_kernel_size': [2, 2, 2], 'n_freq_downsample': [168, 24, 1], 'learning_rate': 0.06112386049747256, 'scaler_type': None, 'max_steps': 1100.0, 'batch_size': 64, 'windows_batch_size': 512, 'random_seed': 15, 'input_size': 24, 'step_size': 24}. Best is trial 3 with value: 0.0.
[rank: 0] Seed set to 13
GPU available: True (cuda), used: True
TPU available: False, using: 0 TPU cores
HPU available: False, using: 0 HPUs
LOCAL_RANK: 0 - CUDA_VISIBLE_DEVICES: [0,1,2,3,4,5,6,7]

  | Name         | Type          | Params | Mode 
-------------------------------------------------------
0 | loss         | RMSE          | 0      | train
1 | padder_train | ConstantPad1d | 0      | train
2 | scaler       | TemporalNorm  | 0      | train
3 | blocks       | ModuleList    | 2.4 M  | train
-------------------------------------------------------
2.4 M     Trainable params
0         Non-trainable params
2.4 M     Total params
9.737     Total estimated model params size (MB)
34        Modules in train mode
0         Modules in eval mode
SLURM auto-requeueing enabled. Setting signal handlers.
`Trainer.fit` stopped: `max_steps=1100.0` reached.
