[I 2025-01-14 14:42:07,025] Trial 49 finished with value: 3609.552490234375 and parameters: {'n_pool_kernel_size': [8, 4, 1], 'n_freq_downsample': [180, 60, 1], 'learning_rate': 0.0007279044097706394, 'scaler_type': 'standard', 'max_steps': 600.0, 'batch_size': 256, 'windows_batch_size': 512, 'random_seed': 19, 'input_size': 72, 'step_size': 1}. Best is trial 39 with value: 2357.391357421875.
[rank: 0] Seed set to 9
GPU available: True (cuda), used: True
TPU available: False, using: 0 TPU cores
HPU available: False, using: 0 HPUs
LOCAL_RANK: 0 - CUDA_VISIBLE_DEVICES: [0,1,2,3,4,5,6,7]

  | Name         | Type          | Params | Mode 
-------------------------------------------------------
0 | loss         | RMSE          | 0      | train
1 | padder_train | ConstantPad1d | 0      | train
2 | scaler       | TemporalNorm  | 0      | train
3 | blocks       | ModuleList    | 2.4 M  | train
-------------------------------------------------------
2.4 M     Trainable params
0         Non-trainable params
2.4 M     Total params
9.765     Total estimated model params size (MB)
34        Modules in train mode
0         Modules in eval mode
SLURM auto-requeueing enabled. Setting signal handlers.
`Trainer.fit` stopped: `max_steps=500.0` reached.
GPU available: True (cuda), used: True
TPU available: False, using: 0 TPU cores
HPU available: False, using: 0 HPUs
LOCAL_RANK: 0 - CUDA_VISIBLE_DEVICES: [0,1,2,3,4,5,6,7]
SLURM auto-requeueing enabled. Setting signal handlers.
[I 2025-01-14 14:42:15,619] A new study created in memory with name: no-name-9611e797-1148-4694-a383-ac4d325650b9
[rank: 0] Seed set to 19
GPU available: True (cuda), used: True
TPU available: False, using: 0 TPU cores
HPU available: False, using: 0 HPUs
LOCAL_RANK: 0 - CUDA_VISIBLE_DEVICES: [0,1,2,3,4,5,6,7]

  | Name         | Type          | Params | Mode 
-------------------------------------------------------
0 | loss         | RMSE          | 0      | train
1 | padder_train | ConstantPad1d | 0      | train
2 | scaler       | TemporalNorm  | 0      | train
3 | blocks       | ModuleList    | 2.5 M  | train
-------------------------------------------------------
2.5 M     Trainable params
0         Non-trainable params
2.5 M     Total params
9.927     Total estimated model params size (MB)
34        Modules in train mode
0         Modules in eval mode
SLURM auto-requeueing enabled. Setting signal handlers.
`Trainer.fit` stopped: `max_steps=900.0` reached.
[I 2025-01-14 14:42:31,511] Trial 0 finished with value: 3942.71630859375 and parameters: {'n_pool_kernel_size': [16, 8, 1], 'n_freq_downsample': [40, 20, 1], 'learning_rate': 0.0003442453347237336, 'scaler_type': 'standard', 'max_steps': 900.0, 'batch_size': 256, 'windows_batch_size': 256, 'random_seed': 19, 'input_size': 48, 'step_size': 24}. Best is trial 0 with value: 3942.71630859375.
[rank: 0] Seed set to 4
GPU available: True (cuda), used: True
TPU available: False, using: 0 TPU cores
HPU available: False, using: 0 HPUs
LOCAL_RANK: 0 - CUDA_VISIBLE_DEVICES: [0,1,2,3,4,5,6,7]

  | Name         | Type          | Params | Mode 
-------------------------------------------------------
0 | loss         | RMSE          | 0      | train
1 | padder_train | ConstantPad1d | 0      | train
2 | scaler       | TemporalNorm  | 0      | train
3 | blocks       | ModuleList    | 2.6 M  | train
-------------------------------------------------------
2.6 M     Trainable params
0         Non-trainable params
2.6 M     Total params
10.438    Total estimated model params size (MB)
34        Modules in train mode
0         Modules in eval mode
SLURM auto-requeueing enabled. Setting signal handlers.
`Trainer.fit` stopped: `max_steps=1000.0` reached.
[I 2025-01-14 14:42:49,569] Trial 1 finished with value: 10026.3203125 and parameters: {'n_pool_kernel_size': [4, 4, 4], 'n_freq_downsample': [168, 24, 1], 'learning_rate': 0.028676349188816386, 'scaler_type': 'robust', 'max_steps': 1000.0, 'batch_size': 64, 'windows_batch_size': 256, 'random_seed': 4, 'input_size': 120, 'step_size': 1}. Best is trial 0 with value: 3942.71630859375.
[rank: 0] Seed set to 14
GPU available: True (cuda), used: True
TPU available: False, using: 0 TPU cores
HPU available: False, using: 0 HPUs
LOCAL_RANK: 0 - CUDA_VISIBLE_DEVICES: [0,1,2,3,4,5,6,7]

  | Name         | Type          | Params | Mode 
-------------------------------------------------------
0 | loss         | RMSE          | 0      | train
1 | padder_train | ConstantPad1d | 0      | train
2 | scaler       | TemporalNorm  | 0      | train
3 | blocks       | ModuleList    | 2.5 M  | train
-------------------------------------------------------
2.5 M     Trainable params
0         Non-trainable params
2.5 M     Total params
10.110    Total estimated model params size (MB)
34        Modules in train mode
0         Modules in eval mode
SLURM auto-requeueing enabled. Setting signal handlers.
`Trainer.fit` stopped: `max_steps=1300.0` reached.
[I 2025-01-14 14:43:12,603] Trial 2 finished with value: 6191.68310546875 and parameters: {'n_pool_kernel_size': [1, 1, 1], 'n_freq_downsample': [60, 8, 1], 'learning_rate': 0.017227720708098127, 'scaler_type': 'standard', 'max_steps': 1300.0, 'batch_size': 256, 'windows_batch_size': 128, 'random_seed': 14, 'input_size': 48, 'step_size': 1}. Best is trial 0 with value: 3942.71630859375.
[rank: 0] Seed set to 6
GPU available: True (cuda), used: True
TPU available: False, using: 0 TPU cores
HPU available: False, using: 0 HPUs
LOCAL_RANK: 0 - CUDA_VISIBLE_DEVICES: [0,1,2,3,4,5,6,7]

  | Name         | Type          | Params | Mode 
-------------------------------------------------------
0 | loss         | RMSE          | 0      | train
1 | padder_train | ConstantPad1d | 0      | train
2 | scaler       | TemporalNorm  | 0      | train
3 | blocks       | ModuleList    | 2.4 M  | train
-------------------------------------------------------
2.4 M     Trainable params
0         Non-trainable params
2.4 M     Total params
9.700     Total estimated model params size (MB)
34        Modules in train mode
0         Modules in eval mode
SLURM auto-requeueing enabled. Setting signal handlers.
`Trainer.fit` stopped: `max_steps=1200.0` reached.
[I 2025-01-14 14:43:33,747] Trial 3 finished with value: 7004.82275390625 and parameters: {'n_pool_kernel_size': [4, 4, 4], 'n_freq_downsample': [40, 20, 1], 'learning_rate': 0.002101925839290389, 'scaler_type': 'standard', 'max_steps': 1200.0, 'batch_size': 32, 'windows_batch_size': 256, 'random_seed': 6, 'input_size': 24, 'step_size': 1}. Best is trial 0 with value: 3942.71630859375.
[rank: 0] Seed set to 18
GPU available: True (cuda), used: True
TPU available: False, using: 0 TPU cores
HPU available: False, using: 0 HPUs
LOCAL_RANK: 0 - CUDA_VISIBLE_DEVICES: [0,1,2,3,4,5,6,7]

  | Name         | Type          | Params | Mode 
-------------------------------------------------------
0 | loss         | RMSE          | 0      | train
1 | padder_train | ConstantPad1d | 0      | train
2 | scaler       | TemporalNorm  | 0      | train
3 | blocks       | ModuleList    | 2.6 M  | train
-------------------------------------------------------
2.6 M     Trainable params
0         Non-trainable params
2.6 M     Total params
10.440    Total estimated model params size (MB)
34        Modules in train mode
0         Modules in eval mode
SLURM auto-requeueing enabled. Setting signal handlers.
`Trainer.fit` stopped: `max_steps=1400.0` reached.
[I 2025-01-14 14:43:59,431] Trial 4 finished with value: 90335.8984375 and parameters: {'n_pool_kernel_size': [4, 4, 4], 'n_freq_downsample': [24, 12, 1], 'learning_rate': 0.078206554302666, 'scaler_type': 'robust', 'max_steps': 1400.0, 'batch_size': 128, 'windows_batch_size': 1024, 'random_seed': 18, 'input_size': 120, 'step_size': 1}. Best is trial 0 with value: 3942.71630859375.
[rank: 0] Seed set to 20
GPU available: True (cuda), used: True
TPU available: False, using: 0 TPU cores
HPU available: False, using: 0 HPUs
LOCAL_RANK: 0 - CUDA_VISIBLE_DEVICES: [0,1,2,3,4,5,6,7]

  | Name         | Type          | Params | Mode 
-------------------------------------------------------
0 | loss         | RMSE          | 0      | train
1 | padder_train | ConstantPad1d | 0      | train
2 | scaler       | TemporalNorm  | 0      | train
3 | blocks       | ModuleList    | 2.5 M  | train
-------------------------------------------------------
2.5 M     Trainable params
0         Non-trainable params
2.5 M     Total params
10.022    Total estimated model params size (MB)
34        Modules in train mode
0         Modules in eval mode
SLURM auto-requeueing enabled. Setting signal handlers.
`Trainer.fit` stopped: `max_steps=700.0` reached.
[I 2025-01-14 14:44:12,889] Trial 5 finished with value: 5953.95166015625 and parameters: {'n_pool_kernel_size': [16, 8, 1], 'n_freq_downsample': [1, 1, 1], 'learning_rate': 0.014936921895092964, 'scaler_type': 'robust', 'max_steps': 700.0, 'batch_size': 128, 'windows_batch_size': 1024, 'random_seed': 20, 'input_size': 48, 'step_size': 1}. Best is trial 0 with value: 3942.71630859375.
[rank: 0] Seed set to 19
GPU available: True (cuda), used: True
TPU available: False, using: 0 TPU cores
HPU available: False, using: 0 HPUs
LOCAL_RANK: 0 - CUDA_VISIBLE_DEVICES: [0,1,2,3,4,5,6,7]

  | Name         | Type          | Params | Mode 
-------------------------------------------------------
0 | loss         | RMSE          | 0      | train
1 | padder_train | ConstantPad1d | 0      | train
2 | scaler       | TemporalNorm  | 0      | train
3 | blocks       | ModuleList    | 2.6 M  | train
-------------------------------------------------------
2.6 M     Trainable params
0         Non-trainable params
2.6 M     Total params
10.547    Total estimated model params size (MB)
34        Modules in train mode
0         Modules in eval mode
SLURM auto-requeueing enabled. Setting signal handlers.
`Trainer.fit` stopped: `max_steps=1100.0` reached.
[I 2025-01-14 14:44:32,826] Trial 6 finished with value: 3089.177001953125 and parameters: {'n_pool_kernel_size': [16, 8, 1], 'n_freq_downsample': [168, 24, 1], 'learning_rate': 0.00024277147899982537, 'scaler_type': 'robust', 'max_steps': 1100.0, 'batch_size': 128, 'windows_batch_size': 512, 'random_seed': 19, 'input_size': 120, 'step_size': 24}. Best is trial 6 with value: 3089.177001953125.
[rank: 0] Seed set to 15
GPU available: True (cuda), used: True
TPU available: False, using: 0 TPU cores
HPU available: False, using: 0 HPUs
LOCAL_RANK: 0 - CUDA_VISIBLE_DEVICES: [0,1,2,3,4,5,6,7]

  | Name         | Type          | Params | Mode 
-------------------------------------------------------
0 | loss         | RMSE          | 0      | train
1 | padder_train | ConstantPad1d | 0      | train
2 | scaler       | TemporalNorm  | 0      | train
3 | blocks       | ModuleList    | 2.6 M  | train
-------------------------------------------------------
2.6 M     Trainable params
0         Non-trainable params
2.6 M     Total params
10.401    Total estimated model params size (MB)
34        Modules in train mode
0         Modules in eval mode
SLURM auto-requeueing enabled. Setting signal handlers.
`Trainer.fit` stopped: `max_steps=800.0` reached.
[I 2025-01-14 14:44:47,243] Trial 7 finished with value: 2148.153076171875 and parameters: {'n_pool_kernel_size': [2, 2, 2], 'n_freq_downsample': [168, 24, 1], 'learning_rate': 0.0007166990275225923, 'scaler_type': 'standard', 'max_steps': 800.0, 'batch_size': 128, 'windows_batch_size': 1024, 'random_seed': 15, 'input_size': 96, 'step_size': 24}. Best is trial 7 with value: 2148.153076171875.
[rank: 0] Seed set to 9
GPU available: True (cuda), used: True
TPU available: False, using: 0 TPU cores
HPU available: False, using: 0 HPUs
LOCAL_RANK: 0 - CUDA_VISIBLE_DEVICES: [0,1,2,3,4,5,6,7]

  | Name         | Type          | Params | Mode 
-------------------------------------------------------
0 | loss         | RMSE          | 0      | train
1 | padder_train | ConstantPad1d | 0      | train
2 | scaler       | TemporalNorm  | 0      | train
3 | blocks       | ModuleList    | 2.5 M  | train
-------------------------------------------------------
2.5 M     Trainable params
0         Non-trainable params
2.5 M     Total params
9.817     Total estimated model params size (MB)
34        Modules in train mode
0         Modules in eval mode
SLURM auto-requeueing enabled. Setting signal handlers.
`Trainer.fit` stopped: `max_steps=1200.0` reached.
[I 2025-01-14 14:45:08,114] Trial 8 finished with value: 3082.483154296875 and parameters: {'n_pool_kernel_size': [16, 8, 1], 'n_freq_downsample': [1, 1, 1], 'learning_rate': 0.0010168646628005247, 'scaler_type': None, 'max_steps': 1200.0, 'batch_size': 256, 'windows_batch_size': 512, 'random_seed': 9, 'input_size': 24, 'step_size': 24}. Best is trial 7 with value: 2148.153076171875.
[rank: 0] Seed set to 11
GPU available: True (cuda), used: True
TPU available: False, using: 0 TPU cores
HPU available: False, using: 0 HPUs
LOCAL_RANK: 0 - CUDA_VISIBLE_DEVICES: [0,1,2,3,4,5,6,7]

  | Name         | Type          | Params | Mode 
-------------------------------------------------------
0 | loss         | RMSE          | 0      | train
1 | padder_train | ConstantPad1d | 0      | train
2 | scaler       | TemporalNorm  | 0      | train
3 | blocks       | ModuleList    | 2.7 M  | train
-------------------------------------------------------
2.7 M     Trainable params
0         Non-trainable params
2.7 M     Total params
10.749    Total estimated model params size (MB)
34        Modules in train mode
0         Modules in eval mode
SLURM auto-requeueing enabled. Setting signal handlers.
`Trainer.fit` stopped: `max_steps=1300.0` reached.
[I 2025-01-14 14:45:30,504] Trial 9 finished with value: 2831.809814453125 and parameters: {'n_pool_kernel_size': [2, 2, 1], 'n_freq_downsample': [60, 8, 1], 'learning_rate': 0.0002545584632608242, 'scaler_type': None, 'max_steps': 1300.0, 'batch_size': 256, 'windows_batch_size': 256, 'random_seed': 11, 'input_size': 120, 'step_size': 24}. Best is trial 7 with value: 2148.153076171875.
[rank: 0] Seed set to 1
GPU available: True (cuda), used: True
TPU available: False, using: 0 TPU cores
HPU available: False, using: 0 HPUs
LOCAL_RANK: 0 - CUDA_VISIBLE_DEVICES: [0,1,2,3,4,5,6,7]

  | Name         | Type          | Params | Mode 
-------------------------------------------------------
0 | loss         | RMSE          | 0      | train
1 | padder_train | ConstantPad1d | 0      | train
2 | scaler       | TemporalNorm  | 0      | train
3 | blocks       | ModuleList    | 2.6 M  | train
-------------------------------------------------------
2.6 M     Trainable params
0         Non-trainable params
2.6 M     Total params
10.401    Total estimated model params size (MB)
34        Modules in train mode
0         Modules in eval mode
SLURM auto-requeueing enabled. Setting signal handlers.
`Trainer.fit` stopped: `max_steps=500.0` reached.
[I 2025-01-14 14:45:39,571] Trial 10 finished with value: 2265.07470703125 and parameters: {'n_pool_kernel_size': [2, 2, 2], 'n_freq_downsample': [180, 60, 1], 'learning_rate': 0.003686741631948496, 'scaler_type': 'standard', 'max_steps': 500.0, 'batch_size': 64, 'windows_batch_size': 1024, 'random_seed': 1, 'input_size': 96, 'step_size': 24}. Best is trial 7 with value: 2148.153076171875.
[rank: 0] Seed set to 2
GPU available: True (cuda), used: True
TPU available: False, using: 0 TPU cores
HPU available: False, using: 0 HPUs
LOCAL_RANK: 0 - CUDA_VISIBLE_DEVICES: [0,1,2,3,4,5,6,7]

  | Name         | Type          | Params | Mode 
-------------------------------------------------------
0 | loss         | RMSE          | 0      | train
1 | padder_train | ConstantPad1d | 0      | train
2 | scaler       | TemporalNorm  | 0      | train
3 | blocks       | ModuleList    | 2.6 M  | train
-------------------------------------------------------
2.6 M     Trainable params
0         Non-trainable params
2.6 M     Total params
10.401    Total estimated model params size (MB)
34        Modules in train mode
0         Modules in eval mode
SLURM auto-requeueing enabled. Setting signal handlers.
`Trainer.fit` stopped: `max_steps=500.0` reached.
[I 2025-01-14 14:45:48,594] Trial 11 finished with value: 2571.84912109375 and parameters: {'n_pool_kernel_size': [2, 2, 2], 'n_freq_downsample': [180, 60, 1], 'learning_rate': 0.004314832727774657, 'scaler_type': 'standard', 'max_steps': 500.0, 'batch_size': 64, 'windows_batch_size': 1024, 'random_seed': 2, 'input_size': 96, 'step_size': 24}. Best is trial 7 with value: 2148.153076171875.
[rank: 0] Seed set to 14
GPU available: True (cuda), used: True
TPU available: False, using: 0 TPU cores
HPU available: False, using: 0 HPUs
LOCAL_RANK: 0 - CUDA_VISIBLE_DEVICES: [0,1,2,3,4,5,6,7]

  | Name         | Type          | Params | Mode 
-------------------------------------------------------
0 | loss         | RMSE          | 0      | train
1 | padder_train | ConstantPad1d | 0      | train
2 | scaler       | TemporalNorm  | 0      | train
3 | blocks       | ModuleList    | 2.6 M  | train
-------------------------------------------------------
2.6 M     Trainable params
0         Non-trainable params
2.6 M     Total params
10.401    Total estimated model params size (MB)
34        Modules in train mode
0         Modules in eval mode
SLURM auto-requeueing enabled. Setting signal handlers.
`Trainer.fit` stopped: `max_steps=500.0` reached.
[I 2025-01-14 14:45:57,721] Trial 12 finished with value: 2710.46826171875 and parameters: {'n_pool_kernel_size': [2, 2, 2], 'n_freq_downsample': [180, 60, 1], 'learning_rate': 0.0010561264223307185, 'scaler_type': 'standard', 'max_steps': 500.0, 'batch_size': 64, 'windows_batch_size': 1024, 'random_seed': 14, 'input_size': 96, 'step_size': 24}. Best is trial 7 with value: 2148.153076171875.
[rank: 0] Seed set to 15
GPU available: True (cuda), used: True
TPU available: False, using: 0 TPU cores
HPU available: False, using: 0 HPUs
LOCAL_RANK: 0 - CUDA_VISIBLE_DEVICES: [0,1,2,3,4,5,6,7]

  | Name         | Type          | Params | Mode 
-------------------------------------------------------
0 | loss         | RMSE          | 0      | train
1 | padder_train | ConstantPad1d | 0      | train
2 | scaler       | TemporalNorm  | 0      | train
3 | blocks       | ModuleList    | 2.6 M  | train
-------------------------------------------------------
2.6 M     Trainable params
0         Non-trainable params
2.6 M     Total params
10.401    Total estimated model params size (MB)
34        Modules in train mode
0         Modules in eval mode
SLURM auto-requeueing enabled. Setting signal handlers.
`Trainer.fit` stopped: `max_steps=700.0` reached.
[I 2025-01-14 14:46:10,231] Trial 13 finished with value: 2418.031494140625 and parameters: {'n_pool_kernel_size': [2, 2, 2], 'n_freq_downsample': [180, 60, 1], 'learning_rate': 0.004462551446224371, 'scaler_type': 'standard', 'max_steps': 700.0, 'batch_size': 32, 'windows_batch_size': 1024, 'random_seed': 15, 'input_size': 96, 'step_size': 24}. Best is trial 7 with value: 2148.153076171875.
[rank: 0] Seed set to 8
GPU available: True (cuda), used: True
TPU available: False, using: 0 TPU cores
HPU available: False, using: 0 HPUs
LOCAL_RANK: 0 - CUDA_VISIBLE_DEVICES: [0,1,2,3,4,5,6,7]

  | Name         | Type          | Params | Mode 
-------------------------------------------------------
0 | loss         | RMSE          | 0      | train
1 | padder_train | ConstantPad1d | 0      | train
2 | scaler       | TemporalNorm  | 0      | train
3 | blocks       | ModuleList    | 2.5 M  | train
-------------------------------------------------------
2.5 M     Trainable params
0         Non-trainable params
2.5 M     Total params
10.161    Total estimated model params size (MB)
34        Modules in train mode
0         Modules in eval mode
SLURM auto-requeueing enabled. Setting signal handlers.
`Trainer.fit` stopped: `max_steps=700.0` reached.
[I 2025-01-14 14:46:22,590] Trial 14 finished with value: 3874.6318359375 and parameters: {'n_pool_kernel_size': [8, 4, 1], 'n_freq_downsample': [168, 24, 1], 'learning_rate': 0.00010574212619035922, 'scaler_type': 'standard', 'max_steps': 700.0, 'batch_size': 128, 'windows_batch_size': 128, 'random_seed': 8, 'input_size': 72, 'step_size': 24}. Best is trial 7 with value: 2148.153076171875.
[rank: 0] Seed set to 1
GPU available: True (cuda), used: True
TPU available: False, using: 0 TPU cores
HPU available: False, using: 0 HPUs
LOCAL_RANK: 0 - CUDA_VISIBLE_DEVICES: [0,1,2,3,4,5,6,7]

  | Name         | Type          | Params | Mode 
-------------------------------------------------------
0 | loss         | RMSE          | 0      | train
1 | padder_train | ConstantPad1d | 0      | train
2 | scaler       | TemporalNorm  | 0      | train
3 | blocks       | ModuleList    | 2.6 M  | train
-------------------------------------------------------
2.6 M     Trainable params
0         Non-trainable params
2.6 M     Total params
10.403    Total estimated model params size (MB)
34        Modules in train mode
0         Modules in eval mode
SLURM auto-requeueing enabled. Setting signal handlers.
`Trainer.fit` stopped: `max_steps=800.0` reached.
